Data da Pesquisa,Video ID,Title,Channel Title,Published At,Description,Tags,Channel ID,View Count,Like Count,Dislike Count,Comment Count,Region Restriction,Relevant Topics,Live Streaming Details
13/05/2024,WYhYJHba0_I,Stealing Thalapathy VIJAY&#39;s CAR in GTA 5 (mods)..! GTA 5 Tamil Gameplay,Sharp Tamil Gaming,2023-06-03T10:46:47Z,gta5 #tamil #vijay In this video I am Stealing TAMIL ACTORS CARS in GTA 5. Hope you guys like this series Stealing TAMIL ...,[],UCjvNWB4Zw5AeOxDKP7WM9Ng,653709,22252,0,1908,{},[],{}
13/05/2024,AzP22cDSo-A,Fortnite Chapter 4 Season 3 WILDS Gameplay Launch Trailer,Fortnite,2023-06-09T06:00:07Z,"The WILDS await in Fortnite Battle Royale Chapter 4 Season 3: The center of the Island has collapsed, revealing a vast, hidden ...",[],UClG8odDC8TS6Zpqk9CGVQiQ,9010659,79415,0,6044,{},[],{}
13/05/2024,iMtlHsSPZI8,"SEER in Season 21 Abilities 25 KILLS and 5,800 Damage Apex Legends Gameplay",hv apex,2024-05-12T16:00:36Z,25 Kills Bomb and 5000 + Damage With Seer in Season 21! Lean-Batist Channel: https://www.youtube.com/@Lean-Batist ...,[],UCVeowp6qXr_4g_JTsAsWvcQ,8063,257,0,20,{},[],{}
13/05/2024,PImmK6WU8SI,The Last of Us 2 PS5 Aggressive &amp; Stealth Gameplay - HILLCREST ( GROUNDED / NO DAMAGE ) | 4K/60FPS .,GamerANH,2023-03-04T13:48:40Z,"The Last of Us Part 2 | PS5 Gameplay | 4k/60FPS . Difficulty : ( Grounded+ ) Look Sensitivity : 6 ----- Aiming Sensitivity : 8 , All HUD ...",[],UCynAYvsNb3_OMGJx8fBEMHw,4362990,30029,0,956,{},[],{}
13/05/2024,vql05Oo5GEE,WARZONE 2.0 IMMERSIVE SOLO GAMEPLAY! (No Commentary),NoAnnoyingCommentary,2023-01-12T11:58:27Z,WARZONE 2.0 IMMERSIVE SOLO GAMEPLAY! (No Commentary) #nocommentary #callofduty #warzone2.,[],UCxeGDA6ryJktEsCbMSeGpIA,3637050,29415,0,573,{},[],{}
13/05/2024,p8IAP3nxGuU,Aston Martin DB11 | Forza Horizon 4  (Steering Wheel Gameplay) | g29,SRT Style,2022-06-26T03:33:47Z,Aston Martin DB11-2017 | Forza Horizon 4 (Steering Wheel Gameplay) | g29 #steeringwheel #astonmartin #srtstyle ...,[],UCrI0Z03P4wy3KFUqvArmkYA,560518,11,0,0,{},[],{}
13/05/2024,Rs2vPjVmn0I,"Sandwich Runner - Gameplay Walkthrough - All Levels (IOS, Android)",night gaming,2022-01-07T02:47:27Z,"Pick up ingredients on the way to goal, how high will it get? Sandwich will be eaten on goal and person who eat it reacts ...",[],UCY5m31VNt7Em_rldwmZAkQA,15205298,20825,0,220,{},[],{}
13/05/2024,5nId-Glx_VI,TAPATAP 1V4 CLUTCH IN TOURNAMENT | 11KILLS GAMEPLAY | BGMI,JONATHAN GAMING,2021-12-22T10:30:14Z,"If you liked the Video don't forget to Like, Share and Subscribe. Hey Guys, Welcome to my Youtube Channel, I'm Jonathan Amaral ...",[],UCNoiWmvkDUL0q-6ECxNFH0Q,5826393,351690,0,4289,{},[],{}
13/05/2024,SjDMwsbaSd8,S.T.A.L.K.E.R. 2: Heart of Chernobyl — Gameplay Trailer,Xbox,2021-06-13T17:13:53Z,"From epic cutscenes and underground labs to open-world fields, here is the first look at the gameplay of S.T.A.L.K.E.R. 2: Heart of ...",[],UCjBp_7RuDBUYbd1LegWEJ8g,3715830,156402,0,8891,{},[],{}
13/05/2024,5mmfqZzoAm8,Gran Turismo 7 - Part 1 - The Beginning (PS5 4K Gameplay),TmarTn2,2022-03-03T17:03:03Z,Finally! A new racing game for PS5... Gran Turismo 7 Playlist: ...,[],UC36MGPfPwOWafAXauiV4LdA,1597431,19527,0,794,{},[],{}
13/05/2024,ZfGTZhnVIa8,Scary Teacher 3D Stupid Cupid - Gameplay Walkthrough Part 12 - Let&#39;s Play Scary Teacher 3D!!,Cherry Pop Productions,2021-02-23T14:00:07Z,Scary Teacher 3D Stupid Cupid - Gameplay Walkthrough Part 12 - Let's Play Scary Teacher 3D!! Let's play Scary Teacher 3D!,[],UCSnNUFvvfLRmVVytvF0EYDQ,5027450,52159,0,2877,{},[],{}
13/05/2024,YRwehYov90k,🎮 NEW UPDATE! 🌱 Colorful Spring in My Talking Tom Friends (Gameplay),Talking Tom,2021-04-01T13:00:30Z,Spring has arrived in My Talking Tom Friends! ☀️     Join your favorite friends and get ready for all-new features and fun in ...,[],UCm3hAp1m1xlAz0ve_EKAo4g,6245822,10413,0,0,{},[],{}
13/05/2024,jCrySbhNyEY,103 Kill Solo Vs Squads Wins Full Gameplay (Fortnite Season 2 Ps4 Controller),KingJoe83,2024-05-13T13:45:01Z,103 Kill Solo Vs Squads Wins Full Gameplay (Fortnite Season 2 Ps4 Controller) #Fortnite #season2 #SoloVsSquads If You Did ...,[],UCEe2aqK4fgDYTOjkZvTvang,6986,230,0,21,{},[],{}
13/05/2024,86Gl9W8PQEI,PJ Masks: Heroes of the Night - Gameplay Walkthrough LV 6 - FHD 60 fps,PawPawGo,2021-11-23T01:44:16Z,"Who goes into the night to save the day? You do! Get your PJs on and become Catboy, Owlette, and Gekko in the most exciting PJ ...",[],UCjkBNfVM-XUbNxxf2VDyVpQ,1182235,1072,0,0,{},[],{}
13/05/2024,pBvezl-975I,Stray (PS5) 4K 60FPS HDR Gameplay - (Full Game),FA GAMEZ,2022-07-20T12:00:08Z,Stray (PS5) 4K 60FPS HDR Gameplay - (Full Game) Stray is a 2022 adventure game developed by BlueTwelve Studio and ...,[],UCNerFmYc9oxCBqrL0mv_8ug,3686236,20130,0,590,{},[],{}
13/05/2024,_qqf27WN5Vk,Riders Republic - PS5 Gameplay | 4K 60FPS,Ozone,2021-10-22T13:03:51Z,Thank You For Watching! Support if You Enjoyed: https://bit.ly/SubscribeToOzone Platform: PlayStation 5 Control Mode: Trickster ...,[],UC1w4L6gRAkUZx9pP4-MUy5Q,10940572,99631,0,1795,{},[],{}
13/05/2024,EB0GNm6GeeA,FNF Character Test | gameplay VS playground,GameTime,2021-12-29T06:29:38Z,In this video you will see a test of 6 characters that is compared to the gameplay for Friday Night Funkin' in playground mode with ...,[],UCzo1VsTCT5fk3x8lXHOTTWg,10221700,117987,0,1676,{},[],{}
13/05/2024,fgy4WZ9ta7E,Skull and Bones | Gameplay Overview Trailer,Ubisoft,2022-07-07T18:15:02Z,"Skull and Bones will be available November 8 on PlayStation 5, Xbox Series X|S, Stadia, Luna, Epic Games Store, and Ubisoft ...",[],UC0KU8F9jJqSLS11LRXvFWmg,2494916,29631,0,7808,{},[],{}
13/05/2024,hjAXuTuR4r0,Scary Teacher 3D CHAPTER 3 - Gameplay Walkthrough Part 14 - Let&#39;s Play Scary Teacher 3D!!!,Cherry Pop Productions,2021-03-04T14:00:28Z,Scary Teacher 3D CHAPTER 3 - Gameplay Walkthrough Part 14 - Let's Play Scary Teacher 3D!!! Let's play Scary Teacher 3D!,[],UCSnNUFvvfLRmVVytvF0EYDQ,3470510,36764,0,1931,{},[],{}
13/05/2024,nJW5KleY8GE,"📌 Parasite Cleaner Gameplay iOS,Android Walkthrough Pro MAX LEVELS Game Mobile Top Free 203VZIUR",Grape Gaming,2022-09-30T14:52:08Z,ParasiteCleaner#EarwaxClinic#MaxLevel Parasite Cleaner Gameplay iOS ...,[],UCap1kqxh2Ufijd-vWZuarHw,8702216,37732,0,154,{},[],{}
13/05/2024,QhS5a85d3Zc,⁴ᴷ⁶⁰ GTA 6 PS5 Graphics!? Heist &amp; Police Chase Action Gameplay! Ray Tracing Graphics / GTA V Mod,INTER,2022-07-13T16:00:27Z,GTA 6 Graphics - The Betta Bank Heist & Police Chase! Get My ReShade Presets here: https://www.patreon.com/intergta GTA 5 ...,[],UCHa0jpbaRolbOOCAMhP54pQ,7194237,61730,0,2030,{},[],{}
13/05/2024,d_oMtBob1OI,"Sandwich Runner - Gameplay Walkthrough - All Levels (IOS, Android)",night gaming,2022-01-14T16:20:18Z,"Pick up ingredients on the way to goal, how high will it get? Sandwich will be eaten on goal and person who eat it reacts ...",[],UCY5m31VNt7Em_rldwmZAkQA,14371441,26166,0,360,{},[],{}
13/05/2024,rsAVILzhEJw,MICHAEL LOVE NEVER END |GTA V #150 GAMEPLAY |TECHNO GAMERZ GTA V 150,Bhugya Gaming,2022-02-22T05:04:39Z,,[],UCi0YpfZSfyLBZDTZ0G4mqWA,4526027,105963,0,221,{},[],{}
13/05/2024,QE9NhN3nnZ0,(PS5) Blair Witch - THIS GAME Is SCARY | ULTRA Realistic Gameplay [4K 60FPS HDR],Champs Network,2022-05-25T16:45:00Z,(PS5) Blair Witch - THIS GAME IS SCARY | ULTRA Realistic Gameplay [4K 60FPS HDR] Thanks For Watching... All the video was ...,[],UCRU9vwwARx8jEACqNpi_KFA,1826172,15029,0,437,{},[],{}
13/05/2024,gMUKg8F0kbM,CALL OF DUTY: WARZONE 2 RANGER SNIPER GAMEPLAY! (NO COMMENTARY),NoAnnoyingCommentary,2023-05-01T11:30:24Z,CALL OF DUTY: WARZONE 2 RANGER SNIPER GAMEPLAY! (NO COMMENTARY) #callofduty #nocommentary #warzone2.,[],UCxeGDA6ryJktEsCbMSeGpIA,1668770,8351,0,143,{},[],{}
13/05/2024,8-N5fYjhQO8,Pragmata - Official Gameplay Teaser Trailer | Capcom Showcase 2023,IGN,2023-06-12T22:16:37Z,"We finally get our first tease of what Pragmata will actually look like, along with an apology for the game's further delay.",[],UCKy1dAqELo0zrOtPkf0eTMw,675979,22793,0,1505,{},[],{}
13/05/2024,agsTc8Gq5EY,ANTHILL vs FLY SWATTER | Kick The Buddy | Bananos Gameplay,Bananos Gameplay,2020-10-26T14:31:07Z,SUBSCRIBE - https://lc.to/p7HKsg The famous Kick the Buddy is a super-duper physics simulation game. Simple gameplay ...,[],UC9zU0JnKrbjiNe0-r6oba9g,79545263,248300,0,2322,{},[],{}
13/05/2024,Z4PcK_UA-pU,Avengers Assemble - Marvel&#39;s Avengers Gameplay #1,Fail Game 2.0,2021-10-10T06:45:01Z,Marvel's Avengers Gameplay on PS5 | FOLLOW ME ON INSTAGRAM - https://www.instagram.com/failgamearmaan/ DON'T ...,[],UCBDr84m_kcMea-oEQ0C6ckA,2152461,59508,0,1417,{},[],{}
13/05/2024,Sykx_cmTYXQ,Snowdrop｜Realistic Stealth Gameplay｜Ghost Recon Breakpoint｜4K,DraKulis Cinematic Gaming,2022-05-12T14:08:25Z,tacticalgaming #stealthgaming #ghostrecon.,[],UCKzn9o7o024r9yQBVV9Wijw,4068995,39003,0,786,{},[],{}
13/05/2024,k1VW8znw7Uc,Counter-Strike: Global Offensive (2023) - Gameplay (PC UHD) [4K60FPS],Throneful,2023-02-04T01:00:17Z,Counter-Strike: Global Offensive (2023) - Gameplay (PC UHD) [4K60FPS] Steam ...,[],UCIw5rbXUrtk31t20Ap5817w,531237,3743,0,128,{},[],{}
13/05/2024,QiSVpxFvDew,O NOVO Jogo do GATO! - Little Kitty Big City - O Início (Gameplay PT-BR Português),Hagazo,2024-05-10T16:31:57Z,"Conferimos Little Kitty Big City, o NOVO Jogo do Gato! Lançado no dia 9 de maio para Xbox Series, Xbox One, Nintendo Switch e ...",[],UC0thds55Zx_icfe2QyO5eIA,17476,1350,0,58,{},[],{}
13/05/2024,BO8lX3hDU30,Cyberpunk 2077 — Official Gameplay Trailer,Cyberpunk 2077,2020-11-19T17:30:27Z,"In this world, consumed by neverending conflict, sometimes only an outsider will get the job done. And that's you. Cyberpunk 2077 ...",[],UC4zyoIAzmdsgpDZQfO1-lSA,33818081,452382,0,40187,{},[],{}
13/05/2024,N4nmiY8NhPk,Pose Puzzle #gaming #tiktok #artgame #gameplay #gamer,Kennedy Souza,2024-05-12T11:00:13Z,,[],UCTdWMt-87H0J1hcx2QBBpRg,13004,290,0,0,{},[],{}
13/05/2024,cgDlmvU2sA4,FIFA 23 Gameplay (PC UHD) [4K60FPS],Throneful,2022-09-27T11:00:31Z,FIFA 23 Gameplay (PC UHD) [4K60FPS] Store - https://www.ea.com/games/fifa/fifa-23/buy. Gaming PC Specs ▻CPU AMD Ryzen ...,[],UCIw5rbXUrtk31t20Ap5817w,730964,3995,0,213,{},[],{}
13/05/2024,bJA5Hzh5pI0,SOLO STEALTH SNIPER! - Sniper Ghost Warrior Contracts 2 Gameplay,Tomographic,2021-06-07T14:00:46Z,Thanks to CI Games for sponsoring this video. Check out the game on Steam! https://sgwc2.com/TomographicLaunchYT My first ...,[],UCOt5hVyS2-nbcJ3_FP41Ajg,2365307,39900,0,818,{},[],{}
14/05/2024,YGK-izMClzg,Checking Out This Brand New Realistic FPS - Gray Zone Warfare Gameplay Part 4,Brian Menard,2024-05-14T22:30:07Z,Gray Zone Warfare is an intense tactical FPS emphasizing realism. Join a Private Military Company to explore a vast MMO open ...,[],UC3t5CYZMhhOl0_8ATxCBrkg,1221,442,0,0,{},[],{}
14/05/2024,Y0lZIXJOCU8,STELLAR BLADE PS5 Walkthrough Gameplay Part 11 - ORBIT ELEVATOR (FULL GAME),theRadBrad,2024-05-14T14:00:23Z,"PS5 Stellar Blade Walkthrough Gameplay Part 11 includes a Full Game Review, Full Gameplay and Campaign Mission 11 of ...",[],UCpqXJOEqGS-TCnazcHCo0rA,19677,1609,0,94,{},[],{}
14/05/2024,c1gIeQukLdo,[HCSSF] Diablo 4 Season 4 Necromancer Blast,Raxxanterax,2024-05-14T14:59:23Z,"I'm Raxxanterax and I make Build Guides, Leveling Guides, Tier Lists and More for Diablo 4, Last Epoch, Path of Exile and Path of ...",[],UCs20qCPrd1AXRviSTdVCoAg,126310,2282,0,0,{},[],{}
14/05/2024,kgppJX0G--E,(PS5) THE PACIFIC WAR 1943 | Realistic Immersive ULTRA Graphics Gameplay [4K 60FPS HDR] Call of Duty,Champs Network,2024-01-12T13:03:57Z,(PS5) THE PACIFIC WAR 1943 | Realistic Immersive ULTRA Graphics Gameplay [4K 60FPS HDR] Call of Duty Thanks For ...,[],UCRU9vwwARx8jEACqNpi_KFA,14748765,105660,0,4117,{},[],{}
14/05/2024,j8LHFJChi_g,(PS5) Mexican Cartel Raid | Realistic IMMERSIVE ULTRA Graphics Gameplay [4K 60FPS HDR] Call of Duty,Champs Network,2024-04-16T18:06:09Z,(PS5) Mexican Cartel Raid | Realistic IMMERSIVE ULTRA Graphics Gameplay [4K 60FPS HDR] Call of Duty Thanks For Watching ...,[],UCRU9vwwARx8jEACqNpi_KFA,1908762,14957,0,394,{},[],{}
14/05/2024,zG4xRd59lx4,Diablo 4 Season 4 Livestream Gameplay,Rhykker,2024-05-14T16:15:59Z,Diablo 4: Season 4 Livestream Gameplay Join this channel to get access to perks: ...,[],UCRl31PWkfF0a3j3hiDRaCGA,34435,651,0,0,{},[],{}
14/05/2024,3dqqj7ThetM,Overwatch 2 | Porsche | Gameplay Trailer,PlayOverwatch,2024-05-13T16:00:02Z,Race into battle with the Overwatch 2 | Porsche D.Va and Pharah Porsche skins. Inspired by the All-Electric 2025 Porsche Macan ...,[],UClOf1XXinvZsy4wKPAkro2A,174351,8058,0,1152,{},[],{}
14/05/2024,F9zosNF1WIA,BATTLE OF YORK™ LOOKS ABSOLUTELY AMAZING | Ultra Realistic Graphics Gameplay [4K 60FPS] Son of Rome,GameV,2024-03-05T15:43:25Z,BATTLE OF YORK™ LOOKS ABSOLUTELY AMAZING | Ultra Realistic Graphics Gameplay [4K 60FPS] Son of Rome Thanks for ...,[],UCAvRtPIFFbnfLHswfRS6zhQ,2014291,19684,0,889,{},[],{}
14/05/2024,gDURzQgd3CM,Braid Anniversary Edition - Español #1 - Impresiones - Juego Completo - Obra Maestra - PS5 Gameplay,L0k0hGaming,2024-05-14T21:20:52Z,SUSCRÍBETE: http://goo.gl/2nA4f5 #BraidAnniversaryEdition #Braid #Ps5 Aquí os dejo mi Gameplay de Braid Anniversary ...,[],UCHybEMsTlz5LLR7MxOOfGjw,4470,356,0,3,{},[],{}
14/05/2024,jgqJ30x79cY,My First Gaming Experience With 120FPS 😑❌ | 90 FPS ✅ | Pubg Mobile,FM Radio Gaming,2024-05-14T16:23:28Z,"Like, Subscribe, Comment & Don't Forget To Press The Bell Icon ──── Follow On Social Media ──── Instagram ...",[],UCpxc92zk45lM0mko0XIGiJg,30955,4031,0,115,{},[],{}
14/05/2024,YT79QYy2fng,PINE HARBOR Full Gameplay Walkthrough Part 1 &amp; ENDING (FULL GAME),theRadBrad,2024-05-08T20:00:18Z,"Pine Harbor Walkthrough Gameplay Part 1 includes a Full Game Review, Full Gameplay and the Ending for PC with PlayStation 5 ...",[],UCpqXJOEqGS-TCnazcHCo0rA,218438,6789,0,282,{},[],{}
14/05/2024,2wC8fqSivk4,How Female vs Male Climb Ladder (Stellar Blade vs Bloodborne),YouTuBruh,2024-04-08T06:47:01Z,I just found Stellar Blade Ladder Descent is so Cool and Stylish then I remember the funny Bloodborne clip on YouTube.,[],UCGSnO3hxveFSu_I-ADgGDLw,6101447,479268,0,3648,{},[],{}
14/05/2024,ExiNCu0W1oI,"Vecna gameplay, mori, addons, new map - DbD x DnD PTB",ZubatLEL,2024-05-14T19:01:44Z,"Watch on Twitch: https://www.twitch.tv/zubatlel Join Discord: https://www.discord.gg/zubatlel 00:00 - First game, against bots 11:33 ...",[],UCv8TjL-bZvShlWzWxVHhG3Q,11809,459,0,88,{},[],{}
14/05/2024,JnIprXJMvN4,FALLOUT 4 Gameplay Walkthrough FULL GAME [4K 60FPS PC ULTRA] - No Commentary,MKIceAndFire,2024-05-02T22:34:04Z,Fallout 4 Walkthrough Part 1 and until the last part will include the full Fallout 4 Gameplay on PC. This Fallout 4 Gameplay is ...,[],UC1bwliGvJogr7cWK0nT2Eag,141354,2395,0,117,{},[],{}
14/05/2024,g7Yi1gTxvbM,"Newest Killer &quot;Vecna&quot; Is Scary!! | Mori, Perks and Gameplay",Hens,2024-05-14T18:58:56Z,I stream 5 times a week at https://www.twitch.tv/hens333 Community Discord: https://discord.gg/MfnbrEVkPQ Chapters: 0:00 Intro ...,[],UCI4aITQ3nx1QR_8RxFlPjRQ,16861,865,0,98,{},[],{}
14/05/2024,lgUjO9Uuf0M,"Best mobile games android ios, cool game ever player #shorts #funny #gaming #puzzle #viralshorts",Max Games YT,2023-06-05T11:00:24Z,"Best mobile games android ios, cool game ever player #shorts #funny #gaming #puzzle #viralshorts #funnygame #puzzle ...",[],UCzoXFSRacjcHFRSqxTB6z_A,102934463,0,0,3167,{},[],{}
14/05/2024,O1xixINNd6I,The Casting of Frank Stone | Gameplay Trailer,Dead by Daylight,2024-05-14T16:17:05Z,WISHLIST NOW: https://dbd.game/3GJPqrM The storytelling prowess of Supermassive Games meets the Dead by Daylight ...,[],UCaSgsFdGbwjfdawl3rOXiwQ,160261,9757,0,662,{},[],{}
14/05/2024,NdF1niyfH2E,INDIKA : #1 - O INÍCIO DE GAMEPLAY em PORTUGUÊS PT-BR | 4k 60fps,MaxMRM GAMEPLAY,2024-05-08T14:06:08Z,Compre V Rising na Steam aqui: https://store.steampowered.com/app/1604030/V_Rising/?utm_source=MaxMRM Adicione à lista ...,[],UCJ8GQ_SNb-33m_BluT4TTlw,147939,16279,0,695,{},[],{}
14/05/2024,_p52uJkHZ98,Wow! NEW iPhone 15 PRO MAX GAMEPLAY🔥Pubg Mobile,MUNNO Gaming,2024-05-13T11:58:03Z,Thanks for watching Please subscribe to my channel — 4 FINGER AND GYRO Devıce: Iphone 14 PRO MAX 40KILLS MY NEW ...,[],UCmVzcQ5hXNecXAcbn6y7TEg,40680,1686,0,74,{},[],{}
14/05/2024,Zlk8-Aikd8U,Call of Duty Warzone 3 Solo M4 Gameplay PS5(No Commentary),Marshal No Commentary,2024-05-14T08:30:15Z,Call of Duty Modern Warfare3-Warzone3 Battle Royale Assault Rifles M4 & Striker 9 & MORS Season 3 Solo Win Gameplay (No ...,[],UCU-4n0wHbEhRH2aJfXsqM8A,16371,573,0,65,{},[],{}
14/05/2024,2ETfPfZaWhY,Wow!😍 NEW BEST LOOT GAMEPLAY in MECHA FUSION MODE 🥵 Pubg Mobile,Pubg RICH,2024-05-14T15:01:00Z,,[],UC7B65yvelzj6LI4wcI2_fNQ,39034,2305,0,289,{},[],{}
14/05/2024,v3FRgjIbR1k,24 Kills No Death!! Unstoppable Valir Tanky Build 100% Annoying!! - Build Top 1 Global Valir ~ MLBB,Gameplay Proplayer,2024-05-12T09:35:00Z,valir gameplay pro player valir best one hit build tank 2024 valir top 1 global build valir tersakit 2024. 24 Kills No Death!,[],UCVZAfLep-Ju-zAJsAGSVUNA,44697,1295,0,186,{},[],{}
14/05/2024,P02psAeMeaM,"SILENT HILL, PERO ES HIPERREALISTA *CAPÍTULO 1 COMPLETO* - PINE HARBOR GAMEPLAY ESPAÑOL",GENuINE993,2024-05-13T21:48:09Z,"Juegos y Tarjetas Prepago Más Baratas: https://ene.ba/genuine En este gameplay en español juego a Pine Harbor, un juego de ...",[],UCqIeOJ3gXlkIqv4ntL0X4BQ,40166,3280,0,137,{},[],{}
14/05/2024,5nKpApXuM1g,(PS5) Camouflage Sniping Mission | Realistic Immersive ULTRA Graphics Gameplay[4K60FPSHDR]CallofDuty,Champs Network,2023-05-31T16:00:04Z,(PS5) Tactical Camouflage Sniping | Realistic Immersive ULTRA Graphics Gameplay [4K 60FPS HDR] Call of Duty Thanks For ...,[],UCRU9vwwARx8jEACqNpi_KFA,13114858,62095,0,1223,{},[],{}
14/05/2024,PVxm_XWRtcg,JUEGAZO - NEVER MOURN Gameplay Español,El Escoces gamer,2024-05-13T15:15:02Z,Never Mourn en Steam: https://store.steampowered.com/app/1839820/Never_Mourn/ TEMPEST te regala NEVER MOURN: ...,[],UC15QE9U_c5QZd1qKP57_hMA,10126,528,0,14,{},[],{}
14/05/2024,PRo7uOrNgGg,"DOGGY RUN GAMEPLAY WALKTHROUGH 🐕🥰 | DOG SWEET 😸 | ANDROID, iOS MOBILE | NEW UPDATE #SHORTS GAMES #0🔥",Gameplay Animation,2021-09-17T13:01:52Z,Hello friend . I am glad to welcome you to my channel .I will be happy if you comment and like this video! I ask you to follow all the ...,[],UCPl0VERb7SjjpE0OIxiIIYw,66853351,2419946,0,2531,{},[],{}
14/05/2024,DnGHW9AaYfg,Wow😍BIG DESTRUCTION GAMEPLAY IN APARTMENTS🔥PUBG Mobile,Fatih GAMING,2024-05-13T06:00:05Z,Don't forget to SUBSCRIBE if you are new here! Thanks for watching and for your support!! My Second Channel ...,[],UCZOW4EOIU_jwHhybPh6q0LQ,36350,1469,0,86,{},[],{}
14/05/2024,64J-08ARU1c,"(PS5) HITMAN 3 - Maldives, Haven Island - Cinematic Run [4k 60FPS]",PlayerKai Gaming,2022-06-29T11:31:04Z,"This video will include Maldives, Haven Island ""Trouble in Paradise"" level in Hitman 3 in cinematic stealth run on professional ...",[],UCX5uxW0ASy9so555o9p8V0w,691999,4518,0,103,{},[],{}
14/05/2024,RSQWHK0J5YM,64 Elimination Solo Vs Squads Gameplay Wins (Fortnite Chapter 5 Season 2 PS4 Controller),SENSEI,2024-05-13T16:45:00Z,Fortnite #SoloVsSquads #FortniteChapter5 #Season2 #ad #FortniteController Buy a Controller @ https://nagashock.com & USE ...,[],UC2Loq2qB-wOLikZfrZ2zKbg,26082,596,0,33,{},[],{}
14/05/2024,L7fR6_LUkeA,Best Funny Game Ever Played #shorts #gameplay #games,Tootal Gaming 69,2023-03-15T13:37:00Z,Best Funny Game Ever Played #shorts #gameplay #games #tootalgaming69 #androidgames.,[],UCg_2rtTN4Mk0xQiSUg4VnAg,139855308,0,0,856,{},[],{}
14/05/2024,AieUGe-_nCk,Finger Runner 3D Game - Finger in the Nose #9 #Shorts #Viral #Funny,Oddman Games,2023-05-09T07:00:04Z,SUBSCRIBE for more Funny Videos: https://www.youtube.com/channel/UC0hWgcc02QfOJiSZ24c4uKQ?sub_confirmation=1 ...,[],UC0hWgcc02QfOJiSZ24c4uKQ,49043023,554737,0,458,{},[],{}
14/05/2024,iG9lHwyohws,I BECAME A MILITARY SOLDIER | READY OR NOT GAMEPLAY,Ujjwal,2024-04-28T03:30:14Z,"I BECAME A MILITARY SOLDIER | READY OR NOT GAMEPLAY #readyornot #ujjwal Share, Support, Subscribe!!! Subscribe: ...",[],UCl_vAxZpvbO-PFXdDu7EdHw,4549412,175687,0,8718,{},[],{}
14/05/2024,d7ysZOGsHv0,Gray Zone Warfare : Early Access Gameplay (PC)[2K],Zangado,2024-05-11T13:00:37Z,"Gray Zone Warfare é um jogo de tiro em primeira pessoa tático, intenso e realista. Junte-se a uma empresa militar privada e ...",[],UCuVIWETFdxzwlHEHMbhm2_w,38743,3604,0,157,{},[],{}
14/05/2024,vvbmBGJltbo,🔴 FIRST DAY OF ARENA BREAKOUT GAMEPLAY - DRLUPO,DrLupo,2024-05-14T19:03:14Z,Finally jumping into Arena Breakout! ------------------------ BECOME A MEMBER OF THE STREAM: ...,[],UCNF0LEQ2abMr0PAX3cfkAMg,26917,1533,0,8,{},[],{}
14/05/2024,z2XS_RryJGk,THE LAST OF US 2 PS5 Gameplay 4K 60FPS HDR ULTRA HD (Upgrade Patch),Shirrako,2021-05-20T05:46:31Z,The Last of Us 2 PS5 Gameplay showcasing the game running on PS5 in 4K 60FPS HDR Enhanced Upgrade Patch Full ...,[],UC7eAfUjR9gdIjoaoQaS0W-A,16925829,145425,0,2598,{},[],{}
14/05/2024,Np-vvAnQ7kY,THE CRAZIEST VR TRICKSHOT #Shorts,LSToast,2023-02-02T01:00:14Z,"USE CODE ""LSTOAST"" FOR 10% OFF GAMER SUPPS: https://gamersupps.gg/LSTOAST (learn more about why I drink Gamer ...",[],UCLnTcASkvbFLQI2Jeo50HdA,104385633,1752939,0,2826,{},[],{}
14/05/2024,THCWELGaghE,Against Some Pro Squads in Solo v Squad Gameplay Call of Duty Mobile!,DeepanshuCODYT,2024-05-12T11:30:09Z,Just 15Year Old Boy Play Battle Royale Solo vs Squad.. If You Like His Gameplay Plz.... Share & Subscribe This Channel..,[],UCREW9f8iJklpq4bPQwLEATg,16105,684,0,33,{},[],{}
14/05/2024,_SQrkkfxY-g,AN EPIC FINAL - Top Spin 2K25 Career Mode - Part 9 | PS5 Gameplay,TheApexHound,2024-05-13T17:00:32Z,"We look to get a few new houses and win as many TS500 tournaments as possible, Let's do it!",[],UCgVls4NK7dz95eGULu8XApQ,6645,208,0,34,{},[],{}
14/05/2024,4_UnOs_Ohow,1vs3 🔥 #pubg,ZEMU GAMING,2023-03-15T07:39:51Z,Hello guys how are you today My settings video   https://youtu.be/GafVEf1zpO8 Device iPhone XS Max 5 finger full gyro Please ...,[],UCOayMK9-JkQDTKQGKpLn38A,10989259,541902,0,1432,{},[],{}
14/05/2024,OVJR91ps2ek,Ghost Recon Breakpoint Gameplay,Gameplaysnchill,2023-01-24T03:27:40Z,Subscribe For More Content! :) Social Media Youtube ------------------- https://tinyurl.com/n2aevq5 Tiktok ...,[],UCQJNg0P-W31gcgbsw0JeW7w,1776994,72592,0,346,{},[],{}
14/05/2024,FCO-KAM8oeQ,MAFIA DEFINITIVE EDITION Gameplay #1,Fail Game 2.0,2022-02-13T06:30:05Z,MAFIA 1 REMAKE Gameplay | FOLLOW ME ON INSTAGRAM - https://www.instagram.com/failgamearmaan/ DON'T FORGET TO ...,[],UCBDr84m_kcMea-oEQ0C6ckA,326748,16561,0,617,{},[],{}
14/05/2024,ISyvt8_uc9k,ESTRENO ÉPICO !! ENCUENTRO a SYRINGEON !! | Garten of Banban 7 (Gameplay Español) #1,iTownGamePlay *Terror&Diversión*,2024-05-10T14:00:13Z,"Hazte MIEMBRO y disfruta de muchas ventajas: http://youtube.com/iTownGamePlay/join Gustaa!, super estreno y maratown en el ...",[],UCKmlxQVs0vHtaLldRIQ8lsA,167773,9961,0,494,{},[],{}
14/05/2024,aqpFeWB9pWg,134 Elimination Duo Vs Squads Gameplay Wins Ft. @CycloneFN- (Fortnite Chapter 5 Season 2),SENSEI,2024-05-14T18:15:08Z,Fortnite #SoloVsSquads #FortniteChapter5 #Season2 #ad #FortniteController Buy a Controller @ https://nagashock.com & USE ...,[],UC2Loq2qB-wOLikZfrZ2zKbg,5190,224,0,18,{},[],{}
14/05/2024,CKFyTDanB8A,Fastest YouTuber of pubg mobile history🔥,Fatih GAMING,2024-01-27T12:00:12Z,,[],UCZOW4EOIU_jwHhybPh6q0LQ,1963669,135982,0,691,{},[],{}
14/05/2024,kaiH5RqxYDs,LET&#39;S GO #gameplay #games #gaming #nextbotchasing #game #garrysmod #gmod #nextbots #scp096 #scp,Cupidut,2024-05-12T00:00:18Z,"Terima kasih banyak teman - teman semua yang udah mampir... Tolong support channel ini dengan cara Subscribe, like, share ...",[],UCpipbQyNfuepLlrNtin_NZA,183183,4046,0,16,{},[],{}
14/05/2024,CUccnnyVUgQ,SOLO VS SQUAD IN BGMI BREAKING MY OWN RECORDS | BGMI GAMEPLAY #2,Total Gaming,2023-06-16T13:00:16Z,Instagram: https://www.instagram.com/totalgaming_official/ 🕊️Twitter:- https://twitter.com/total_gaming093 Facebook: ...,[],UC5c9VlYTSvBSCaoMu_GI6gQ,2678045,179968,0,17053,{},[],{}
14/05/2024,1a7eAo2Q-_k,Ultimate Secret Base!! CKN Gaming,CKN Gaming,2021-02-08T04:21:22Z,Checking out the ultimate Secret Base in Minecraft . It is so cool guys . Check it out. Thanks for watching CKN Gaming.,[],UC135_IPK8XOEEdXdtcseR4w,2435808,8188,0,0,{},[],{}
14/05/2024,E3NEgpBaE5Y,Crash Bandicoot: On the Run! Part 2 Full Playthough! Kids Gameplay!,Kaven Adventures,2021-05-21T12:00:13Z,Can We Beat Crash Bandicoot: On the Run! Boss Battles! Noob vs Pro vs Hacker! Part 2! Full PlayThrough! Kids Gameplay!,[],UCnY-_mYoZNcaTAW9SeEWHAg,2870230,2039,0,0,{},[],{}
14/05/2024,Vra8lXGQeGM,Mafia | Realistic Next-Gen Ultra Graphics Gameplay [4K UHD 60FPS] Full Game,HEDGEHOG x,2021-09-01T14:45:01Z,"HEDGEHOG Plays Gameplay Walkthrough With All Part & Ending of Top Most Anticipated, Upcoming & Newly Released Games ...",[],UCiw3IAxa0e2sNUiqzW1hgyQ,4744089,41178,0,1381,{},[],{}
14/05/2024,JVywqFx0GdE,Detroit Become Human - FULL GAME Walkthrough Gameplay No Commentary (Everyone Survives),Gamer Max Channel,2018-06-20T16:38:18Z,This video is a complete full game walkthrough for Detroit Become Human on best ending. This is an instructional video showing ...,[],UCVdg9q21qjYjBnxp8pMGKvw,3814521,57606,0,5536,{},[],{}
14/05/2024,E3NEgpBaE5Y,Crash Bandicoot: On the Run! Part 2 Full Playthough! Kids Gameplay!,Kaven Adventures,2021-05-21T12:00:13Z,Can We Beat Crash Bandicoot: On the Run! Boss Battles! Noob vs Pro vs Hacker! Part 2! Full PlayThrough! Kids Gameplay!,[],UCnY-_mYoZNcaTAW9SeEWHAg,2870230,2039,0,0,{},[],{}
14/05/2024,ISyvt8_uc9k,ESTRENO ÉPICO !! ENCUENTRO a SYRINGEON !! | Garten of Banban 7 (Gameplay Español) #1,iTownGamePlay *Terror&Diversión*,2024-05-10T14:00:13Z,"Hazte MIEMBRO y disfruta de muchas ventajas: http://youtube.com/iTownGamePlay/join Gustaa!, super estreno y maratown en el ...",[],UCKmlxQVs0vHtaLldRIQ8lsA,167773,9961,0,494,{},[],{}
