Data da Pesquisa,Video ID,Title,Channel Title,Published At,Description,Tags,Channel ID,View Count,Like Count,Dislike Count,Comment Count,Region Restriction,Relevant Topics,Live Streaming Details
12/05/2024,CbsJFpa2aw4,VASCO 2 X 1 VITÓRIA - Campeonato Brasileiro - 6ª Rodada - 12/05/2024 - AO VIVO,Tupi Esportes,2024-05-12T18:21:24Z,"FUTEBOL é na TUPI❗ Estádio São Januário - RJ Narração  Luiz Penido Comentários  Dé, o Aranha A TUPI conta tudo ...",[],UC9u7p59wlSaAuBmPevKWo9A,23738,3720,0,0,{},[],{}
12/05/2024,ExxmKU-Wn6w,"PILHADO SURTOU! &quot;COVAAARDE! TITE, VOCÊ É UM...&quot; OLHA essa PISTOLADA após Bolívar 2 x 1 Flamengo!",Jovem Pan Esportes,2024-04-25T02:52:26Z,"PILHADO PISTOLOU! Após o Flamengo de Tite perder para o Bolívar por 2 gols a 1 hoje pela Libertadores, o apresentador do ...",[],UCv-Nx8pSfG_LxbViMz14RWQ,363720,19278,0,2707,{},[],{}
12/05/2024,r6jmeK72f_8,&quot;SÓ PODE ESTAR DE SACANAGEM! A INFORMAÇÃO de hoje é que o Flamengo...&quot; OLHA o que REVOLTOU Pilhado!,Jovem Pan Esportes,2024-05-09T17:25:40Z,"Uma informação de hoje sobre o Flamengo de Tite, que vive crise na Libertadores, revoltou Pilhado ao vivo no Bate-Pronto.",[],UCv-Nx8pSfG_LxbViMz14RWQ,416584,15615,0,1361,{},[],{}
12/05/2024,nHErO4Ft3oE,"&quot;ISSO É UMA MALUQUICE, gente! O Tite tem que ser COBRADO? SIM! Mas...&quot; Mauro Cezar ANALISA Flamengo!",Jovem Pan Esportes,2024-05-03T21:15:01Z,"Tem que ser demitido? Os gritos de ""Fora, Tite"" ecoaram na torcida do Flamengo após a vitória por 1 a 0 sobre o Amazonas com ...",[],UCv-Nx8pSfG_LxbViMz14RWQ,290040,10864,0,618,{},[],{}
12/05/2024,2RVs1yhDLgg,São Paulo VENCE e SE CLASSIFICA às 8ªs da Libertadores; Vini BRILHA na Champions! | BATE-PRONTO,Jovem Pan Esportes,2024-05-09T17:09:16Z,"O Bate-Pronto de hoje falará tudo sobre a vitória do São Paulo por 3 a 1 sobre o Cobresal, ontem de noite, no Chile. O resultado ...",[],UCv-Nx8pSfG_LxbViMz14RWQ,184162,7068,0,119,{},[],{}
12/05/2024,DVaIujjsWWw,Palmeiras e São Paulo VENCEM pela Copa do Brasil; Flamengo e Corinthians JOGAM amanhã! | BATE-PRONTO,Jovem Pan Esportes,2024-05-03T17:11:29Z,"O Bate-Pronto de hoje debaterá as vitórias de Palmeiras e São Paulo, ontem de noite, na Copa do Brasil. O Verdão bateu o ...",[],UCv-Nx8pSfG_LxbViMz14RWQ,167303,6247,0,44,{},[],{}
12/05/2024,bhmgW3PlmbY,"Flamengo VENCE, mas é VAIADO; Tite é XINGADO; Carlos Miguel BRILHA no Corinthians! | BATE-PRONTO",Jovem Pan Esportes,2024-05-02T17:05:49Z,"O Bate-Pronto de hoje falará tudo sobre os jogos de ontem pela Copa do Brasil. No Maracanã, o Flamengo venceu o Amazonas ...",[],UCv-Nx8pSfG_LxbViMz14RWQ,226448,8833,0,85,{},[],{}
12/05/2024,u0ywlRe3ZMs,Flamengo PERDE pro Palestino e CAI para 3º na Libertadores; Corinthians VENCE na Sula! | BATE-PRONTO,Jovem Pan Esportes,2024-05-08T17:11:26Z,O Bate-Pronto de hoje debaterá a situação do futebol brasileiro em meio ao estado de calamidade no Rio Grande do Sul devido ...,[],UCv-Nx8pSfG_LxbViMz14RWQ,307071,13609,0,132,{},[],{}
12/05/2024,tjk9c72cEYA,Pilhado DESTRUIU Flavio Prado? &quot;VOCÊ É PALHAÇO! É BRILHANTE o início do Zubeldía no São Paulo e...&quot;,Jovem Pan Esportes,2024-05-09T15:45:14Z,Flavio Prado e Pilhado tiveram um debate muito quente sobre o São Paulo de Zubeldía após a vitória sobre o Cobresal e a ...,[],UCv-Nx8pSfG_LxbViMz14RWQ,212590,8610,0,1746,{},[],{}
12/05/2024,XLENpHKzK-o,"&quot;EU FALO! Se o Vinicius Júnior não for o MELHOR DO MUNDO caso o Real GANHE a Champions, EU VOU...&quot;",Jovem Pan Esportes,2024-05-09T16:51:13Z,"Vinicius Júnior x Bayern de Munique: o brasileiro do Real Madrid teve skills, melhores momentos e brilhou de novo na semifinal ...",[],UCv-Nx8pSfG_LxbViMz14RWQ,226199,8833,0,979,{},[],{}
12/05/2024,RRTO1rTU8Ec,"&quot;VÃO ME CRITICAR, mas EU FALO: o Endrick TÁ BATENDO MUITO! É DESLEAL!&quot; Faltas no Palmeiras ASSUSTAM!",Jovem Pan Esportes,2024-05-12T22:08:37Z,"Endrick tem cometido faltas violentas e desleais? Hoje teve Palmeiras x Athletico-PR, e entradas do atacante foram criticadas no ...",[],UCv-Nx8pSfG_LxbViMz14RWQ,16058,1287,0,283,{},[],{}
12/05/2024,YlegND4P_Pg,"&quot;É UMA VERGONHA! É INADMISSÍVEL! Cara, o que o Vasco FEZ...&quot; VEXAME, SAÍDA de Ramón Díaz e CRISE!",Jovem Pan Esportes,2024-04-28T23:32:08Z,"Ramón Diaz pediu demissão ou foi demitido? O Vasco foi goleado, levou 4 gols a 0 do Criciúma e, logo após o jogo, anunciou a ...",[],UCv-Nx8pSfG_LxbViMz14RWQ,132026,4943,0,327,{},[],{}
12/05/2024,hcHsc1sDBoY,&quot;CÊ TÁ LOUCO??? EU DUVIDO que FALARIA ISSO pro Gabigol!&quot; DEBATE FERVE sobre o Flamengo de Tite!,Jovem Pan Esportes,2024-04-25T17:11:59Z,"Até Gabigol foi citado! Após a derrota do Flamengo para o Bolíviar na altitude, Tite foi alvo de críticas durante debate no ...",[],UCv-Nx8pSfG_LxbViMz14RWQ,183547,6308,0,498,{},[],{}
12/05/2024,eqIpo3-Gnjc,"&quot;O TITE FUGIU NO AEROPORTO, cara! É UMA VERGONHA! Ele...&quot; Pilhado DETONA ATITUDE no Flamengo!",Jovem Pan Esportes,2024-05-08T16:39:46Z,"Em meio a protestos da torcida do Flamengo, Tite deixou o Aeroporto do Galeão pela porta lateral. A atitude foi detonada por ...",[],UCv-Nx8pSfG_LxbViMz14RWQ,275841,10553,0,1200,{},[],{}
12/05/2024,VWUgFDTRvZg,&quot;É RIDÍCULO! NÃO TEM MAIS DESCULPA! O Flamengo do Tite VIROU UM TIME de...&quot; Pilhado DETONA!,Jovem Pan Esportes,2024-05-02T16:30:06Z,Pilhado detonou o Flamengo de Tite após a vitória por 1 a 0 sobre o Amazonas na Copa do Brasil. Veja mais um vídeo do ...,[],UCv-Nx8pSfG_LxbViMz14RWQ,223855,9954,0,801,{},[],{}
12/05/2024,1HH_-1ty-ro,"&quot;E O ABEL TÁ ERRADO???? Cara, ISSO que ELE FALOU...&quot; Declaração no Palmeiras PROVOCA POLÊMICA!",Jovem Pan Esportes,2024-05-12T22:35:10Z,Uma declaração de Abel Ferreira na entrevista coletiva após Palmeiras x Athletico-PR provocou polêmica e ferveu o debate no ...,[],UCv-Nx8pSfG_LxbViMz14RWQ,10845,809,0,108,{},[],{}
12/05/2024,r21F8b3mjwU,Flamengo SE REVOLTA com ARBITRAGEM e QUESTIONA a CBF; Palmeiras e São Paulo VENCEM! | BATE-PRONTO,Jovem Pan Esportes,2024-05-06T17:12:05Z,"O Bate-Pronto de hoje falará tudo sobre as polêmicas envolvendo o empate por 1 a 1 entre Bragantino e Flamengo, no sábado, ...",[],UCv-Nx8pSfG_LxbViMz14RWQ,205869,8043,0,83,{},[],{}
12/05/2024,wIbDdxGsyDE,PILHADO VOLTOU COM TUDO! &quot;É ISSO! O Flamengo do Tite VAI CALAR A MINHA BOCA se...&quot;,Jovem Pan Esportes,2024-04-22T15:33:59Z,"Pilhado voltou ao Bate-Pronto, da Jovem Pan Esportes, e falou sobre o Flamengo de Tite após o empate sem gols contra o ...",[],UCv-Nx8pSfG_LxbViMz14RWQ,241361,13965,0,812,{},[],{}
12/05/2024,ryZ8Qz188Vw,&quot;FOI TUDO UM ABSURDO...&quot; Mauro Cezar e Pilhado DETONAM decisões do VAR na partida do Flamengo!,Jovem Pan Esportes,2024-05-05T17:22:11Z,"O Flamengo foi até Bragança Paulista e empatou em 1 x 1 com o Bragantino, em um jogo cheio de polêmicas de arbitragem, ...",[],UCv-Nx8pSfG_LxbViMz14RWQ,486509,17358,0,2434,{},[],{}
12/05/2024,GF90PB46cNU,&quot;É SÉRIO! É ASSUSTADOR! O Gabigol NÃO EXISTIU! Parecia que...&quot; Mauro Cezar CRITICA o 10 do Flamengo!,Jovem Pan Esportes,2024-05-12T17:23:40Z,A atuação de Gabigol em Flamengo x Corinthians foi pífia. Mauro Cezar Pereira criticou o desempenho do atacante no Canelada ...,[],UCv-Nx8pSfG_LxbViMz14RWQ,120828,7772,0,854,{},[],{}
12/05/2024,3_AvTRRSxdU,"&quot;É IMPRESSIONANTE! TEM QUE RESPEITAR o Athletico-PR e o Cuca! GANHOU do Palmeiras, é o LÍDER e...&quot;",Jovem Pan Esportes,2024-05-12T21:42:25Z,O Palmeiras perdeu para o líder Athletico-PR de Cuca por 2 gols a 0 hoje pelo Brasileirão. Veja o debate após o jogo no ...,[],UCv-Nx8pSfG_LxbViMz14RWQ,29323,2256,0,342,{},[],{}
12/05/2024,_rl2BpxGxVk,FÜLLKRUG MARCA E BORUSSIA DORTMUND BATE O PSG EM NOITE APAGADA DE MBAPPÉ! - MELHOR DA LIGA,TNT Sports Brasil,2024-05-01T21:58:56Z,Borussia Dortmund e Paris Saint-Germain se enfrentam pela ida da semifinal da Champions League 2023/24! Você acompanha ...,[],UCs-6sCz2LJm1PrWQN4ErsPw,1524485,26143,0,22,{},[],{}
12/05/2024,uho6AYmmkUE,"&quot;Eu SEMPRE FALEI ISSO do Tite! Pra mim, o MAIOR PROBLEMA dele é...&quot; Mauro Cezar ANALISA o Flamengo!",Jovem Pan Esportes,2024-05-07T17:03:58Z,Hoje tem o jogo Palestino x Flamengo ao vivo e com imagem pela Libertadores. Assista ao comentário de Mauro Cezar Pereira ...,[],UCv-Nx8pSfG_LxbViMz14RWQ,262976,8508,0,342,{},[],{}
12/05/2024,vkv6w18jqg0,PEGOU FOGO! &quot;VOCÊ É RIDÍCULO! O São Paulo É SIM um time que pode...&quot; Pilhado REBATE Flavio Prado!,Jovem Pan Esportes,2024-05-03T03:41:32Z,O São Paulo de Luis Zubeldía venceu o Águia de Marabá por 3 gols a 1 hoje pela Copa do Brasil e fez o debate ferver ao vivo ...,[],UCv-Nx8pSfG_LxbViMz14RWQ,248372,8055,0,1393,{},[],{}
12/05/2024,SazErDk88nc,TRICOLOR NAS OITAVAS! São Paulo VENCE o Cobresal e SE CLASSIFICA na Libertadores! | CANELADA,Jovem Pan Esportes,2024-05-09T03:34:57Z,Veja a íntegra do Canelada. Crédito da foto usada na thumbnail: Reprodução/Twitter da Conmebol Baixe o app Panflix: ...,[],UCv-Nx8pSfG_LxbViMz14RWQ,132984,5445,0,65,{},[],{}
12/05/2024,AWiTgFht9UA,São Paulo 0 x 0 Palmeiras - 29/04/2024 - Brasileirão,Jovem Pan Esportes,2024-04-30T01:22:15Z,Jogo São Paulo x Palmeiras ao vivo hoje: assista à transmissão com imagem dos jornalistas da Jovem Pan Esportes. Narração ...,[],UCv-Nx8pSfG_LxbViMz14RWQ,1559326,14559,0,29,{},[],{}
12/05/2024,c_88CKuPs3Q,"BASTIDORES! &quot;A SITUAÇÃO É ESSA! Se o Gabigol DE FATO FOR SUSPENSO, o Flamengo...&quot; Mauro Cezar FALA!",Jovem Pan Esportes,2024-03-26T17:15:01Z,Informações: e agora? Gabigol vai sair do Flamengo? O atacante foi suspenso por 2 anos por tentativa de fraude no exame ...,[],UCv-Nx8pSfG_LxbViMz14RWQ,311100,10330,0,729,{},[],{}
12/05/2024,irBtISjvzd0,A CBF deveria PARAR o Brasileirão pela CALAMIDADE no RS?; Flamengo e Corinthians JOGAM | BATE-PRONTO,Jovem Pan Esportes,2024-05-07T17:10:19Z,O Bate-Pronto de hoje debaterá a situação do futebol brasileiro em meio ao estado de calamidade no Rio Grande do Sul devido ...,[],UCv-Nx8pSfG_LxbViMz14RWQ,220232,8883,0,245,{},[],{}
12/05/2024,m7FHCNge_Go,"Palmeiras VENCE após VIRADA ÉPICA contra Del Valle; Flamengo PERDE, e Tite VIRA ALVO! | BATE-PRONTO",Jovem Pan Esportes,2024-04-25T17:07:06Z,O Bate-Pronto de hoje falará tudo sobre os jogos de ontem pela Libertadores. Tanto Palmeiras quanto Flamengo entraram em ...,[],UCv-Nx8pSfG_LxbViMz14RWQ,198196,8069,0,86,{},[],{}
12/05/2024,K1Sgy-jdDVA,&quot;FOI UMA LAMBANÇA! ERRO CRASSO! O Flamengo...&quot; NOVO CONTRATO com a Globo é ANALISADO por Mauro Cezar,Jovem Pan Esportes,2024-04-09T16:35:05Z,Novo contrato do Flamengo com a TV Globo pelos direitos de transmissão do Brasileirão de 2025 a 2029: o clube rubro-negro ...,[],UCv-Nx8pSfG_LxbViMz14RWQ,383515,13310,0,952,{},[],{}
12/05/2024,RIIp05CuwD4,Corinthians DOMINA o Fluminense e VOLTA A VENCER; Flamengo PERDE; Hoje tem CHOQUE-REI! | BATE-PRONTO,Jovem Pan Esportes,2024-04-29T17:13:52Z,"O Bate-Pronto de hoje falará tudo sobre os jogos deste fim de semana pelo Brasileirão. Em Itaquera, o Corinthians não deu ...",[],UCv-Nx8pSfG_LxbViMz14RWQ,185139,7644,0,75,{},[],{}
12/05/2024,DkZBVcq0Gu4,É TRICAMPEÃO! Palmeiras VENCE o Santos e CONQUISTA o 3º TÍTULO PAULISTA SEGUIDO! | CANELADA,Jovem Pan Esportes,2024-04-08T00:42:27Z,"Veja a íntegra do Canelada. Crédito das fotos usadas na thumbnail: Fabio Menotti/Palmeiras/by Canon Siga o canal ""Jovem Pan ...",[],UCv-Nx8pSfG_LxbViMz14RWQ,235194,6951,0,148,{},[],{}
12/05/2024,21DVtzR19LQ,Bragantino 1 x 1 Flamengo - 04/05/2024 - Brasileirão,Jovem Pan Esportes,2024-05-04T23:47:00Z,Jogo Bragantino x Flamengo ao vivo hoje: assista à transmissão com imagem dos jornalistas da Jovem Pan Esportes. Narração ...,[],UCv-Nx8pSfG_LxbViMz14RWQ,1203387,8765,0,91,{},[],{}
12/05/2024,GE2RpVdPVXA,Presidente do Grêmio CITA Flamengo e paulistas ao COBRAR a PARALISAÇÃO do Brasileirão | VEJA DEBATE,Jovem Pan Esportes,2024-05-07T16:34:07Z,"Chuvas e enchentes no Rio Grande do Sul: o presidente do Grêmio, Alberto Guerra, cobrou a CBF pela paralisação do ...",[],UCv-Nx8pSfG_LxbViMz14RWQ,199920,6237,0,766,{},[],{}
12/05/2024,kFQMa_xlDEw,Flamengo e Corinthians JOGAM HOJE pela Copa do Brasil; Vini BRILHA na Champions! | BATE-PRONTO,Jovem Pan Esportes,2024-05-01T17:06:52Z,O Bate-Pronto de hoje projetará os jogos de hoje de Flamengo e Corinthians pela Copa do Brasil. O time rubro-negro vai ...,[],UCv-Nx8pSfG_LxbViMz14RWQ,159409,6773,0,72,{},[],{}
12/05/2024,xF2MB2R7hCQ,&quot;O Corinthians é UMA COISA MEDONHA! E É MUITO CLARO que o Flamengo...&quot; Mauro Cezar ANALISA 2 a 0!,Jovem Pan Esportes,2024-05-12T16:55:11Z,O Flamengo de Tite venceu o Corinthians por 2 gols a 0 ontem e dormiu na liderança do Brasileirão. Veja a análise de Mauro ...,[],UCv-Nx8pSfG_LxbViMz14RWQ,106002,6404,0,393,{},[],{}
12/05/2024,q-6MGl5kFCk,&quot;ISSO É UMA ARMADILHA PERIGOSA! O Dorival pra mim...&quot; Mauro Cezar FALA TUDO da Seleção Brasileira!,Jovem Pan Esportes,2024-03-27T15:35:02Z,Seleção Brasileira: Brasil e Espanha empataram por 3 gols a 3 no segundo jogo de Dorival Júnior à frente do selecionado ...,[],UCv-Nx8pSfG_LxbViMz14RWQ,335642,12901,0,2320,{},[],{}
12/05/2024,tHM9g01mViE,Palmeiras 2 x 1 Botafogo-SP - 02/05/2024 - Copa do Brasil,Jovem Pan Esportes,2024-05-03T02:44:09Z,Jogo Palmeiras x Botafogo/SP ao vivo hoje: assista à transmissão com imagem dos jornalistas da Jovem Pan Esportes. Narração ...,[],UCv-Nx8pSfG_LxbViMz14RWQ,469186,4321,0,19,{},[],{}
12/05/2024,Z2U-cJ1DYdE,Corinthians 3 x 0 Fluminense - 28/04/2024 - Brasileirão,Jovem Pan Esportes,2024-04-28T21:11:03Z,Jogo Corinthians x Fluminense ao vivo hoje: assista à transmissão com imagem dos jornalistas da Jovem Pan Esportes.,[],UCv-Nx8pSfG_LxbViMz14RWQ,473013,4320,0,51,{},[],{}
12/05/2024,aeeok2OqZaM,São Paulo e Palmeiras EMPATAM; Gabigol consegue EFEITO SUSPENSIVO e pode JOGAR no Fla | BATE-PRONTO,Jovem Pan Esportes,2024-04-30T17:10:45Z,"O Bate-Pronto de hoje analisará o empate por 0 a 0 de ontem entre São Paulo e Palmeiras, no Estádio do Morumbi. O clássico foi ...",[],UCv-Nx8pSfG_LxbViMz14RWQ,179357,7278,0,52,{},[],{}
12/05/2024,a_ssXW8BZuk,"MEU DEUS! Pilhado SURTA, SE VESTE de Einstein e DETONA Tite após DERROTA do Flamengo &quot;da CIÊNCIA&quot;!",Jovem Pan Esportes,2024-04-29T15:38:17Z,"PILHADO EINSTEIN!!! Após nova derrota do Flamengo, Tite foi detonado pelo apresentador do Bate-Pronto, que se vestiu de ...",[],UCv-Nx8pSfG_LxbViMz14RWQ,260463,13819,0,1302,{},[],{}
12/05/2024,wij7wDnXaZY,"&quot;ISSO É UM ESCÁRNIO, cara! É UMA FALSIDADE da CBF!&quot; OLHA qual ATITUDE sobre TRAGÉDIA no RS REVOLTOU!",Jovem Pan Esportes,2024-05-12T23:00:32Z,Tragédia no Rio Grande do Sul por causa das chuvas e enchentes: a CBF anunciou que vai se reunir com os clubes apenas no ...,[],UCv-Nx8pSfG_LxbViMz14RWQ,6294,363,0,43,{},[],{}
12/05/2024,BYztErWyfns,Corinthians 0 x 0 Fortaleza - 04/05/2024 - Brasileirão,Jovem Pan Esportes,2024-05-05T03:10:42Z,Jogo Corinthians x Fortaleza ao vivo hoje: assista à transmissão com imagem dos jornalistas da Jovem Pan Esportes. Narração ...,[],UCv-Nx8pSfG_LxbViMz14RWQ,408189,4871,0,5,{},[],{}
12/05/2024,03djyLPpY48,ÉPICO! Real Madrid VENCE o Manchester City NOS PÊNALTIS e vai à SEMIFINAL da Champions! | PÓS-JOGO,Jovem Pan Esportes,2024-04-17T22:51:12Z,Assista ao pós-jogo da Champions League na Jovem Pan Esportes. Crédito da foto usada na thumbnail: ADAM VAUGHAN/EFE ...,[],UCv-Nx8pSfG_LxbViMz14RWQ,239863,4976,0,39,{},[],{}
12/05/2024,8ZdkDh21fOg,&quot;TEM QUE RESPEITAR o Vinicius Júnior! E DEU PRA VER ele FALANDO pro Ancelotti que...&quot; Bayern x Real,Jovem Pan Esportes,2024-04-30T22:04:48Z,"Bayern de Munique x Real Madrid na Champions League: Vinicius Júnior fez dois gols, ""se irritou"" com Ancelotti e foi o grande ...",[],UCv-Nx8pSfG_LxbViMz14RWQ,242927,8263,0,385,{},[],{}
12/05/2024,KAIYesN3HZg,São Paulo PERDE para o Fortaleza em ESTREIA no Brasileirão | CANELADA,Jovem Pan Esportes,2024-04-14T18:09:44Z,"Veja a íntegra do Canelada. Siga o canal ""Jovem Pan Esportes"" no WhatsApp: https://whatsapp.com/channel/0029Va9w.",[],UCv-Nx8pSfG_LxbViMz14RWQ,117354,4449,0,25,{},[],{}
12/05/2024,AdXY6Hq3k8k,América-RN 1 x 2 Corinthians - 01/05/2024 - Copa do Brasil,Jovem Pan Esportes,2024-05-02T01:19:57Z,Jogo América-RN x Corinthians ao vivo hoje: assista à transmissão com imagem dos jornalistas da Jovem Pan Esportes.,[],UCv-Nx8pSfG_LxbViMz14RWQ,610350,4753,0,31,{},[],{}
12/05/2024,_fLvmBs0bTQ,"&quot;Cara, o que o Felipe Melo FALOU sobre Daniel Alves e Robinho foi...&quot; FORTE DECLARAÇÃO é DEBATIDA!",Jovem Pan Esportes,2024-03-28T17:38:27Z,Felipe Melo fala sobre Daniel Alves e Robinho em entrevista ao Globo Esporte e revela um forte posicionamento sobre os casos.,[],UCv-Nx8pSfG_LxbViMz14RWQ,323710,9082,0,833,{},[],{}
12/05/2024,HWPc953ZNh8,&quot;O que o Textor ME MOSTROU foi uma...&quot; NOVA REVELAÇÃO de presidente da CPI PROVOCA DEBATE!,Jovem Pan Esportes,2024-04-24T16:41:37Z,"Textor entregou provas? Um dia após o dono do Botafogo ir à CPI das Manipulações de Resultados, Jorge Kajuru, senador ...",[],UCv-Nx8pSfG_LxbViMz14RWQ,198067,6422,0,1873,{},[],{}
12/05/2024,AXqk68EU8bk,"&quot;ISSO É COMPLICADO! Gente, o Thiago Silva no Fluminense vai...&quot; REFORÇO DE PESO PROVOCA DEBATE!",Jovem Pan Esportes,2024-05-07T17:36:49Z,"Thiago Silva no Fluminense: o zagueiro, autor de skills e highlights no Chelsea em 2024, foi anunciado como novo reforço do ...",[],UCv-Nx8pSfG_LxbViMz14RWQ,111139,4321,0,721,{},[],{}
12/05/2024,Alie2BGJJ6Y,"&quot;É FANTÁSTICO, gente! AO CONTRÁRIO do Ronaldo, o NOVO DONO do Cruzeiro é...&quot; OLHA esse DEBATE!",Jovem Pan Esportes,2024-04-30T02:20:31Z,"Ronaldo VENDEU a SAF do Cruzeiro! Agora, Pedro Lourenço é o novo dono do clube celeste. O que esperar? Veja o debate no ...",[],UCv-Nx8pSfG_LxbViMz14RWQ,245353,9494,0,850,{},[],{}
12/05/2024,VKUcfVLVTTM,"&quot;Que BAITA CONTRATAÇÃO do São Paulo! Esse cara ME SURPREENDEU, TÁ JOGANDO MUITO e...&quot; VEJA DEBATE!",Jovem Pan Esportes,2024-04-26T02:44:58Z,André Silva e Ferreirinha foram exaltados após o São Paulo fazer 2 gols a 0 no Barcelona de Guayaquil hoje na Libertadores.,[],UCv-Nx8pSfG_LxbViMz14RWQ,148000,6040,0,339,{},[],{}
12/05/2024,tHM9g01mViE,Palmeiras 2 x 1 Botafogo-SP - 02/05/2024 - Copa do Brasil,Jovem Pan Esportes,2024-05-03T02:44:09Z,Jogo Palmeiras x Botafogo/SP ao vivo hoje: assista à transmissão com imagem dos jornalistas da Jovem Pan Esportes. Narração ...,[],UCv-Nx8pSfG_LxbViMz14RWQ,469186,4321,0,19,{},[],{}
12/05/2024,21DVtzR19LQ,Bragantino 1 x 1 Flamengo - 04/05/2024 - Brasileirão,Jovem Pan Esportes,2024-05-04T23:47:00Z,Jogo Bragantino x Flamengo ao vivo hoje: assista à transmissão com imagem dos jornalistas da Jovem Pan Esportes. Narração ...,[],UCv-Nx8pSfG_LxbViMz14RWQ,1203387,8765,0,91,{},[],{}
12/05/2024,F5Z2NRLcvSk,&quot;É SÓ &#39;FUMO&#39;! O Corinthians AUMENTOU pra R$ 114 MILHÕES a DÍVIDA de...&quot; OLHA ISSO!,Jovem Pan Esportes,2024-04-25T17:42:45Z,"Dívida do Corinthians: de 2022 para 2023, houve um aumento de 70% no valor devido pelo Timão de direitos de imagem a ...",[],UCv-Nx8pSfG_LxbViMz14RWQ,209186,6338,0,373,{},[],{}
12/05/2024,03djyLPpY48,ÉPICO! Real Madrid VENCE o Manchester City NOS PÊNALTIS e vai à SEMIFINAL da Champions! | PÓS-JOGO,Jovem Pan Esportes,2024-04-17T22:51:12Z,Assista ao pós-jogo da Champions League na Jovem Pan Esportes. Crédito da foto usada na thumbnail: ADAM VAUGHAN/EFE ...,[],UCv-Nx8pSfG_LxbViMz14RWQ,239863,4976,0,39,{},[],{}
12/05/2024,jUpjcaBnyyo,SENSACIONAL! OLHA o que o presidente do Atlético-GO FALOU após DERROTA pro São Paulo! SURPREENDENTE!,Jovem Pan Esportes,2024-04-22T00:16:28Z,"SURPREENDENTE! O Atlético Goianiense perdeu para o São Paulo por 3 gols a 0 hoje, e o presidente do Dragão, Adson Batista ...",[],UCv-Nx8pSfG_LxbViMz14RWQ,167474,5872,0,518,{},[],{}
12/05/2024,Z2U-cJ1DYdE,Corinthians 3 x 0 Fluminense - 28/04/2024 - Brasileirão,Jovem Pan Esportes,2024-04-28T21:11:03Z,Jogo Corinthians x Fluminense ao vivo hoje: assista à transmissão com imagem dos jornalistas da Jovem Pan Esportes.,[],UCv-Nx8pSfG_LxbViMz14RWQ,473013,4320,0,51,{},[],{}
12/05/2024,-WX3wNwHi6w,"Racing x Corinthians - JOGO COMPLETO, com narração de Diguinho Coruja | Copa Sul-Americana 2024",SBT Sports,2024-04-03T03:11:02Z,"Vai começar a fase de grupos da Conmebol Sul-Americana. No SBT, ninguém perde nenhum detalhe da estreia do Corinthians, ...",[],UCxc3marqP9BJSkQ0_K4mqDg,1408260,44760,0,51,{},[],{}
12/05/2024,AdXY6Hq3k8k,América-RN 1 x 2 Corinthians - 01/05/2024 - Copa do Brasil,Jovem Pan Esportes,2024-05-02T01:19:57Z,Jogo América-RN x Corinthians ao vivo hoje: assista à transmissão com imagem dos jornalistas da Jovem Pan Esportes.,[],UCv-Nx8pSfG_LxbViMz14RWQ,610350,4753,0,31,{},[],{}
12/05/2024,0R8Ss0VZ0zs,&quot;É INACREDITÁVEL! O Palmeiras do Abel é o ÚNICO TIME CAPAZ de...&quot; VIRADA SURREAL contra o Del Valle!,Jovem Pan Esportes,2024-04-25T03:53:28Z,"VIRADA SURREAL! O Palmeiras fez 3 gols a 2 no Independiente del Valle hoje pela Libertadores, e Abel Ferreira foi exaltado no ...",[],UCv-Nx8pSfG_LxbViMz14RWQ,287949,12003,0,922,{},[],{}
12/05/2024,Cwv8ba9hrDw,Corinthians empata em casa; Diretoria do Flamengo DETONA a arbitragem do Brasileirão! | CANELADA,Jovem Pan Esportes,2024-05-05T18:14:27Z,Veja a íntegra do Canelada!!! Crédito da foto usada na thumbnail: MARCO GALVÃO/FOTOARENA/ESTADÃO CONTEÚDO Baixe ...,[],UCv-Nx8pSfG_LxbViMz14RWQ,198825,7384,0,65,{},[],{}
12/05/2024,bs19Nv0nSTs,OS ESPORTES MAIS ENGRAÇADOS DO MUNDO!!!!,Reversão,2022-04-20T22:18:32Z,SEMPRE REVERSÃO!! SE INSCREVA E DEIXE O LIKE! Insta: https://bit.ly/2G8xoDx OUTROS CANAIS: VLOGS: @CanalCanalha ...,[],UCyEHckavb7hMh5f8j4WEiIg,485825,55959,0,1377,{},[],{}
12/05/2024,zkzY476j28A,"Palmeiras PERDE para o Athletico-PR, que VOLTA À LIDERANÇA ISOLADA do Brasileirão! | CANELADA",Jovem Pan Esportes,2024-05-12T22:38:40Z,Veja a íntegra do Canelada Crédito da foto usada na thumbnail: YURI MURAKAMI/FOTOARENA/ESTADÃO CONTEÚDO Baixe o ...,[],UCv-Nx8pSfG_LxbViMz14RWQ,71595,3978,0,29,{},[],{}
12/05/2024,5i64nqk9Zyo,ESPORTES MAIS PERIGOS0S DO MUNDO!!,Reversão,2022-06-12T20:22:13Z,SEMPRE REVERSÃO!! SE INSCREVA E DEIXE O LIKE! Insta: https://bit.ly/2G8xoDx OUTROS CANAIS: VLOGS: @CanalCanalha ...,[],UCyEHckavb7hMh5f8j4WEiIg,340289,46276,0,174,{},[],{}
12/05/2024,6sBONdiWNm0,FALOU UM ABSURDO??? OPINIÃO POLÊMICA sobre Vinicius Júnior e Neymar FERVE DEBATE após Bayern x Real!,Jovem Pan Esportes,2024-04-30T22:30:00Z,"Vinicius Júnior, que anotou dois gols em Bayern de Munique x Real Madrid hoje pela Champions League, vai se tornar MAIOR ...",[],UCv-Nx8pSfG_LxbViMz14RWQ,202469,8324,0,1752,{},[],{}
12/05/2024,vqNUYp53SA8,&quot;EU TÔ EMPOLGADO SIM! O São Paulo TEM VERGONHA NA CARA! Se CLASSIFICOU e...&quot; VITÓRIA sobre Cobresal!,Jovem Pan Esportes,2024-05-09T02:47:46Z,O São Paulo de Zubeldía venceu o Cobresal por 3 gols a 1 hoje e se classificou às oitavas de final da Libertadores. O SPFC foi ...,[],UCv-Nx8pSfG_LxbViMz14RWQ,181551,9041,0,483,{},[],{}
12/05/2024,eOnjvQLERzk,Palmeiras 0 x 2 Athletico-PR - 12/05/2024 - Brasileirão,Jovem Pan Esportes,2024-05-12T21:17:48Z,Jogo Palmeiras x Athletico-PR ao vivo hoje: assista à transmissão com imagem dos jornalistas da Jovem Pan Esportes. Narração ...,[],UCv-Nx8pSfG_LxbViMz14RWQ,500720,5209,0,23,{},[],{}
12/05/2024,KcbteUxPQ58,INCRÍVEL! Palmeiras consegue VIRADA SURREAL contra o Del Valle NO FIM; Flamengo PERDE! | CANELADA,Jovem Pan Esportes,2024-04-25T03:44:14Z,Veja a íntegra do Canelada... Crédito da foto usada na thumbnail: Luciano González/EFE Baixe o app Panflix: ...,[],UCv-Nx8pSfG_LxbViMz14RWQ,325541,12780,0,179,{},[],{}
12/05/2024,eKMdrvqxww0,"O Bayern foi ROUBADO contra o Real Madrid??? &quot;Cara, a ARBITRAGEM pra mim...&quot; POLÊMICA na Champions!",Jovem Pan Esportes,2024-05-08T21:55:49Z,O gol anulado estava impedido? O Bayern foi roubado pela arbitragem contra o Real Madrid na Champions League? Assista ao ...,[],UCv-Nx8pSfG_LxbViMz14RWQ,214284,6060,0,1758,{},[],{}
12/05/2024,Sah_jokx03A,"&quot;EU NÃO DUVIDO NADA DISSO! Se o Augusto Melo TIVER CULHÃO, ele...&quot; DEBATE FERVE sobre o Corinthians!",Jovem Pan Esportes,2024-04-23T15:37:47Z,O Corinthians vai fazer jogo importante contra o Argentinos Juniors hoje ao vivo e com imagem pela Copa Sul-Americana. Veja o ...,[],UCv-Nx8pSfG_LxbViMz14RWQ,96218,3696,0,167,{},[],{}
12/05/2024,fY5KxduLe4U,🔴AO VIVO | Ceará empata com o CRB; Notícias do Fortaleza | Esportes do Povo,O POVO,2024-05-07T15:06:05Z,"Participe pelo nosso Whatsapp (85) 9699-2299, e pelas nossas redes sociais twitter e instagram @opovocbn. Estamos ao vivo ...",[],UCj-RTZE-V3Q6jleatRR9k2A,4209,449,0,4,{},[],{}
12/05/2024,hNDZdkxeGwU,🔴 ARNALDO E TIRONI: SÃO PAULO JÁ SUBIU DE PATAMAR COM ZUBELDÍA? FLAMENGO PODE SER ELIMINADO!,UOL Esporte,2024-05-09T13:14:39Z,"São Paulo chega a cinco vitórias seguidas fora de casa, quebra marca de 12 anos e se classifica na Libertadores com duas ...",[],UC3KHYFWeB0WimMBfm3NEahQ,34256,2768,0,47,{},[],{}
12/05/2024,45UTIRDHsi8,"&quot;ME FALARAM que ISSO NÃO CAIU BEM DENTRO do Flamengo, cara! O Tite...&quot; Pilhado DÁ INFORMAÇÃO!",Jovem Pan Esportes,2024-05-09T03:44:19Z,"Informações de bastidores do Flamengo de Tite: segundo Pilhado, ""não caiu bem dentro do clube"", entre conselheiros e alguns ...",[],UCv-Nx8pSfG_LxbViMz14RWQ,293502,12222,0,823,{},[],{}
12/05/2024,6KdBZRI72Lo,São Paulo 1 x 2 Fortaleza - 13/04/2024 - Brasileirão,Jovem Pan Esportes,2024-04-14T03:17:45Z,Jogo São Paulo x Fortaleza ao vivo hoje: assista à transmissão com imagem dos jornalistas da Jovem Pan Esportes. Narração de ...,[],UCv-Nx8pSfG_LxbViMz14RWQ,729896,8399,0,43,{},[],{}
12/05/2024,4QHc8NR4ioM,"Flamengo &quot;RESSURGE&quot;, VENCE o Corinthians e ASSUME a LIDERANÇA do Brasileirão! | CANELADA 12/05/2024",Jovem Pan Esportes,2024-05-12T18:08:54Z,Veja a íntegra do Canelada. Crédito da foto usada na thumbnail: DANIEL SOEIRO DE ABREU CASTELO ...,[],UCv-Nx8pSfG_LxbViMz14RWQ,92780,5098,0,20,{},[],{}
12/05/2024,D8PSDiw7XPg,&quot;NINGUÉM LEMBRA MAIS DISSO! Mas o Vinicius Júnior com o Neymar na Copa...&quot; Mauro Cezar FALA TUDO!,Jovem Pan Esportes,2024-05-01T15:34:07Z,Vinicius Júnior brilhou e fez dois gols em Bayern de Munique x Real Madrid pela Champions League. A atuação do brasileiro foi ...,[],UCv-Nx8pSfG_LxbViMz14RWQ,372015,13676,0,928,{},[],{}
12/05/2024,JNAF3v3WSxE,&quot;OLHA ISSO! ACABOU A PACIÊNCIA DO CÁSSIO! Ele DISPAROU que...&quot; DESABAFO em ENTREVISTA no Corinthians,Jovem Pan Esportes,2024-04-24T03:16:47Z,"Em entrevista, Cássio desabafa após a derrota do Corinthians para o Argentinos Juniors em jogo hoje pela Copa Sul-Americana.",[],UCv-Nx8pSfG_LxbViMz14RWQ,487566,14756,0,1292,{},[],{}
12/05/2024,2btcwHxPO4M,OS 10 ESPORTES COM MAIS MEDALHAS PARA O BRASIL EM OLIMPÍADAS,TNT Sports Brasil,2021-07-24T21:00:01Z,Você sabia disso? Vitor Sergio Rodrigues elenca quais modalidades trouxeram mais medalhas para o Brasil em Olimpíadas!,[],UCs-6sCz2LJm1PrWQN4ErsPw,20976,1822,0,43,{},[],{}
12/05/2024,YXvOf3SRg6Y,Flamengo 1 x 0 Amazonas - 01/05/2024 - Copa do Brasil,Jovem Pan Esportes,2024-05-02T02:38:57Z,Jogo Flamengo x Amazonas ao vivo hoje: assista à transmissão com imagem dos jornalistas da Jovem Pan Esportes. Narração ...,[],UCv-Nx8pSfG_LxbViMz14RWQ,426162,4259,0,42,{},[],{}
12/05/2024,W3eeosjLSrs,&quot;O Palmeiras É FREGUÊS do São Paulo em DECISÃO! A REAL é que...&quot; Pilhado DISPARA após a Supercopa!,Jovem Pan Esportes,2024-02-04T21:34:13Z,"O São Paulo foi campeão da Supercopa do Brasil contra o Palmeiras nos pênaltis, e Pilhado disparou no Canelada, da Jovem ...",[],UCv-Nx8pSfG_LxbViMz14RWQ,115640,6367,0,682,{},[],{}
12/05/2024,_9wqQv6tx4c,RÁDIO ESPORTES  - 08/05/2024,Itatiaia Esporte,2024-05-08T16:10:59Z,Explore o mundo do esporte durante o seu almoço com o Rádio Esportes! Nosso programa oferece informações precisas e ...,[],UCezhRry1J2kNRNCdNDHimNA,10766,606,0,3,{},[],{}
12/05/2024,mtBGb1hQoCk,&quot;ISSO É UM LIXO! UMA COISA GROTESCA!&quot; ÁUDIO DO VAR do GOL ANULADO do Palmeiras PROVOCA DEBATE!,Jovem Pan Esportes,2024-05-03T16:06:56Z,"A linha do impedimento no gol anulado de Rony, do Palmeiras, estava certa? O áudio do VAR do jogo contra o Botafogo-SP foi ...",[],UCv-Nx8pSfG_LxbViMz14RWQ,333266,9675,0,1369,{},[],{}
12/05/2024,jTJCvJgpTG0,MEU DEUS! QUE FALHA BISONHA DO CÁSSIO! OLHA essa ENTREGADA do goleiro em Juventude x Corinthians!,Jovem Pan Esportes,2024-04-18T00:56:14Z,"QUE FALHA DO CÁSSIO! O goleiro do Corinthians não foi bem, e o Juventude fez 2 gols a 0 com melhores momentos hoje pelo ...",[],UCv-Nx8pSfG_LxbViMz14RWQ,96705,1287,0,355,{},[],{}
12/05/2024,19hDxmTNpXg,Flamengo 0 x 2 Botafogo - 28/04/2024 - Brasileirão,Jovem Pan Esportes,2024-04-28T16:12:48Z,Jogo Flamengo x Botafogo ao vivo hoje: assista à transmissão com imagem dos jornalistas da Jovem Pan Esportes. Narração de ...,[],UCv-Nx8pSfG_LxbViMz14RWQ,982720,8091,0,133,{},[],{}
12/05/2024,kDtbhJdGSCM,Corinthians EMPATA com o Galo; Flamengo VENCE Atlético-GO com pênalti polêmico! | CANELADA,Jovem Pan Esportes,2024-04-14T22:52:33Z,"Veja a íntegra do Canelada... Crédito da foto usada na thumbnail: Pedro Souza/Atlético Siga o canal ""Jovem Pan Esportes"" no ...",[],UCv-Nx8pSfG_LxbViMz14RWQ,132907,3882,0,107,{},[],{}
12/05/2024,VOy63WPLnPU,Barcelona-EQU 0 x 2 São Paulo - 25/04/2024 - Libertadores,Jovem Pan Esportes,2024-04-26T02:10:16Z,Jogo Barcelona-EQU X São Paulo ao vivo hoje: assista à transmissão com imagem dos jornalistas da Jovem Pan Esportes.,[],UCv-Nx8pSfG_LxbViMz14RWQ,592651,6210,0,10,{},[],{}
12/05/2024,r3iokjW2Xso,Flamengo JOGA MAL em ESTREIA na Libertadores; Corinthians VACILA na Sul-Americana! | BATE-PRONTO,Jovem Pan Esportes,2024-04-03T17:08:48Z,"O Bate-Pronto de hoje falará tudo sobre os jogos de ontem. Pela Libertadores, o Flamengo não jogou bem e, mesmo com um ...",[],UCv-Nx8pSfG_LxbViMz14RWQ,174031,6619,0,60,{},[],{}
12/05/2024,BuOl6Pi61Oo,🔴AO VIVO | Fortaleza sofre goleada na Sul-Americana; Preparação do Ceará | Esportes do Povo,O POVO,2024-05-09T15:06:18Z,"Participe pelo nosso Whatsapp (85) 9699-2299, e pelas nossas redes sociais twitter e instagram @opovocbn. Estamos ao vivo ...",[],UCj-RTZE-V3Q6jleatRR9k2A,3187,341,0,4,{},[],{}
12/05/2024,Ha6R_o5OfFY,&quot;É INFORMAÇÃO! Gente de DENTRO do Palmeiras ME FALOU que o John Kennedy...&quot; OLHA o que Vampeta FALOU,Jovem Pan Esportes,2024-05-01T17:33:38Z,"John Kennedy no Palmeiras: segundo informações de Vampeta, o atacante, que foi afastado de novo do Fluminense por ...",[],UCv-Nx8pSfG_LxbViMz14RWQ,264226,8114,0,465,{},[],{}
12/05/2024,Ren0s1BARmo,"NOVA JOIA BRILHA, e Palmeiras VENCE o Liverpool-URU DE VIRADA na Libertadores! | CANELADA",Jovem Pan Esportes,2024-04-12T03:02:43Z,Veja a íntegra do Canelada. Crédito da foto usada na thumbnail: ANDERSON LIRA/FOTOARENA/ESTADÃO CONTEÚDO Siga o ...,[],UCv-Nx8pSfG_LxbViMz14RWQ,146747,4274,0,53,{},[],{}
12/05/2024,lYQeZlSmWtg,&quot;É ASSUSTADOR! Esse elenco do Corinthians GANHA R$ 22 MILHÕES e VAI LUTAR pra NÃO CAIR!&quot; OLHA ISSO!,Jovem Pan Esportes,2024-04-22T16:40:25Z,"O Corinthians vai lutar para ser não ser rebaixado? A crise no Timão de Augusto Melo, que ainda não marcou sequer um gol no ...",[],UCv-Nx8pSfG_LxbViMz14RWQ,357939,11749,0,639,{},[],{}
12/05/2024,-h8Vj5Pqmjo,Corinthians 0 x 0 Atlético-MG - 14/04/2024 - Brasileirão,Jovem Pan Esportes,2024-04-14T21:20:09Z,Jogo Corinthians x Atlético-MG ao vivo hoje: assista à transmissão com imagem dos jornalistas da Jovem Pan Esportes.,[],UCv-Nx8pSfG_LxbViMz14RWQ,384610,3105,0,19,{},[],{}
12/05/2024,s3wu_RTcNjg,"DI MARÍA NO FLAMENGO? &quot;Gente, ele é CRAQUE! JOGA MUITO! E EU VI que...&quot; OLHA esse DEBATE sobre RUMOR",Jovem Pan Esportes,2024-04-08T17:49:11Z,"Ángel Di María no Flamengo? Será que o argentino, autor de skills e gols no Benfica, de fato interessa ao clube rubro-negro?",[],UCv-Nx8pSfG_LxbViMz14RWQ,172788,7185,0,412,{},[],{}
12/05/2024,KiSUuQCZbe0,RÁDIO ESPORTES  - 04/05/2024,Itatiaia Esporte,2024-05-04T16:06:31Z,Explore o mundo do esporte durante o seu almoço com o Rádio Esportes! Nosso programa oferece informações precisas e ...,[],UCezhRry1J2kNRNCdNDHimNA,12819,584,0,2,{},[],{}
12/05/2024,VQ2vAVjCkAA,Cuiabá 0 x 2 Palmeiras - 05/05/2024 - Brasileirão,Jovem Pan Esportes,2024-05-06T00:39:01Z,Jogo Cuiabá x Palmeiras ao vivo hoje: assista à transmissão com imagem dos jornalistas da Jovem Pan Esportes. Narração de ...,[],UCv-Nx8pSfG_LxbViMz14RWQ,426366,5508,0,8,{},[],{}
12/05/2024,wuLGxFbaclc,É HOJE! Dorival ESTREIA na Seleção em JOGAÇO contra a Inglaterra em Wembley! | CAMISA 10,Jovem Pan Esportes,2024-03-23T15:33:38Z,"O Camisa 10 deste sábado falará tudo sobre a Seleção Brasileira, que enfrenta a Inglaterra em amistoso hoje, às 16h, em ...",[],UCv-Nx8pSfG_LxbViMz14RWQ,54229,1525,0,21,{},[],{}
12/05/2024,3nlmHhsNuMw,&quot;FOI HISTÓRICO! O Cuca foi MUITO CORAJOSO de ter FALADO ISSO e...&quot; FORTE PRONUNCIAMENTO REPERCUTE!,Jovem Pan Esportes,2024-03-11T17:20:22Z,"O pronunciamento de Cuca sobre as mulheres em entrevista coletiva no Athletico-PR repercutiu bastante. O treinador, que havia ...",[],UCv-Nx8pSfG_LxbViMz14RWQ,132127,6165,0,782,{},[],{}
12/05/2024,CZn_aFX9yqc,&quot;NÃO TEM O MENOR CABIMENTO! O Dorival TEM QUE TOMAR CUIDADO com...&quot; Mauro Cezar FALA TUDO da Seleção,Jovem Pan Esportes,2024-01-22T15:30:05Z,"Lucas Moura disse ter como meta ser convocado pela Seleção Brasileira. E Dorival Júnior, técnico recém-contratado pela CBF, ...",[],UCv-Nx8pSfG_LxbViMz14RWQ,227894,6421,0,875,{},[],{}
12/05/2024,GhYaioIvjRw,&quot;Fair Play financeiro não prejudica...&quot; Mauro Cezar É DIRETO sobre a gestão financeira dos clubes.,Jovem Pan Esportes,2023-12-27T16:13:51Z,"""Fair Play financeiro não prejudica..."" Mauro Cezar É DIRETO sobre a gestão financeira dos clubes. A discussão no Bate Pronto é ...",[],UCv-Nx8pSfG_LxbViMz14RWQ,337569,11951,0,1387,{},[],{}
13/05/2024,ExxmKU-Wn6w,"PILHADO SURTOU! &quot;COVAAARDE! TITE, VOCÊ É UM...&quot; OLHA essa PISTOLADA após Bolívar 2 x 1 Flamengo!",Jovem Pan Esportes,2024-04-25T02:52:26Z,"PILHADO PISTOLOU! Após o Flamengo de Tite perder para o Bolívar por 2 gols a 1 hoje pela Libertadores, o apresentador do ...",[],UCv-Nx8pSfG_LxbViMz14RWQ,363783,19280,0,2707,{},[],{}
13/05/2024,nHErO4Ft3oE,"&quot;ISSO É UMA MALUQUICE, gente! O Tite tem que ser COBRADO? SIM! Mas...&quot; Mauro Cezar ANALISA Flamengo!",Jovem Pan Esportes,2024-05-03T21:15:01Z,"Tem que ser demitido? Os gritos de ""Fora, Tite"" ecoaram na torcida do Flamengo após a vitória por 1 a 0 sobre o Amazonas com ...",[],UCv-Nx8pSfG_LxbViMz14RWQ,290135,10864,0,618,{},[],{}
13/05/2024,dvhBwkA25Og,"&quot;ISSO É JUSTO??? EU NÃO ACHO JUSTO! Pra mim, o Dorival...&quot; CONVOCAÇÃO da Seleção PROVOCA DEBATE!",Jovem Pan Esportes,2024-05-10T16:12:30Z,Convocação da Seleção Brasileira para a Copa América: Dorival Júnior convocou hoje apenas três jogadores que atuam no ...,[],UCv-Nx8pSfG_LxbViMz14RWQ,377730,12270,0,1824,{},[],{}
13/05/2024,2RVs1yhDLgg,São Paulo VENCE e SE CLASSIFICA às 8ªs da Libertadores; Vini BRILHA na Champions! | BATE-PRONTO,Jovem Pan Esportes,2024-05-09T17:09:16Z,"O Bate-Pronto de hoje falará tudo sobre a vitória do São Paulo por 3 a 1 sobre o Cobresal, ontem de noite, no Chile. O resultado ...",[],UCv-Nx8pSfG_LxbViMz14RWQ,184555,7072,0,119,{},[],{}
13/05/2024,aN1OXOnc-64,VEJA como foi a CONVOCAÇÃO da Seleção Brasileira para a Copa América! | BATE-PRONTO,Jovem Pan Esportes,2024-05-10T17:11:43Z,O Bate-Pronto de hoje exibirá e debaterá ao vivo a convocação de Dorival Júnior na Seleção Brasileira. O treinador anunciará os ...,[],UCv-Nx8pSfG_LxbViMz14RWQ,258922,10312,0,101,{},[],{}
13/05/2024,DVaIujjsWWw,Palmeiras e São Paulo VENCEM pela Copa do Brasil; Flamengo e Corinthians JOGAM amanhã! | BATE-PRONTO,Jovem Pan Esportes,2024-05-03T17:11:29Z,"O Bate-Pronto de hoje debaterá as vitórias de Palmeiras e São Paulo, ontem de noite, na Copa do Brasil. O Verdão bateu o ...",[],UCv-Nx8pSfG_LxbViMz14RWQ,167373,6248,0,44,{},[],{}
13/05/2024,bhmgW3PlmbY,"Flamengo VENCE, mas é VAIADO; Tite é XINGADO; Carlos Miguel BRILHA no Corinthians! | BATE-PRONTO",Jovem Pan Esportes,2024-05-02T17:05:49Z,"O Bate-Pronto de hoje falará tudo sobre os jogos de ontem pela Copa do Brasil. No Maracanã, o Flamengo venceu o Amazonas ...",[],UCv-Nx8pSfG_LxbViMz14RWQ,226524,8832,0,85,{},[],{}
13/05/2024,XLENpHKzK-o,"&quot;EU FALO! Se o Vinicius Júnior não for o MELHOR DO MUNDO caso o Real GANHE a Champions, EU VOU...&quot;",Jovem Pan Esportes,2024-05-09T16:51:13Z,"Vinicius Júnior x Bayern de Munique: o brasileiro do Real Madrid teve skills, melhores momentos e brilhou de novo na semifinal ...",[],UCv-Nx8pSfG_LxbViMz14RWQ,229760,8946,0,988,{},[],{}
13/05/2024,u0ywlRe3ZMs,Flamengo PERDE pro Palestino e CAI para 3º na Libertadores; Corinthians VENCE na Sula! | BATE-PRONTO,Jovem Pan Esportes,2024-05-08T17:11:26Z,O Bate-Pronto de hoje debaterá a situação do futebol brasileiro em meio ao estado de calamidade no Rio Grande do Sul devido ...,[],UCv-Nx8pSfG_LxbViMz14RWQ,307434,13609,0,132,{},[],{}
13/05/2024,iYyWICbbwm0,"&quot;É SENSACIONAL o início do Zubeldía! O São Paulo mostra MUITA RAÇA, VONTADE e...&quot; 2x1 no Fluminense!",Jovem Pan Esportes,2024-05-14T01:42:01Z,"O São Paulo venceu o Fluminense por 2 gols a 1 em grande jogo hoje pelo Brasileirão. Veja a análise da partida no Pós-Jogo, ...",[],UCv-Nx8pSfG_LxbViMz14RWQ,26371,1748,0,102,{},[],{}
13/05/2024,eqIpo3-Gnjc,"&quot;O TITE FUGIU NO AEROPORTO, cara! É UMA VERGONHA! Ele...&quot; Pilhado DETONA ATITUDE no Flamengo!",Jovem Pan Esportes,2024-05-08T16:39:46Z,"Em meio a protestos da torcida do Flamengo, Tite deixou o Aeroporto do Galeão pela porta lateral. A atitude foi detonada por ...",[],UCv-Nx8pSfG_LxbViMz14RWQ,276159,10566,0,1202,{},[],{}
13/05/2024,YlegND4P_Pg,"&quot;É UMA VERGONHA! É INADMISSÍVEL! Cara, o que o Vasco FEZ...&quot; VEXAME, SAÍDA de Ramón Díaz e CRISE!",Jovem Pan Esportes,2024-04-28T23:32:08Z,"Ramón Diaz pediu demissão ou foi demitido? O Vasco foi goleado, levou 4 gols a 0 do Criciúma e, logo após o jogo, anunciou a ...",[],UCv-Nx8pSfG_LxbViMz14RWQ,132047,4943,0,327,{},[],{}
13/05/2024,wIbDdxGsyDE,PILHADO VOLTOU COM TUDO! &quot;É ISSO! O Flamengo do Tite VAI CALAR A MINHA BOCA se...&quot;,Jovem Pan Esportes,2024-04-22T15:33:59Z,"Pilhado voltou ao Bate-Pronto, da Jovem Pan Esportes, e falou sobre o Flamengo de Tite após o empate sem gols contra o ...",[],UCv-Nx8pSfG_LxbViMz14RWQ,241375,13965,0,812,{},[],{}
13/05/2024,C6SaPizE91Q,&quot;É ÓBVIO! O Tite está ARRISCADO de SER DEMITIDO do Flamengo se...&quot; CRISE PROVOCA DEBATE!,Jovem Pan Esportes,2024-05-08T16:07:57Z,Tite pode ser demitido do Flamengo em caso de má atuação contra o Corinthians no sábado? Seria um erro da diretoria ...,[],UCv-Nx8pSfG_LxbViMz14RWQ,381529,14218,0,1214,{},[],{}
13/05/2024,VWUgFDTRvZg,&quot;É RIDÍCULO! NÃO TEM MAIS DESCULPA! O Flamengo do Tite VIROU UM TIME de...&quot; Pilhado DETONA!,Jovem Pan Esportes,2024-05-02T16:30:06Z,Pilhado detonou o Flamengo de Tite após a vitória por 1 a 0 sobre o Amazonas na Copa do Brasil. Veja mais um vídeo do ...,[],UCv-Nx8pSfG_LxbViMz14RWQ,223900,9955,0,802,{},[],{}
13/05/2024,ryZ8Qz188Vw,&quot;FOI TUDO UM ABSURDO...&quot; Mauro Cezar e Pilhado DETONAM decisões do VAR na partida do Flamengo!,Jovem Pan Esportes,2024-05-05T17:22:11Z,"O Flamengo foi até Bragança Paulista e empatou em 1 x 1 com o Bragantino, em um jogo cheio de polêmicas de arbitragem, ...",[],UCv-Nx8pSfG_LxbViMz14RWQ,486614,17359,0,2434,{},[],{}
13/05/2024,SazErDk88nc,TRICOLOR NAS OITAVAS! São Paulo VENCE o Cobresal e SE CLASSIFICA na Libertadores! | CANELADA,Jovem Pan Esportes,2024-05-09T03:34:57Z,Veja a íntegra do Canelada. Crédito da foto usada na thumbnail: Reprodução/Twitter da Conmebol Baixe o app Panflix: ...,[],UCv-Nx8pSfG_LxbViMz14RWQ,133164,5444,0,65,{},[],{}
13/05/2024,vkv6w18jqg0,PEGOU FOGO! &quot;VOCÊ É RIDÍCULO! O São Paulo É SIM um time que pode...&quot; Pilhado REBATE Flavio Prado!,Jovem Pan Esportes,2024-05-03T03:41:32Z,O São Paulo de Luis Zubeldía venceu o Águia de Marabá por 3 gols a 1 hoje pela Copa do Brasil e fez o debate ferver ao vivo ...,[],UCv-Nx8pSfG_LxbViMz14RWQ,248424,8055,0,1394,{},[],{}
13/05/2024,c_88CKuPs3Q,"BASTIDORES! &quot;A SITUAÇÃO É ESSA! Se o Gabigol DE FATO FOR SUSPENSO, o Flamengo...&quot; Mauro Cezar FALA!",Jovem Pan Esportes,2024-03-26T17:15:01Z,Informações: e agora? Gabigol vai sair do Flamengo? O atacante foi suspenso por 2 anos por tentativa de fraude no exame ...,[],UCv-Nx8pSfG_LxbViMz14RWQ,311105,10330,0,729,{},[],{}
13/05/2024,r21F8b3mjwU,Flamengo SE REVOLTA com ARBITRAGEM e QUESTIONA a CBF; Palmeiras e São Paulo VENCEM! | BATE-PRONTO,Jovem Pan Esportes,2024-05-06T17:12:05Z,"O Bate-Pronto de hoje falará tudo sobre as polêmicas envolvendo o empate por 1 a 1 entre Bragantino e Flamengo, no sábado, ...",[],UCv-Nx8pSfG_LxbViMz14RWQ,205989,8044,0,83,{},[],{}
13/05/2024,m7FHCNge_Go,"Palmeiras VENCE após VIRADA ÉPICA contra Del Valle; Flamengo PERDE, e Tite VIRA ALVO! | BATE-PRONTO",Jovem Pan Esportes,2024-04-25T17:07:06Z,O Bate-Pronto de hoje falará tudo sobre os jogos de ontem pela Libertadores. Tanto Palmeiras quanto Flamengo entraram em ...,[],UCv-Nx8pSfG_LxbViMz14RWQ,198224,8069,0,86,{},[],{}
13/05/2024,K1Sgy-jdDVA,&quot;FOI UMA LAMBANÇA! ERRO CRASSO! O Flamengo...&quot; NOVO CONTRATO com a Globo é ANALISADO por Mauro Cezar,Jovem Pan Esportes,2024-04-09T16:35:05Z,Novo contrato do Flamengo com a TV Globo pelos direitos de transmissão do Brasileirão de 2025 a 2029: o clube rubro-negro ...,[],UCv-Nx8pSfG_LxbViMz14RWQ,383562,13311,0,952,{},[],{}
13/05/2024,GE2RpVdPVXA,Presidente do Grêmio CITA Flamengo e paulistas ao COBRAR a PARALISAÇÃO do Brasileirão | VEJA DEBATE,Jovem Pan Esportes,2024-05-07T16:34:07Z,"Chuvas e enchentes no Rio Grande do Sul: o presidente do Grêmio, Alberto Guerra, cobrou a CBF pela paralisação do ...",[],UCv-Nx8pSfG_LxbViMz14RWQ,206333,6390,0,807,{},[],{}
13/05/2024,r6jmeK72f_8,&quot;SÓ PODE ESTAR DE SACANAGEM! A INFORMAÇÃO de hoje é que o Flamengo...&quot; OLHA o que REVOLTOU Pilhado!,Jovem Pan Esportes,2024-05-09T17:25:40Z,"Uma informação de hoje sobre o Flamengo de Tite, que vive crise na Libertadores, revoltou Pilhado ao vivo no Bate-Pronto.",[],UCv-Nx8pSfG_LxbViMz14RWQ,416972,15624,0,1361,{},[],{}
13/05/2024,BYztErWyfns,Corinthians 0 x 0 Fortaleza - 04/05/2024 - Brasileirão,Jovem Pan Esportes,2024-05-05T03:10:42Z,Jogo Corinthians x Fortaleza ao vivo hoje: assista à transmissão com imagem dos jornalistas da Jovem Pan Esportes. Narração ...,[],UCv-Nx8pSfG_LxbViMz14RWQ,408428,4869,0,5,{},[],{}
13/05/2024,AXqk68EU8bk,"&quot;ISSO É COMPLICADO! Gente, o Thiago Silva no Fluminense vai...&quot; REFORÇO DE PESO PROVOCA DEBATE!",Jovem Pan Esportes,2024-05-07T17:36:49Z,"Thiago Silva no Fluminense: o zagueiro, autor de skills e highlights no Chelsea em 2024, foi anunciado como novo reforço do ...",[],UCv-Nx8pSfG_LxbViMz14RWQ,112343,4352,0,727,{},[],{}
13/05/2024,kFQMa_xlDEw,Flamengo e Corinthians JOGAM HOJE pela Copa do Brasil; Vini BRILHA na Champions! | BATE-PRONTO,Jovem Pan Esportes,2024-05-01T17:06:52Z,O Bate-Pronto de hoje projetará os jogos de hoje de Flamengo e Corinthians pela Copa do Brasil. O time rubro-negro vai ...,[],UCv-Nx8pSfG_LxbViMz14RWQ,159429,6773,0,72,{},[],{}
13/05/2024,hcHsc1sDBoY,&quot;CÊ TÁ LOUCO??? EU DUVIDO que FALARIA ISSO pro Gabigol!&quot; DEBATE FERVE sobre o Flamengo de Tite!,Jovem Pan Esportes,2024-04-25T17:11:59Z,"Até Gabigol foi citado! Após a derrota do Flamengo para o Bolíviar na altitude, Tite foi alvo de críticas durante debate no ...",[],UCv-Nx8pSfG_LxbViMz14RWQ,183553,6309,0,498,{},[],{}
13/05/2024,hujZSOr3Ht0,&quot;O Lorran TALVEZ POSSA ser o...&quot; VEJA o que Mauro Cezar FALOU sobre o NOVO XODÓ do Flamengo!,Jovem Pan Esportes,2024-05-13T15:30:21Z,"Lorran fez gol, deu assistência e foi o grande nome do Flamengo na vitória contra o Corinthians. Ele já deveria virar titular do time ...",[],UCv-Nx8pSfG_LxbViMz14RWQ,133678,8173,0,252,{},[],{}
13/05/2024,Gb_IFFPMqBk,Flamengo 2 x 0 Corinthians - 11/05/2024 - Brasileirão,Jovem Pan Esportes,2024-05-11T22:15:12Z,Jogo Flamengo x Corinthians ao vivo hoje: assista à transmissão com imagem dos jornalistas da Jovem Pan Esportes. Narração ...,[],UCv-Nx8pSfG_LxbViMz14RWQ,1129343,11626,0,35,{},[],{}
13/05/2024,aeeok2OqZaM,São Paulo e Palmeiras EMPATAM; Gabigol consegue EFEITO SUSPENSIVO e pode JOGAR no Fla | BATE-PRONTO,Jovem Pan Esportes,2024-04-30T17:10:45Z,"O Bate-Pronto de hoje analisará o empate por 0 a 0 de ontem entre São Paulo e Palmeiras, no Estádio do Morumbi. O clássico foi ...",[],UCv-Nx8pSfG_LxbViMz14RWQ,179372,7278,0,52,{},[],{}
13/05/2024,_rl2BpxGxVk,FÜLLKRUG MARCA E BORUSSIA DORTMUND BATE O PSG EM NOITE APAGADA DE MBAPPÉ! - MELHOR DA LIGA,TNT Sports Brasil,2024-05-01T21:58:56Z,Borussia Dortmund e Paris Saint-Germain se enfrentam pela ida da semifinal da Champions League 2023/24! Você acompanha ...,[],UCs-6sCz2LJm1PrWQN4ErsPw,1524687,26139,0,22,{},[],{}
13/05/2024,8rc0bbo0VtM,É HOJE! Flamengo e São Paulo SE ENFRENTAM EM JOGÃO no Maracanã! | BATE-PRONTO - 17/04/24,Jovem Pan Esportes,2024-04-17T17:14:40Z,"O Bate-Pronto de hoje projetará o jogão de hoje entre Flamengo e São Paulo, no Maracanã, pela 2ª rodada do Brasileirão.",[],UCv-Nx8pSfG_LxbViMz14RWQ,180053,6432,0,34,{},[],{}
13/05/2024,21DVtzR19LQ,Bragantino 1 x 1 Flamengo - 04/05/2024 - Brasileirão,Jovem Pan Esportes,2024-05-04T23:47:00Z,Jogo Bragantino x Flamengo ao vivo hoje: assista à transmissão com imagem dos jornalistas da Jovem Pan Esportes. Narração ...,[],UCv-Nx8pSfG_LxbViMz14RWQ,1203560,8765,0,91,{},[],{}
13/05/2024,a_ssXW8BZuk,"MEU DEUS! Pilhado SURTA, SE VESTE de Einstein e DETONA Tite após DERROTA do Flamengo &quot;da CIÊNCIA&quot;!",Jovem Pan Esportes,2024-04-29T15:38:17Z,"PILHADO EINSTEIN!!! Após nova derrota do Flamengo, Tite foi detonado pelo apresentador do Bate-Pronto, que se vestiu de ...",[],UCv-Nx8pSfG_LxbViMz14RWQ,260507,13818,0,1302,{},[],{}
13/05/2024,HWPc953ZNh8,&quot;O que o Textor ME MOSTROU foi uma...&quot; NOVA REVELAÇÃO de presidente da CPI PROVOCA DEBATE!,Jovem Pan Esportes,2024-04-24T16:41:37Z,"Textor entregou provas? Um dia após o dono do Botafogo ir à CPI das Manipulações de Resultados, Jorge Kajuru, senador ...",[],UCv-Nx8pSfG_LxbViMz14RWQ,198160,6424,0,1873,{},[],{}
13/05/2024,8ZdkDh21fOg,&quot;TEM QUE RESPEITAR o Vinicius Júnior! E DEU PRA VER ele FALANDO pro Ancelotti que...&quot; Bayern x Real,Jovem Pan Esportes,2024-04-30T22:04:48Z,"Bayern de Munique x Real Madrid na Champions League: Vinicius Júnior fez dois gols, ""se irritou"" com Ancelotti e foi o grande ...",[],UCv-Nx8pSfG_LxbViMz14RWQ,243038,8263,0,386,{},[],{}
13/05/2024,KAIYesN3HZg,São Paulo PERDE para o Fortaleza em ESTREIA no Brasileirão | CANELADA,Jovem Pan Esportes,2024-04-14T18:09:44Z,"Veja a íntegra do Canelada. Siga o canal ""Jovem Pan Esportes"" no WhatsApp: https://whatsapp.com/channel/0029Va9w.",[],UCv-Nx8pSfG_LxbViMz14RWQ,117359,4449,0,25,{},[],{}
13/05/2024,AWiTgFht9UA,São Paulo 0 x 0 Palmeiras - 29/04/2024 - Brasileirão,Jovem Pan Esportes,2024-04-30T01:22:15Z,Jogo São Paulo x Palmeiras ao vivo hoje: assista à transmissão com imagem dos jornalistas da Jovem Pan Esportes. Narração ...,[],UCv-Nx8pSfG_LxbViMz14RWQ,1560251,14560,0,29,{},[],{}
13/05/2024,F9Zx5V1-mR4,&quot;PARA COM ISSO! É TERRÍVEL! O futebol no Brasil hoje...&quot; DESABAFO FORTE após ESTREIA do Brasileirão!,Jovem Pan Esportes,2024-04-15T21:30:02Z,"Atlético-GO x Flamengo, Corinthians x Atlético-MG, Vasco x Grêmio... As polêmicas de arbitragem e o ""caos"" tomaram conta da ...",[],UCv-Nx8pSfG_LxbViMz14RWQ,119361,3956,0,286,{},[],{}
13/05/2024,dVrGAAzuCRE,"&quot;É TODA HORA ISSO! Nós estamos MUITO TOLERANTES com FUTEBOL RUIM, gente!&quot; Mauro Cezar CRITICA!",Jovem Pan Esportes,2024-04-30T15:30:55Z,"São Paulo, Palmeiras, Flamengo, Fluminense... Grandes times do futebol brasileiro apresentaram um futebol muito pobre na ...",[],UCv-Nx8pSfG_LxbViMz14RWQ,135413,6031,0,513,{},[],{}
13/05/2024,ZpbXqEOqHsc,"Flamengo PERDE para o Botafogo, e Tite é MUITO CRITICADO; Fogão ASSUME A LIDERANÇA! | CANELADA",Jovem Pan Esportes,2024-04-28T18:04:45Z,Veja a íntegra do Canelada. Crédito da foto usada na thumbnail: Vitor Silva/Botafogo Baixe o app Panflix: ...,[],UCv-Nx8pSfG_LxbViMz14RWQ,433841,15696,0,264,{},[],{}
13/05/2024,VKUcfVLVTTM,"&quot;Que BAITA CONTRATAÇÃO do São Paulo! Esse cara ME SURPREENDEU, TÁ JOGANDO MUITO e...&quot; VEJA DEBATE!",Jovem Pan Esportes,2024-04-26T02:44:58Z,André Silva e Ferreirinha foram exaltados após o São Paulo fazer 2 gols a 0 no Barcelona de Guayaquil hoje na Libertadores.,[],UCv-Nx8pSfG_LxbViMz14RWQ,148006,6040,0,339,{},[],{}
13/05/2024,Alie2BGJJ6Y,"&quot;É FANTÁSTICO, gente! AO CONTRÁRIO do Ronaldo, o NOVO DONO do Cruzeiro é...&quot; OLHA esse DEBATE!",Jovem Pan Esportes,2024-04-30T02:20:31Z,"Ronaldo VENDEU a SAF do Cruzeiro! Agora, Pedro Lourenço é o novo dono do clube celeste. O que esperar? Veja o debate no ...",[],UCv-Nx8pSfG_LxbViMz14RWQ,245437,9496,0,819,{},[],{}
13/05/2024,Cwv8ba9hrDw,Corinthians empata em casa; Diretoria do Flamengo DETONA a arbitragem do Brasileirão! | CANELADA,Jovem Pan Esportes,2024-05-05T18:14:27Z,Veja a íntegra do Canelada!!! Crédito da foto usada na thumbnail: MARCO GALVÃO/FOTOARENA/ESTADÃO CONTEÚDO Baixe ...,[],UCv-Nx8pSfG_LxbViMz14RWQ,198925,7385,0,65,{},[],{}
13/05/2024,tHM9g01mViE,Palmeiras 2 x 1 Botafogo-SP - 02/05/2024 - Copa do Brasil,Jovem Pan Esportes,2024-05-03T02:44:09Z,Jogo Palmeiras x Botafogo/SP ao vivo hoje: assista à transmissão com imagem dos jornalistas da Jovem Pan Esportes. Narração ...,[],UCv-Nx8pSfG_LxbViMz14RWQ,469240,4321,0,19,{},[],{}
13/05/2024,-WX3wNwHi6w,"Racing x Corinthians - JOGO COMPLETO, com narração de Diguinho Coruja | Copa Sul-Americana 2024",SBT Sports,2024-04-03T03:11:02Z,"Vai começar a fase de grupos da Conmebol Sul-Americana. No SBT, ninguém perde nenhum detalhe da estreia do Corinthians, ...",[],UCxc3marqP9BJSkQ0_K4mqDg,1408395,44761,0,53,{},[],{}
13/05/2024,fY5KxduLe4U,🔴AO VIVO | Ceará empata com o CRB; Notícias do Fortaleza | Esportes do Povo,O POVO,2024-05-07T15:06:05Z,"Participe pelo nosso Whatsapp (85) 9699-2299, e pelas nossas redes sociais twitter e instagram @opovocbn. Estamos ao vivo ...",[],UCj-RTZE-V3Q6jleatRR9k2A,4216,449,0,4,{},[],{}
13/05/2024,03djyLPpY48,ÉPICO! Real Madrid VENCE o Manchester City NOS PÊNALTIS e vai à SEMIFINAL da Champions! | PÓS-JOGO,Jovem Pan Esportes,2024-04-17T22:51:12Z,Assista ao pós-jogo da Champions League na Jovem Pan Esportes. Crédito da foto usada na thumbnail: ADAM VAUGHAN/EFE ...,[],UCv-Nx8pSfG_LxbViMz14RWQ,239870,4976,0,39,{},[],{}
13/05/2024,6sBONdiWNm0,FALOU UM ABSURDO??? OPINIÃO POLÊMICA sobre Vinicius Júnior e Neymar FERVE DEBATE após Bayern x Real!,Jovem Pan Esportes,2024-04-30T22:30:00Z,"Vinicius Júnior, que anotou dois gols em Bayern de Munique x Real Madrid hoje pela Champions League, vai se tornar MAIOR ...",[],UCv-Nx8pSfG_LxbViMz14RWQ,202609,8327,0,1752,{},[],{}
13/05/2024,Alie2BGJJ6Y,"&quot;É FANTÁSTICO, gente! AO CONTRÁRIO do Ronaldo, o NOVO DONO do Cruzeiro é...&quot; OLHA esse DEBATE!",Jovem Pan Esportes,2024-04-30T02:20:31Z,"Ronaldo VENDEU a SAF do Cruzeiro! Agora, Pedro Lourenço é o novo dono do clube celeste. O que esperar? Veja o debate no ...",[],UCv-Nx8pSfG_LxbViMz14RWQ,245437,9496,0,819,{},[],{}
13/05/2024,Cwv8ba9hrDw,Corinthians empata em casa; Diretoria do Flamengo DETONA a arbitragem do Brasileirão! | CANELADA,Jovem Pan Esportes,2024-05-05T18:14:27Z,Veja a íntegra do Canelada!!! Crédito da foto usada na thumbnail: MARCO GALVÃO/FOTOARENA/ESTADÃO CONTEÚDO Baixe ...,[],UCv-Nx8pSfG_LxbViMz14RWQ,198925,7385,0,65,{},[],{}
13/05/2024,tHM9g01mViE,Palmeiras 2 x 1 Botafogo-SP - 02/05/2024 - Copa do Brasil,Jovem Pan Esportes,2024-05-03T02:44:09Z,Jogo Palmeiras x Botafogo/SP ao vivo hoje: assista à transmissão com imagem dos jornalistas da Jovem Pan Esportes. Narração ...,[],UCv-Nx8pSfG_LxbViMz14RWQ,469240,4321,0,19,{},[],{}
13/05/2024,-WX3wNwHi6w,"Racing x Corinthians - JOGO COMPLETO, com narração de Diguinho Coruja | Copa Sul-Americana 2024",SBT Sports,2024-04-03T03:11:02Z,"Vai começar a fase de grupos da Conmebol Sul-Americana. No SBT, ninguém perde nenhum detalhe da estreia do Corinthians, ...",[],UCxc3marqP9BJSkQ0_K4mqDg,1408395,44761,0,53,{},[],{}
13/05/2024,fY5KxduLe4U,🔴AO VIVO | Ceará empata com o CRB; Notícias do Fortaleza | Esportes do Povo,O POVO,2024-05-07T15:06:05Z,"Participe pelo nosso Whatsapp (85) 9699-2299, e pelas nossas redes sociais twitter e instagram @opovocbn. Estamos ao vivo ...",[],UCj-RTZE-V3Q6jleatRR9k2A,4216,449,0,4,{},[],{}
13/05/2024,tyVIAPnavjo,SÃO PAULO 2 X 1 FLUMINENSE - Campeonato Brasileiro - 6ª Rodada - 13/05/2024 - AO VIVO,Tupi Esportes,2024-05-13T19:42:03Z,FUTEBOL é na TUPI❗ Estádio Morumbis - SP Narração  José Carlos Araújo Comentários  Eraldo Leite A TUPI conta tudo ...,[],UC9u7p59wlSaAuBmPevKWo9A,64412,2522,0,0,{},[],{}
13/05/2024,03djyLPpY48,ÉPICO! Real Madrid VENCE o Manchester City NOS PÊNALTIS e vai à SEMIFINAL da Champions! | PÓS-JOGO,Jovem Pan Esportes,2024-04-17T22:51:12Z,Assista ao pós-jogo da Champions League na Jovem Pan Esportes. Crédito da foto usada na thumbnail: ADAM VAUGHAN/EFE ...,[],UCv-Nx8pSfG_LxbViMz14RWQ,239870,4976,0,39,{},[],{}
13/05/2024,jUpjcaBnyyo,SENSACIONAL! OLHA o que o presidente do Atlético-GO FALOU após DERROTA pro São Paulo! SURPREENDENTE!,Jovem Pan Esportes,2024-04-22T00:16:28Z,"SURPREENDENTE! O Atlético Goianiense perdeu para o São Paulo por 3 gols a 0 hoje, e o presidente do Dragão, Adson Batista ...",[],UCv-Nx8pSfG_LxbViMz14RWQ,167525,5872,0,518,{},[],{}
13/05/2024,Z2U-cJ1DYdE,Corinthians 3 x 0 Fluminense - 28/04/2024 - Brasileirão,Jovem Pan Esportes,2024-04-28T21:11:03Z,Jogo Corinthians x Fluminense ao vivo hoje: assista à transmissão com imagem dos jornalistas da Jovem Pan Esportes.,[],UCv-Nx8pSfG_LxbViMz14RWQ,473086,4318,0,51,{},[],{}
13/05/2024,DkZBVcq0Gu4,É TRICAMPEÃO! Palmeiras VENCE o Santos e CONQUISTA o 3º TÍTULO PAULISTA SEGUIDO! | CANELADA,Jovem Pan Esportes,2024-04-08T00:42:27Z,"Veja a íntegra do Canelada. Crédito das fotos usadas na thumbnail: Fabio Menotti/Palmeiras/by Canon Siga o canal ""Jovem Pan ...",[],UCv-Nx8pSfG_LxbViMz14RWQ,235202,6951,0,148,{},[],{}
13/05/2024,45UTIRDHsi8,"&quot;ME FALARAM que ISSO NÃO CAIU BEM DENTRO do Flamengo, cara! O Tite...&quot; Pilhado DÁ INFORMAÇÃO!",Jovem Pan Esportes,2024-05-09T03:44:19Z,"Informações de bastidores do Flamengo de Tite: segundo Pilhado, ""não caiu bem dentro do clube"", entre conselheiros e alguns ...",[],UCv-Nx8pSfG_LxbViMz14RWQ,293806,12225,0,823,{},[],{}
13/05/2024,0R8Ss0VZ0zs,&quot;É INACREDITÁVEL! O Palmeiras do Abel é o ÚNICO TIME CAPAZ de...&quot; VIRADA SURREAL contra o Del Valle!,Jovem Pan Esportes,2024-04-25T03:53:28Z,"VIRADA SURREAL! O Palmeiras fez 3 gols a 2 no Independiente del Valle hoje pela Libertadores, e Abel Ferreira foi exaltado no ...",[],UCv-Nx8pSfG_LxbViMz14RWQ,287964,12003,0,922,{},[],{}
13/05/2024,bs19Nv0nSTs,OS ESPORTES MAIS ENGRAÇADOS DO MUNDO!!!!,Reversão,2022-04-20T22:18:32Z,SEMPRE REVERSÃO!! SE INSCREVA E DEIXE O LIKE! Insta: https://bit.ly/2G8xoDx OUTROS CANAIS: VLOGS: @CanalCanalha ...,[],UCyEHckavb7hMh5f8j4WEiIg,486189,55972,0,1377,{},[],{}
13/05/2024,AdXY6Hq3k8k,América-RN 1 x 2 Corinthians - 01/05/2024 - Copa do Brasil,Jovem Pan Esportes,2024-05-02T01:19:57Z,Jogo América-RN x Corinthians ao vivo hoje: assista à transmissão com imagem dos jornalistas da Jovem Pan Esportes.,[],UCv-Nx8pSfG_LxbViMz14RWQ,610407,4751,0,31,{},[],{}
13/05/2024,HPwOQiuQzZE,RÁDIO ESPORTES  - 09/05/2024,Itatiaia Esporte,2024-05-09T16:06:48Z,Explore o mundo do esporte durante o seu almoço com o Rádio Esportes! Nosso programa oferece informações precisas e ...,[],UCezhRry1J2kNRNCdNDHimNA,9489,500,0,4,{},[],{}
13/05/2024,BuOl6Pi61Oo,🔴AO VIVO | Fortaleza sofre goleada na Sul-Americana; Preparação do Ceará | Esportes do Povo,O POVO,2024-05-09T15:06:18Z,"Participe pelo nosso Whatsapp (85) 9699-2299, e pelas nossas redes sociais twitter e instagram @opovocbn. Estamos ao vivo ...",[],UCj-RTZE-V3Q6jleatRR9k2A,3205,341,0,4,{},[],{}
13/05/2024,5i64nqk9Zyo,ESPORTES MAIS PERIGOS0S DO MUNDO!!,Reversão,2022-06-12T20:22:13Z,SEMPRE REVERSÃO!! SE INSCREVA E DEIXE O LIKE! Insta: https://bit.ly/2G8xoDx OUTROS CANAIS: VLOGS: @CanalCanalha ...,[],UCyEHckavb7hMh5f8j4WEiIg,340595,46297,0,174,{},[],{}
13/05/2024,_9wqQv6tx4c,RÁDIO ESPORTES  - 08/05/2024,Itatiaia Esporte,2024-05-08T16:10:59Z,Explore o mundo do esporte durante o seu almoço com o Rádio Esportes! Nosso programa oferece informações precisas e ...,[],UCezhRry1J2kNRNCdNDHimNA,10774,606,0,3,{},[],{}
13/05/2024,vqNUYp53SA8,&quot;EU TÔ EMPOLGADO SIM! O São Paulo TEM VERGONHA NA CARA! Se CLASSIFICOU e...&quot; VITÓRIA sobre Cobresal!,Jovem Pan Esportes,2024-05-09T02:47:46Z,O São Paulo de Zubeldía venceu o Cobresal por 3 gols a 1 hoje e se classificou às oitavas de final da Libertadores. O SPFC foi ...,[],UCv-Nx8pSfG_LxbViMz14RWQ,182107,9051,0,483,{},[],{}
13/05/2024,6sBONdiWNm0,FALOU UM ABSURDO??? OPINIÃO POLÊMICA sobre Vinicius Júnior e Neymar FERVE DEBATE após Bayern x Real!,Jovem Pan Esportes,2024-04-30T22:30:00Z,"Vinicius Júnior, que anotou dois gols em Bayern de Munique x Real Madrid hoje pela Champions League, vai se tornar MAIOR ...",[],UCv-Nx8pSfG_LxbViMz14RWQ,202609,8327,0,1752,{},[],{}
13/05/2024,KcbteUxPQ58,INCRÍVEL! Palmeiras consegue VIRADA SURREAL contra o Del Valle NO FIM; Flamengo PERDE! | CANELADA,Jovem Pan Esportes,2024-04-25T03:44:14Z,Veja a íntegra do Canelada... Crédito da foto usada na thumbnail: Luciano González/EFE Baixe o app Panflix: ...,[],UCv-Nx8pSfG_LxbViMz14RWQ,325562,12780,0,179,{},[],{}
13/05/2024,LsRpF1VMFoY,RÁDIO ESPORTES  - 09/04/2024,Itatiaia Esporte,2024-04-09T16:06:13Z,Explore o mundo do esporte durante o seu almoço com o Rádio Esportes! Nosso programa oferece informações precisas e ...,[],UCezhRry1J2kNRNCdNDHimNA,11677,702,0,12,{},[],{}
13/05/2024,Sah_jokx03A,"&quot;EU NÃO DUVIDO NADA DISSO! Se o Augusto Melo TIVER CULHÃO, ele...&quot; DEBATE FERVE sobre o Corinthians!",Jovem Pan Esportes,2024-04-23T15:37:47Z,O Corinthians vai fazer jogo importante contra o Argentinos Juniors hoje ao vivo e com imagem pela Copa Sul-Americana. Veja o ...,[],UCv-Nx8pSfG_LxbViMz14RWQ,96223,3696,0,167,{},[],{}
13/05/2024,eKMdrvqxww0,"O Bayern foi ROUBADO contra o Real Madrid??? &quot;Cara, a ARBITRAGEM pra mim...&quot; POLÊMICA na Champions!",Jovem Pan Esportes,2024-05-08T21:55:49Z,O gol anulado estava impedido? O Bayern foi roubado pela arbitragem contra o Real Madrid na Champions League? Assista ao ...,[],UCv-Nx8pSfG_LxbViMz14RWQ,214581,6070,0,1763,{},[],{}
13/05/2024,6KdBZRI72Lo,São Paulo 1 x 2 Fortaleza - 13/04/2024 - Brasileirão,Jovem Pan Esportes,2024-04-14T03:17:45Z,Jogo São Paulo x Fortaleza ao vivo hoje: assista à transmissão com imagem dos jornalistas da Jovem Pan Esportes. Narração de ...,[],UCv-Nx8pSfG_LxbViMz14RWQ,729923,8398,0,43,{},[],{}
13/05/2024,2btcwHxPO4M,OS 10 ESPORTES COM MAIS MEDALHAS PARA O BRASIL EM OLIMPÍADAS,TNT Sports Brasil,2021-07-24T21:00:01Z,Você sabia disso? Vitor Sergio Rodrigues elenca quais modalidades trouxeram mais medalhas para o Brasil em Olimpíadas!,[],UCs-6sCz2LJm1PrWQN4ErsPw,20985,1822,0,43,{},[],{}
13/05/2024,4TGwX3GmQwo,🔴AO VIVO | Fortaleza enfrenta Nacional Potosí na Bolívia; Embarque do Ceará | Esportes do Povo,O POVO,2024-05-08T15:04:29Z,"Participe pelo nosso Whatsapp (85) 9699-2299, e pelas nossas redes sociais twitter e instagram @opovocbn. Estamos ao vivo ...",[],UCj-RTZE-V3Q6jleatRR9k2A,3752,442,0,0,{},[],{}
13/05/2024,JNAF3v3WSxE,&quot;OLHA ISSO! ACABOU A PACIÊNCIA DO CÁSSIO! Ele DISPAROU que...&quot; DESABAFO em ENTREVISTA no Corinthians,Jovem Pan Esportes,2024-04-24T03:16:47Z,"Em entrevista, Cássio desabafa após a derrota do Corinthians para o Argentinos Juniors em jogo hoje pela Copa Sul-Americana.",[],UCv-Nx8pSfG_LxbViMz14RWQ,487604,14757,0,1292,{},[],{}
13/05/2024,D8PSDiw7XPg,&quot;NINGUÉM LEMBRA MAIS DISSO! Mas o Vinicius Júnior com o Neymar na Copa...&quot; Mauro Cezar FALA TUDO!,Jovem Pan Esportes,2024-05-01T15:34:07Z,Vinicius Júnior brilhou e fez dois gols em Bayern de Munique x Real Madrid pela Champions League. A atuação do brasileiro foi ...,[],UCv-Nx8pSfG_LxbViMz14RWQ,374995,13747,0,930,{},[],{}
13/05/2024,W3eeosjLSrs,&quot;O Palmeiras É FREGUÊS do São Paulo em DECISÃO! A REAL é que...&quot; Pilhado DISPARA após a Supercopa!,Jovem Pan Esportes,2024-02-04T21:34:13Z,"O São Paulo foi campeão da Supercopa do Brasil contra o Palmeiras nos pênaltis, e Pilhado disparou no Canelada, da Jovem ...",[],UCv-Nx8pSfG_LxbViMz14RWQ,115658,6369,0,682,{},[],{}
13/05/2024,uho6AYmmkUE,"&quot;Eu SEMPRE FALEI ISSO do Tite! Pra mim, o MAIOR PROBLEMA dele é...&quot; Mauro Cezar ANALISA o Flamengo!",Jovem Pan Esportes,2024-05-07T17:03:58Z,Hoje tem o jogo Palestino x Flamengo ao vivo e com imagem pela Libertadores. Assista ao comentário de Mauro Cezar Pereira ...,[],UCv-Nx8pSfG_LxbViMz14RWQ,263144,8513,0,342,{},[],{}
13/05/2024,DTgbIClDs9Y,Palmeiras PERDE para o LÍDER Athletico-PR; Flamengo SE RECUPERA e BATE o Corinthians! | BATE-PRONTO,Jovem Pan Esportes,2024-05-13T17:09:39Z,O Bate-Pronto de hoje falará tudo sobre os jogos deste fim de semana pelo Brasileirão. O Palmeiras decepcionou e perdeu para ...,[],UCv-Nx8pSfG_LxbViMz14RWQ,156100,6518,0,57,{},[],{}
13/05/2024,jTJCvJgpTG0,MEU DEUS! QUE FALHA BISONHA DO CÁSSIO! OLHA essa ENTREGADA do goleiro em Juventude x Corinthians!,Jovem Pan Esportes,2024-04-18T00:56:14Z,"QUE FALHA DO CÁSSIO! O goleiro do Corinthians não foi bem, e o Juventude fez 2 gols a 0 com melhores momentos hoje pelo ...",[],UCv-Nx8pSfG_LxbViMz14RWQ,96849,1287,0,355,{},[],{}
13/05/2024,kDtbhJdGSCM,Corinthians EMPATA com o Galo; Flamengo VENCE Atlético-GO com pênalti polêmico! | CANELADA,Jovem Pan Esportes,2024-04-14T22:52:33Z,"Veja a íntegra do Canelada... Crédito da foto usada na thumbnail: Pedro Souza/Atlético Siga o canal ""Jovem Pan Esportes"" no ...",[],UCv-Nx8pSfG_LxbViMz14RWQ,132912,3882,0,107,{},[],{}
13/05/2024,ft5cjq4ye5s,&quot;É PROCESSO DE FRITURA! E vai ficar INSUPORTÁVEL se...&quot; Mauro Cezar MANDA REAL sobre Tite e Flamengo,Jovem Pan Esportes,2024-05-10T17:13:28Z,Tite será demitido do Flamengo se não vencer o Corinthians? Protestos no CT rubro-negro aumentaram a pressão sobre o ...,[],UCv-Nx8pSfG_LxbViMz14RWQ,474438,18215,0,1545,{},[],{}
13/05/2024,19hDxmTNpXg,Flamengo 0 x 2 Botafogo - 28/04/2024 - Brasileirão,Jovem Pan Esportes,2024-04-28T16:12:48Z,Jogo Flamengo x Botafogo ao vivo hoje: assista à transmissão com imagem dos jornalistas da Jovem Pan Esportes. Narração de ...,[],UCv-Nx8pSfG_LxbViMz14RWQ,982831,8089,0,133,{},[],{}
13/05/2024,VOy63WPLnPU,Barcelona-EQU 0 x 2 São Paulo - 25/04/2024 - Libertadores,Jovem Pan Esportes,2024-04-26T02:10:16Z,Jogo Barcelona-EQU X São Paulo ao vivo hoje: assista à transmissão com imagem dos jornalistas da Jovem Pan Esportes.,[],UCv-Nx8pSfG_LxbViMz14RWQ,592703,6210,0,10,{},[],{}
13/05/2024,hddWDTd-INM,Esporte que virou FEBRE entre jogadores? 🎾,Euro Fut,2024-05-07T16:29:26Z,Conheça todos os nossos projetos: https://linktr.ee/eurofute Aparentemente diversos jogadores de futebol começaram a jogar e ...,[],UCwSnqMoMhWa3AWn3WEFpF-Q,196704,22598,0,75,{},[],{}
13/05/2024,YXvOf3SRg6Y,Flamengo 1 x 0 Amazonas - 01/05/2024 - Copa do Brasil,Jovem Pan Esportes,2024-05-02T02:38:57Z,Jogo Flamengo x Amazonas ao vivo hoje: assista à transmissão com imagem dos jornalistas da Jovem Pan Esportes. Narração ...,[],UCv-Nx8pSfG_LxbViMz14RWQ,426220,4259,0,42,{},[],{}
13/05/2024,lYQeZlSmWtg,&quot;É ASSUSTADOR! Esse elenco do Corinthians GANHA R$ 22 MILHÕES e VAI LUTAR pra NÃO CAIR!&quot; OLHA ISSO!,Jovem Pan Esportes,2024-04-22T16:40:25Z,"O Corinthians vai lutar para ser não ser rebaixado? A crise no Timão de Augusto Melo, que ainda não marcou sequer um gol no ...",[],UCv-Nx8pSfG_LxbViMz14RWQ,357958,11748,0,639,{},[],{}
13/05/2024,I7Fr9J-yzbE,RÁDIO ESPORTES  - 07/05/2024,Itatiaia Esporte,2024-05-07T16:05:55Z,Explore o mundo do esporte durante o seu almoço com o Rádio Esportes! Nosso programa oferece informações precisas e ...,[],UCezhRry1J2kNRNCdNDHimNA,10939,538,0,5,{},[],{}
13/05/2024,Ren0s1BARmo,"NOVA JOIA BRILHA, e Palmeiras VENCE o Liverpool-URU DE VIRADA na Libertadores! | CANELADA",Jovem Pan Esportes,2024-04-12T03:02:43Z,Veja a íntegra do Canelada. Crédito da foto usada na thumbnail: ANDERSON LIRA/FOTOARENA/ESTADÃO CONTEÚDO Siga o ...,[],UCv-Nx8pSfG_LxbViMz14RWQ,146749,4274,0,53,{},[],{}
13/05/2024,Ha6R_o5OfFY,&quot;É INFORMAÇÃO! Gente de DENTRO do Palmeiras ME FALOU que o John Kennedy...&quot; OLHA o que Vampeta FALOU,Jovem Pan Esportes,2024-05-01T17:33:38Z,"John Kennedy no Palmeiras: segundo informações de Vampeta, o atacante, que foi afastado de novo do Fluminense por ...",[],UCv-Nx8pSfG_LxbViMz14RWQ,264314,8115,0,465,{},[],{}
13/05/2024,mtBGb1hQoCk,&quot;ISSO É UM LIXO! UMA COISA GROTESCA!&quot; ÁUDIO DO VAR do GOL ANULADO do Palmeiras PROVOCA DEBATE!,Jovem Pan Esportes,2024-05-03T16:06:56Z,"A linha do impedimento no gol anulado de Rony, do Palmeiras, estava certa? O áudio do VAR do jogo contra o Botafogo-SP foi ...",[],UCv-Nx8pSfG_LxbViMz14RWQ,333342,9677,0,1369,{},[],{}
13/05/2024,G_TZk5fPLT8,"&quot;É ASSIM QUE TEM QUE SER! O Palmeiras, como todo time com VERGONHA NA CARA...&quot; Mauro Cezar ELOGIA!",Jovem Pan Esportes,2024-05-10T16:41:13Z,"Aprendeu, Flamengo? O Palmeiras venceu o Liverpool, do Uruguai, por 5 gols a 0 pela Libertadores, e Mauro Cezar Pereira ...",[],UCv-Nx8pSfG_LxbViMz14RWQ,354437,11977,0,586,{},[],{}
13/05/2024,GhYaioIvjRw,&quot;Fair Play financeiro não prejudica...&quot; Mauro Cezar É DIRETO sobre a gestão financeira dos clubes.,Jovem Pan Esportes,2023-12-27T16:13:51Z,"""Fair Play financeiro não prejudica..."" Mauro Cezar É DIRETO sobre a gestão financeira dos clubes. A discussão no Bate Pronto é ...",[],UCv-Nx8pSfG_LxbViMz14RWQ,337569,11950,0,1387,{},[],{}
13/05/2024,wuLGxFbaclc,É HOJE! Dorival ESTREIA na Seleção em JOGAÇO contra a Inglaterra em Wembley! | CAMISA 10,Jovem Pan Esportes,2024-03-23T15:33:38Z,"O Camisa 10 deste sábado falará tudo sobre a Seleção Brasileira, que enfrenta a Inglaterra em amistoso hoje, às 16h, em ...",[],UCv-Nx8pSfG_LxbViMz14RWQ,54229,1525,0,21,{},[],{}
13/05/2024,2H77ULSGK6M,Nacional-PAR 0 x 2 Corinthians - 07/05/2024 - Copa Sul-Americana,Jovem Pan Esportes,2024-05-08T00:41:24Z,Jogo Nacional x Corinthians ao vivo hoje: assista à transmissão com imagem dos jornalistas da Jovem Pan Esportes. Narração ...,[],UCv-Nx8pSfG_LxbViMz14RWQ,203400,2484,0,4,{},[],{}
13/05/2024,KiSUuQCZbe0,RÁDIO ESPORTES  - 04/05/2024,Itatiaia Esporte,2024-05-04T16:06:31Z,Explore o mundo do esporte durante o seu almoço com o Rádio Esportes! Nosso programa oferece informações precisas e ...,[],UCezhRry1J2kNRNCdNDHimNA,12821,584,0,2,{},[],{}
13/05/2024,3nlmHhsNuMw,&quot;FOI HISTÓRICO! O Cuca foi MUITO CORAJOSO de ter FALADO ISSO e...&quot; FORTE PRONUNCIAMENTO REPERCUTE!,Jovem Pan Esportes,2024-03-11T17:20:22Z,"O pronunciamento de Cuca sobre as mulheres em entrevista coletiva no Athletico-PR repercutiu bastante. O treinador, que havia ...",[],UCv-Nx8pSfG_LxbViMz14RWQ,132154,6165,0,782,{},[],{}
14/05/2024,aPdPUzYEWHo,Corinthians x Argentinos Juniors - COM IMAGENS e narração de Diguinho Coruja | Sul-Americana 2024,SBT Sports,2024-05-13T19:20:04Z,A transmissão mais bem-humorada da Copa Sul-Americana retorna na noite desta terça-feira (14). Além da exibição tradicional ...,[],UCxc3marqP9BJSkQ0_K4mqDg,128509,30443,0,0,{},[],{}
14/05/2024,jgpaiGA3Pr8,Corinthians x Argentinos Juniors - AO VIVO - 14/05/2024 - Sul-Americana,Jovem Pan Esportes,2024-05-14T20:34:59Z,Jogo Corinthians x Argentinos Juniors ao vivo hoje: assista à transmissão com imagem dos jornalistas da Jovem Pan Esportes.,[],UCv-Nx8pSfG_LxbViMz14RWQ,11832,1791,0,0,{},[],{}
14/05/2024,IOlQE4rHNL0,Corinthians x Argentinos Juniors - COM IMAGENS e narração de Diguinho Coruja | Sul-Americana 2024,SBT,2024-05-13T23:22:49Z,A transmissão mais bem-humorada da Copa Sul-Americana retorna na noite desta terça-feira (14). Além da exibição tradicional ...,[],UCR3TOnFWDeAlT-Ho6LueDmg,86942,22730,0,0,{},[],{}
14/05/2024,dvhBwkA25Og,"&quot;ISSO É JUSTO??? EU NÃO ACHO JUSTO! Pra mim, o Dorival...&quot; CONVOCAÇÃO da Seleção PROVOCA DEBATE!",Jovem Pan Esportes,2024-05-10T16:12:30Z,Convocação da Seleção Brasileira para a Copa América: Dorival Júnior convocou hoje apenas três jogadores que atuam no ...,[],UCv-Nx8pSfG_LxbViMz14RWQ,380196,12316,0,1827,{},[],{}
14/05/2024,aN1OXOnc-64,VEJA como foi a CONVOCAÇÃO da Seleção Brasileira para a Copa América! | BATE-PRONTO,Jovem Pan Esportes,2024-05-10T17:11:43Z,O Bate-Pronto de hoje exibirá e debaterá ao vivo a convocação de Dorival Júnior na Seleção Brasileira. O treinador anunciará os ...,[],UCv-Nx8pSfG_LxbViMz14RWQ,259300,10316,0,101,{},[],{}
14/05/2024,2RVs1yhDLgg,São Paulo VENCE e SE CLASSIFICA às 8ªs da Libertadores; Vini BRILHA na Champions! | BATE-PRONTO,Jovem Pan Esportes,2024-05-09T17:09:16Z,"O Bate-Pronto de hoje falará tudo sobre a vitória do São Paulo por 3 a 1 sobre o Cobresal, ontem de noite, no Chile. O resultado ...",[],UCv-Nx8pSfG_LxbViMz14RWQ,184842,7077,0,119,{},[],{}
14/05/2024,WQZ4MVHaeog,&quot;JÁ É UMA MUDANÇA! A INFORMAÇÃO é que o Flamengo contra o Corinthians...&quot; JOGÃO PROVOCA DEBATE!,Jovem Pan Esportes,2024-05-10T17:45:01Z,"Amanhã tem o jogo Flamengo x Corinthians ao vivo e com imagem. Tite está sob pressão, e o Timão busca subir na tabela do ...",[],UCv-Nx8pSfG_LxbViMz14RWQ,196408,7404,0,398,{},[],{}
14/05/2024,6vH2Bu8rIi4,"&quot;PODE TER UM RACHA, gente! O Flamengo SE POSICIONOU contra a...&quot; OLHA o que PROVOCOU DEBATE!",Jovem Pan Esportes,2024-05-11T22:02:09Z,"O Flamengo, que venceu o Corinthians por 2 gols a 0 hoje, se posicionou contra a paralisação do futebol brasileiro por causa da ...",[],UCv-Nx8pSfG_LxbViMz14RWQ,75852,2146,0,238,{},[],{}
14/05/2024,DVaIujjsWWw,Palmeiras e São Paulo VENCEM pela Copa do Brasil; Flamengo e Corinthians JOGAM amanhã! | BATE-PRONTO,Jovem Pan Esportes,2024-05-03T17:11:29Z,"O Bate-Pronto de hoje debaterá as vitórias de Palmeiras e São Paulo, ontem de noite, na Copa do Brasil. O Verdão bateu o ...",[],UCv-Nx8pSfG_LxbViMz14RWQ,167445,6250,0,44,{},[],{}
14/05/2024,nHErO4Ft3oE,"&quot;ISSO É UMA MALUQUICE, gente! O Tite tem que ser COBRADO? SIM! Mas...&quot; Mauro Cezar ANALISA Flamengo!",Jovem Pan Esportes,2024-05-03T21:15:01Z,"Tem que ser demitido? Os gritos de ""Fora, Tite"" ecoaram na torcida do Flamengo após a vitória por 1 a 0 sobre o Amazonas com ...",[],UCv-Nx8pSfG_LxbViMz14RWQ,290181,10865,0,618,{},[],{}
14/05/2024,bhmgW3PlmbY,"Flamengo VENCE, mas é VAIADO; Tite é XINGADO; Carlos Miguel BRILHA no Corinthians! | BATE-PRONTO",Jovem Pan Esportes,2024-05-02T17:05:49Z,"O Bate-Pronto de hoje falará tudo sobre os jogos de ontem pela Copa do Brasil. No Maracanã, o Flamengo venceu o Amazonas ...",[],UCv-Nx8pSfG_LxbViMz14RWQ,226586,8832,0,85,{},[],{}
14/05/2024,XLENpHKzK-o,"&quot;EU FALO! Se o Vinicius Júnior não for o MELHOR DO MUNDO caso o Real GANHE a Champions, EU VOU...&quot;",Jovem Pan Esportes,2024-05-09T16:51:13Z,"Vinicius Júnior x Bayern de Munique: o brasileiro do Real Madrid teve skills, melhores momentos e brilhou de novo na semifinal ...",[],UCv-Nx8pSfG_LxbViMz14RWQ,231389,8994,0,993,{},[],{}
14/05/2024,u0ywlRe3ZMs,Flamengo PERDE pro Palestino e CAI para 3º na Libertadores; Corinthians VENCE na Sula! | BATE-PRONTO,Jovem Pan Esportes,2024-05-08T17:11:26Z,O Bate-Pronto de hoje debaterá a situação do futebol brasileiro em meio ao estado de calamidade no Rio Grande do Sul devido ...,[],UCv-Nx8pSfG_LxbViMz14RWQ,307765,13613,0,132,{},[],{}
14/05/2024,C6SaPizE91Q,&quot;É ÓBVIO! O Tite está ARRISCADO de SER DEMITIDO do Flamengo se...&quot; CRISE PROVOCA DEBATE!,Jovem Pan Esportes,2024-05-08T16:07:57Z,Tite pode ser demitido do Flamengo em caso de má atuação contra o Corinthians no sábado? Seria um erro da diretoria ...,[],UCv-Nx8pSfG_LxbViMz14RWQ,381681,14220,0,1214,{},[],{}
14/05/2024,Gb_IFFPMqBk,Flamengo 2 x 0 Corinthians - 11/05/2024 - Brasileirão,Jovem Pan Esportes,2024-05-11T22:15:12Z,Jogo Flamengo x Corinthians ao vivo hoje: assista à transmissão com imagem dos jornalistas da Jovem Pan Esportes. Narração ...,[],UCv-Nx8pSfG_LxbViMz14RWQ,1130802,11627,0,35,{},[],{}
14/05/2024,YlegND4P_Pg,"&quot;É UMA VERGONHA! É INADMISSÍVEL! Cara, o que o Vasco FEZ...&quot; VEXAME, SAÍDA de Ramón Díaz e CRISE!",Jovem Pan Esportes,2024-04-28T23:32:08Z,"Ramón Diaz pediu demissão ou foi demitido? O Vasco foi goleado, levou 4 gols a 0 do Criciúma e, logo após o jogo, anunciou a ...",[],UCv-Nx8pSfG_LxbViMz14RWQ,132070,4943,0,327,{},[],{}
14/05/2024,AWiTgFht9UA,São Paulo 0 x 0 Palmeiras - 29/04/2024 - Brasileirão,Jovem Pan Esportes,2024-04-30T01:22:15Z,Jogo São Paulo x Palmeiras ao vivo hoje: assista à transmissão com imagem dos jornalistas da Jovem Pan Esportes. Narração ...,[],UCv-Nx8pSfG_LxbViMz14RWQ,1560799,14557,0,29,{},[],{}
14/05/2024,21DVtzR19LQ,Bragantino 1 x 1 Flamengo - 04/05/2024 - Brasileirão,Jovem Pan Esportes,2024-05-04T23:47:00Z,Jogo Bragantino x Flamengo ao vivo hoje: assista à transmissão com imagem dos jornalistas da Jovem Pan Esportes. Narração ...,[],UCv-Nx8pSfG_LxbViMz14RWQ,1203690,8764,0,91,{},[],{}
14/05/2024,9Dn6waQKwzM,"&quot;É IMPRESSIONANTE! Tem que SE RENDER ao Zubeldía! O São Paulo TÁ CONVENCENDO, NÃO É COVARDE e...&quot;",Jovem Pan Esportes,2024-05-14T15:33:04Z,O São Paulo de Zubeldía venceu o Fluminense por 2 gols a 1 ontem. O SPFC ainda não perdeu sob o comando do técnico ...,[],UCv-Nx8pSfG_LxbViMz14RWQ,178250,9844,0,509,{},[],{}
14/05/2024,_rl2BpxGxVk,FÜLLKRUG MARCA E BORUSSIA DORTMUND BATE O PSG EM NOITE APAGADA DE MBAPPÉ! - MELHOR DA LIGA,TNT Sports Brasil,2024-05-01T21:58:56Z,Borussia Dortmund e Paris Saint-Germain se enfrentam pela ida da semifinal da Champions League 2023/24! Você acompanha ...,[],UCs-6sCz2LJm1PrWQN4ErsPw,1524861,26134,0,22,{},[],{}
14/05/2024,ryZ8Qz188Vw,&quot;FOI TUDO UM ABSURDO...&quot; Mauro Cezar e Pilhado DETONAM decisões do VAR na partida do Flamengo!,Jovem Pan Esportes,2024-05-05T17:22:11Z,"O Flamengo foi até Bragança Paulista e empatou em 1 x 1 com o Bragantino, em um jogo cheio de polêmicas de arbitragem, ...",[],UCv-Nx8pSfG_LxbViMz14RWQ,486671,17360,0,2434,{},[],{}
14/05/2024,wIbDdxGsyDE,PILHADO VOLTOU COM TUDO! &quot;É ISSO! O Flamengo do Tite VAI CALAR A MINHA BOCA se...&quot;,Jovem Pan Esportes,2024-04-22T15:33:59Z,"Pilhado voltou ao Bate-Pronto, da Jovem Pan Esportes, e falou sobre o Flamengo de Tite após o empate sem gols contra o ...",[],UCv-Nx8pSfG_LxbViMz14RWQ,241395,13965,0,812,{},[],{}
14/05/2024,RIIp05CuwD4,Corinthians DOMINA o Fluminense e VOLTA A VENCER; Flamengo PERDE; Hoje tem CHOQUE-REI! | BATE-PRONTO,Jovem Pan Esportes,2024-04-29T17:13:52Z,"O Bate-Pronto de hoje falará tudo sobre os jogos deste fim de semana pelo Brasileirão. Em Itaquera, o Corinthians não deu ...",[],UCv-Nx8pSfG_LxbViMz14RWQ,185190,7643,0,75,{},[],{}
14/05/2024,m7FHCNge_Go,"Palmeiras VENCE após VIRADA ÉPICA contra Del Valle; Flamengo PERDE, e Tite VIRA ALVO! | BATE-PRONTO",Jovem Pan Esportes,2024-04-25T17:07:06Z,O Bate-Pronto de hoje falará tudo sobre os jogos de ontem pela Libertadores. Tanto Palmeiras quanto Flamengo entraram em ...,[],UCv-Nx8pSfG_LxbViMz14RWQ,198246,8068,0,86,{},[],{}
14/05/2024,vkv6w18jqg0,PEGOU FOGO! &quot;VOCÊ É RIDÍCULO! O São Paulo É SIM um time que pode...&quot; Pilhado REBATE Flavio Prado!,Jovem Pan Esportes,2024-05-03T03:41:32Z,O São Paulo de Luis Zubeldía venceu o Águia de Marabá por 3 gols a 1 hoje pela Copa do Brasil e fez o debate ferver ao vivo ...,[],UCv-Nx8pSfG_LxbViMz14RWQ,248584,8056,0,1394,{},[],{}
14/05/2024,8ZdkDh21fOg,&quot;TEM QUE RESPEITAR o Vinicius Júnior! E DEU PRA VER ele FALANDO pro Ancelotti que...&quot; Bayern x Real,Jovem Pan Esportes,2024-04-30T22:04:48Z,"Bayern de Munique x Real Madrid na Champions League: Vinicius Júnior fez dois gols, ""se irritou"" com Ancelotti e foi o grande ...",[],UCv-Nx8pSfG_LxbViMz14RWQ,243147,8264,0,386,{},[],{}
14/05/2024,r6jmeK72f_8,&quot;SÓ PODE ESTAR DE SACANAGEM! A INFORMAÇÃO de hoje é que o Flamengo...&quot; OLHA o que REVOLTOU Pilhado!,Jovem Pan Esportes,2024-05-09T17:25:40Z,"Uma informação de hoje sobre o Flamengo de Tite, que vive crise na Libertadores, revoltou Pilhado ao vivo no Bate-Pronto.",[],UCv-Nx8pSfG_LxbViMz14RWQ,417123,15626,0,1361,{},[],{}
14/05/2024,ExxmKU-Wn6w,"PILHADO SURTOU! &quot;COVAAARDE! TITE, VOCÊ É UM...&quot; OLHA essa PISTOLADA após Bolívar 2 x 1 Flamengo!",Jovem Pan Esportes,2024-04-25T02:52:26Z,"PILHADO PISTOLOU! Após o Flamengo de Tite perder para o Bolívar por 2 gols a 1 hoje pela Libertadores, o apresentador do ...",[],UCv-Nx8pSfG_LxbViMz14RWQ,363828,19278,0,2707,{},[],{}
14/05/2024,VWUgFDTRvZg,&quot;É RIDÍCULO! NÃO TEM MAIS DESCULPA! O Flamengo do Tite VIROU UM TIME de...&quot; Pilhado DETONA!,Jovem Pan Esportes,2024-05-02T16:30:06Z,Pilhado detonou o Flamengo de Tite após a vitória por 1 a 0 sobre o Amazonas na Copa do Brasil. Veja mais um vídeo do ...,[],UCv-Nx8pSfG_LxbViMz14RWQ,223920,9955,0,802,{},[],{}
14/05/2024,2xW4c725Uyg,🔴AO VIVO | Ceará perde para o CRB; Fortaleza encara o Corinthians | Esportes do Povo,O POVO,2024-05-03T15:06:25Z,"Participe pelo nosso Whatsapp (85) 9699-2299, e pelas nossas redes sociais twitter e instagram @opovocbn. Estamos ao vivo ...",[],UCj-RTZE-V3Q6jleatRR9k2A,3935,441,0,0,{},[],{}
14/05/2024,BYztErWyfns,Corinthians 0 x 0 Fortaleza - 04/05/2024 - Brasileirão,Jovem Pan Esportes,2024-05-05T03:10:42Z,Jogo Corinthians x Fortaleza ao vivo hoje: assista à transmissão com imagem dos jornalistas da Jovem Pan Esportes. Narração ...,[],UCv-Nx8pSfG_LxbViMz14RWQ,408458,4869,0,5,{},[],{}
14/05/2024,GE2RpVdPVXA,Presidente do Grêmio CITA Flamengo e paulistas ao COBRAR a PARALISAÇÃO do Brasileirão | VEJA DEBATE,Jovem Pan Esportes,2024-05-07T16:34:07Z,"Chuvas e enchentes no Rio Grande do Sul: o presidente do Grêmio, Alberto Guerra, cobrou a CBF pela paralisação do ...",[],UCv-Nx8pSfG_LxbViMz14RWQ,211370,6477,0,826,{},[],{}
14/05/2024,vCRO6T3KgT8,"&quot;QUAL É O PLANO? Se PARAR o campeonato, o MAIS LÓGICO pra mim seria que...&quot; Mauro Cezar dá SUGESTÃO!",Jovem Pan Esportes,2024-05-14T17:34:10Z,E se a CBF de fato paralisar o Brasileirão e a Copa do Brasil por causa da tragédia no Rio Grande do Sul? Qual plano seria ...,[],UCv-Nx8pSfG_LxbViMz14RWQ,168671,7984,0,922,{},[],{}
14/05/2024,Alie2BGJJ6Y,"&quot;É FANTÁSTICO, gente! AO CONTRÁRIO do Ronaldo, o NOVO DONO do Cruzeiro é...&quot; OLHA esse DEBATE!",Jovem Pan Esportes,2024-04-30T02:20:31Z,"Ronaldo VENDEU a SAF do Cruzeiro! Agora, Pedro Lourenço é o novo dono do clube celeste. O que esperar? Veja o debate no ...",[],UCv-Nx8pSfG_LxbViMz14RWQ,245512,9498,0,819,{},[],{}
14/05/2024,tHM9g01mViE,Palmeiras 2 x 1 Botafogo-SP - 02/05/2024 - Copa do Brasil,Jovem Pan Esportes,2024-05-03T02:44:09Z,Jogo Palmeiras x Botafogo/SP ao vivo hoje: assista à transmissão com imagem dos jornalistas da Jovem Pan Esportes. Narração ...,[],UCv-Nx8pSfG_LxbViMz14RWQ,469280,4320,0,19,{},[],{}
14/05/2024,K1Sgy-jdDVA,&quot;FOI UMA LAMBANÇA! ERRO CRASSO! O Flamengo...&quot; NOVO CONTRATO com a Globo é ANALISADO por Mauro Cezar,Jovem Pan Esportes,2024-04-09T16:35:05Z,Novo contrato do Flamengo com a TV Globo pelos direitos de transmissão do Brasileirão de 2025 a 2029: o clube rubro-negro ...,[],UCv-Nx8pSfG_LxbViMz14RWQ,383589,13311,0,952,{},[],{}
14/05/2024,03djyLPpY48,ÉPICO! Real Madrid VENCE o Manchester City NOS PÊNALTIS e vai à SEMIFINAL da Champions! | PÓS-JOGO,Jovem Pan Esportes,2024-04-17T22:51:12Z,Assista ao pós-jogo da Champions League na Jovem Pan Esportes. Crédito da foto usada na thumbnail: ADAM VAUGHAN/EFE ...,[],UCv-Nx8pSfG_LxbViMz14RWQ,239876,4976,0,39,{},[],{}
14/05/2024,8rc0bbo0VtM,É HOJE! Flamengo e São Paulo SE ENFRENTAM EM JOGÃO no Maracanã! | BATE-PRONTO - 17/04/24,Jovem Pan Esportes,2024-04-17T17:14:40Z,"O Bate-Pronto de hoje projetará o jogão de hoje entre Flamengo e São Paulo, no Maracanã, pela 2ª rodada do Brasileirão.",[],UCv-Nx8pSfG_LxbViMz14RWQ,180063,6432,0,34,{},[],{}
14/05/2024,Z2U-cJ1DYdE,Corinthians 3 x 0 Fluminense - 28/04/2024 - Brasileirão,Jovem Pan Esportes,2024-04-28T21:11:03Z,Jogo Corinthians x Fluminense ao vivo hoje: assista à transmissão com imagem dos jornalistas da Jovem Pan Esportes.,[],UCv-Nx8pSfG_LxbViMz14RWQ,473128,4319,0,51,{},[],{}
14/05/2024,-WX3wNwHi6w,"Racing x Corinthians - JOGO COMPLETO, com narração de Diguinho Coruja | Copa Sul-Americana 2024",SBT Sports,2024-04-03T03:11:02Z,"Vai começar a fase de grupos da Conmebol Sul-Americana. No SBT, ninguém perde nenhum detalhe da estreia do Corinthians, ...",[],UCxc3marqP9BJSkQ0_K4mqDg,1408743,44758,0,53,{},[],{}
14/05/2024,g275ocrRC4M,&quot;OLHA ISSO! TÁ CLARO que o Cássio TÁ PU%0! A INFORMAÇÃO é que...&quot; SAÍDA do Corinthians pro Cruzeiro?,Jovem Pan Esportes,2024-05-14T17:00:24Z,"Cássio saiu do Corinthians para o Cruzeiro? Segundo informações, o goleiro comunicou à diretoria do Timão que quer deixar o ...",[],UCv-Nx8pSfG_LxbViMz14RWQ,117963,4075,0,430,{},[],{}
14/05/2024,fQ6pdEMwMsw,&quot;PELO AMOR DE DEUS! IMAGINA o Gabigol nesse time do Corinthians?&quot; Mauro Cezar FALA do 10 do Flamengo,Jovem Pan Esportes,2024-05-14T18:02:29Z,"Imaginem Gabigol, que está em péssima fase no Flamengo, jogando no atual time do Corinthians? Mauro Cezar Pereira ...",[],UCv-Nx8pSfG_LxbViMz14RWQ,112406,4966,0,187,{},[],{}
14/05/2024,19hDxmTNpXg,Flamengo 0 x 2 Botafogo - 28/04/2024 - Brasileirão,Jovem Pan Esportes,2024-04-28T16:12:48Z,Jogo Flamengo x Botafogo ao vivo hoje: assista à transmissão com imagem dos jornalistas da Jovem Pan Esportes. Narração de ...,[],UCv-Nx8pSfG_LxbViMz14RWQ,982905,8089,0,133,{},[],{}
14/05/2024,BuOl6Pi61Oo,🔴AO VIVO | Fortaleza sofre goleada na Sul-Americana; Preparação do Ceará | Esportes do Povo,O POVO,2024-05-09T15:06:18Z,"Participe pelo nosso Whatsapp (85) 9699-2299, e pelas nossas redes sociais twitter e instagram @opovocbn. Estamos ao vivo ...",[],UCj-RTZE-V3Q6jleatRR9k2A,3207,341,0,4,{},[],{}
14/05/2024,DkZBVcq0Gu4,É TRICAMPEÃO! Palmeiras VENCE o Santos e CONQUISTA o 3º TÍTULO PAULISTA SEGUIDO! | CANELADA,Jovem Pan Esportes,2024-04-08T00:42:27Z,"Veja a íntegra do Canelada. Crédito das fotos usadas na thumbnail: Fabio Menotti/Palmeiras/by Canon Siga o canal ""Jovem Pan ...",[],UCv-Nx8pSfG_LxbViMz14RWQ,235206,6951,0,148,{},[],{}
14/05/2024,ZpbXqEOqHsc,"Flamengo PERDE para o Botafogo, e Tite é MUITO CRITICADO; Fogão ASSUME A LIDERANÇA! | CANELADA",Jovem Pan Esportes,2024-04-28T18:04:45Z,Veja a íntegra do Canelada. Crédito da foto usada na thumbnail: Vitor Silva/Botafogo Baixe o app Panflix: ...,[],UCv-Nx8pSfG_LxbViMz14RWQ,433862,15695,0,264,{},[],{}
14/05/2024,6KdBZRI72Lo,São Paulo 1 x 2 Fortaleza - 13/04/2024 - Brasileirão,Jovem Pan Esportes,2024-04-14T03:17:45Z,Jogo São Paulo x Fortaleza ao vivo hoje: assista à transmissão com imagem dos jornalistas da Jovem Pan Esportes. Narração de ...,[],UCv-Nx8pSfG_LxbViMz14RWQ,730021,8399,0,43,{},[],{}
14/05/2024,Cwv8ba9hrDw,Corinthians empata em casa; Diretoria do Flamengo DETONA a arbitragem do Brasileirão! | CANELADA,Jovem Pan Esportes,2024-05-05T18:14:27Z,Veja a íntegra do Canelada!!! Crédito da foto usada na thumbnail: MARCO GALVÃO/FOTOARENA/ESTADÃO CONTEÚDO Baixe ...,[],UCv-Nx8pSfG_LxbViMz14RWQ,199007,7385,0,65,{},[],{}
14/05/2024,tDwb1pNAqJA,RÁDIO ESPORTES  - 01/05/2024,Itatiaia Esporte,2024-05-01T16:07:02Z,Explore o mundo do esporte durante o seu almoço com o Rádio Esportes! Nosso programa oferece informações precisas e ...,[],UCezhRry1J2kNRNCdNDHimNA,13071,707,0,7,{},[],{}
14/05/2024,r21F8b3mjwU,Flamengo SE REVOLTA com ARBITRAGEM e QUESTIONA a CBF; Palmeiras e São Paulo VENCEM! | BATE-PRONTO,Jovem Pan Esportes,2024-05-06T17:12:05Z,"O Bate-Pronto de hoje falará tudo sobre as polêmicas envolvendo o empate por 1 a 1 entre Bragantino e Flamengo, no sábado, ...",[],UCv-Nx8pSfG_LxbViMz14RWQ,206062,8044,0,83,{},[],{}
14/05/2024,DkZBVcq0Gu4,É TRICAMPEÃO! Palmeiras VENCE o Santos e CONQUISTA o 3º TÍTULO PAULISTA SEGUIDO! | CANELADA,Jovem Pan Esportes,2024-04-08T00:42:27Z,"Veja a íntegra do Canelada. Crédito das fotos usadas na thumbnail: Fabio Menotti/Palmeiras/by Canon Siga o canal ""Jovem Pan ...",[],UCv-Nx8pSfG_LxbViMz14RWQ,235206,6951,0,148,{},[],{}
14/05/2024,-WX3wNwHi6w,"Racing x Corinthians - JOGO COMPLETO, com narração de Diguinho Coruja | Copa Sul-Americana 2024",SBT Sports,2024-04-03T03:11:02Z,"Vai começar a fase de grupos da Conmebol Sul-Americana. No SBT, ninguém perde nenhum detalhe da estreia do Corinthians, ...",[],UCxc3marqP9BJSkQ0_K4mqDg,1408743,44758,0,53,{},[],{}
14/05/2024,g275ocrRC4M,&quot;OLHA ISSO! TÁ CLARO que o Cássio TÁ PU%0! A INFORMAÇÃO é que...&quot; SAÍDA do Corinthians pro Cruzeiro?,Jovem Pan Esportes,2024-05-14T17:00:24Z,"Cássio saiu do Corinthians para o Cruzeiro? Segundo informações, o goleiro comunicou à diretoria do Timão que quer deixar o ...",[],UCv-Nx8pSfG_LxbViMz14RWQ,117963,4075,0,430,{},[],{}
14/05/2024,2H77ULSGK6M,Nacional-PAR 0 x 2 Corinthians - 07/05/2024 - Copa Sul-Americana,Jovem Pan Esportes,2024-05-08T00:41:24Z,Jogo Nacional x Corinthians ao vivo hoje: assista à transmissão com imagem dos jornalistas da Jovem Pan Esportes. Narração ...,[],UCv-Nx8pSfG_LxbViMz14RWQ,203489,2484,0,4,{},[],{}
14/05/2024,fQ6pdEMwMsw,&quot;PELO AMOR DE DEUS! IMAGINA o Gabigol nesse time do Corinthians?&quot; Mauro Cezar FALA do 10 do Flamengo,Jovem Pan Esportes,2024-05-14T18:02:29Z,"Imaginem Gabigol, que está em péssima fase no Flamengo, jogando no atual time do Corinthians? Mauro Cezar Pereira ...",[],UCv-Nx8pSfG_LxbViMz14RWQ,112406,4966,0,187,{},[],{}
14/05/2024,19hDxmTNpXg,Flamengo 0 x 2 Botafogo - 28/04/2024 - Brasileirão,Jovem Pan Esportes,2024-04-28T16:12:48Z,Jogo Flamengo x Botafogo ao vivo hoje: assista à transmissão com imagem dos jornalistas da Jovem Pan Esportes. Narração de ...,[],UCv-Nx8pSfG_LxbViMz14RWQ,982905,8089,0,133,{},[],{}
14/05/2024,dVrGAAzuCRE,"&quot;É TODA HORA ISSO! Nós estamos MUITO TOLERANTES com FUTEBOL RUIM, gente!&quot; Mauro Cezar CRITICA!",Jovem Pan Esportes,2024-04-30T15:30:55Z,"São Paulo, Palmeiras, Flamengo, Fluminense... Grandes times do futebol brasileiro apresentaram um futebol muito pobre na ...",[],UCv-Nx8pSfG_LxbViMz14RWQ,135425,6032,0,513,{},[],{}
14/05/2024,a_ssXW8BZuk,"MEU DEUS! Pilhado SURTA, SE VESTE de Einstein e DETONA Tite após DERROTA do Flamengo &quot;da CIÊNCIA&quot;!",Jovem Pan Esportes,2024-04-29T15:38:17Z,"PILHADO EINSTEIN!!! Após nova derrota do Flamengo, Tite foi detonado pelo apresentador do Bate-Pronto, que se vestiu de ...",[],UCv-Nx8pSfG_LxbViMz14RWQ,260540,13818,0,1302,{},[],{}
14/05/2024,6KdBZRI72Lo,São Paulo 1 x 2 Fortaleza - 13/04/2024 - Brasileirão,Jovem Pan Esportes,2024-04-14T03:17:45Z,Jogo São Paulo x Fortaleza ao vivo hoje: assista à transmissão com imagem dos jornalistas da Jovem Pan Esportes. Narração de ...,[],UCv-Nx8pSfG_LxbViMz14RWQ,730021,8399,0,43,{},[],{}
14/05/2024,r21F8b3mjwU,Flamengo SE REVOLTA com ARBITRAGEM e QUESTIONA a CBF; Palmeiras e São Paulo VENCEM! | BATE-PRONTO,Jovem Pan Esportes,2024-05-06T17:12:05Z,"O Bate-Pronto de hoje falará tudo sobre as polêmicas envolvendo o empate por 1 a 1 entre Bragantino e Flamengo, no sábado, ...",[],UCv-Nx8pSfG_LxbViMz14RWQ,206062,8044,0,83,{},[],{}
14/05/2024,lYQeZlSmWtg,&quot;É ASSUSTADOR! Esse elenco do Corinthians GANHA R$ 22 MILHÕES e VAI LUTAR pra NÃO CAIR!&quot; OLHA ISSO!,Jovem Pan Esportes,2024-04-22T16:40:25Z,"O Corinthians vai lutar para ser não ser rebaixado? A crise no Timão de Augusto Melo, que ainda não marcou sequer um gol no ...",[],UCv-Nx8pSfG_LxbViMz14RWQ,357969,11748,0,639,{},[],{}
14/05/2024,0R8Ss0VZ0zs,&quot;É INACREDITÁVEL! O Palmeiras do Abel é o ÚNICO TIME CAPAZ de...&quot; VIRADA SURREAL contra o Del Valle!,Jovem Pan Esportes,2024-04-25T03:53:28Z,"VIRADA SURREAL! O Palmeiras fez 3 gols a 2 no Independiente del Valle hoje pela Libertadores, e Abel Ferreira foi exaltado no ...",[],UCv-Nx8pSfG_LxbViMz14RWQ,287971,12003,0,922,{},[],{}
14/05/2024,VKUcfVLVTTM,"&quot;Que BAITA CONTRATAÇÃO do São Paulo! Esse cara ME SURPREENDEU, TÁ JOGANDO MUITO e...&quot; VEJA DEBATE!",Jovem Pan Esportes,2024-04-26T02:44:58Z,André Silva e Ferreirinha foram exaltados após o São Paulo fazer 2 gols a 0 no Barcelona de Guayaquil hoje na Libertadores.,[],UCv-Nx8pSfG_LxbViMz14RWQ,148028,6041,0,339,{},[],{}
14/05/2024,VTYm2-0n4dY,MANCHESTER CITY X REAL MADRID (NARRAÇÃO AO VIVO) | QUARTAS - VOLTA | CHAMPIONS 23/24,TNT Sports Brasil,2024-04-17T22:05:59Z,Manchester City e Real Madrid se enfrentam pela ida das quartas de final da Champions League 2023/24! Você acompanha a ...,[],UCs-6sCz2LJm1PrWQN4ErsPw,5317110,74849,0,438,{},[],{}
14/05/2024,bs19Nv0nSTs,OS ESPORTES MAIS ENGRAÇADOS DO MUNDO!!!!,Reversão,2022-04-20T22:18:32Z,SEMPRE REVERSÃO!! SE INSCREVA E DEIXE O LIKE! Insta: https://bit.ly/2G8xoDx OUTROS CANAIS: VLOGS: @CanalCanalha ...,[],UCyEHckavb7hMh5f8j4WEiIg,486599,55987,0,1377,{},[],{}
14/05/2024,ft5cjq4ye5s,&quot;É PROCESSO DE FRITURA! E vai ficar INSUPORTÁVEL se...&quot; Mauro Cezar MANDA REAL sobre Tite e Flamengo,Jovem Pan Esportes,2024-05-10T17:13:28Z,Tite será demitido do Flamengo se não vencer o Corinthians? Protestos no CT rubro-negro aumentaram a pressão sobre o ...,[],UCv-Nx8pSfG_LxbViMz14RWQ,474803,18222,0,1545,{},[],{}
14/05/2024,5i64nqk9Zyo,ESPORTES MAIS PERIGOS0S DO MUNDO!!,Reversão,2022-06-12T20:22:13Z,SEMPRE REVERSÃO!! SE INSCREVA E DEIXE O LIKE! Insta: https://bit.ly/2G8xoDx OUTROS CANAIS: VLOGS: @CanalCanalha ...,[],UCyEHckavb7hMh5f8j4WEiIg,340922,46323,0,174,{},[],{}
14/05/2024,6sBONdiWNm0,FALOU UM ABSURDO??? OPINIÃO POLÊMICA sobre Vinicius Júnior e Neymar FERVE DEBATE após Bayern x Real!,Jovem Pan Esportes,2024-04-30T22:30:00Z,"Vinicius Júnior, que anotou dois gols em Bayern de Munique x Real Madrid hoje pela Champions League, vai se tornar MAIOR ...",[],UCv-Nx8pSfG_LxbViMz14RWQ,202690,8331,0,1752,{},[],{}
14/05/2024,6ckY9PCMJvM,São Paulo VENCE o Fluminense DE VIRADA e é o 5º; Luciano e Fernando Diniz BRIGAM! | BATE-PRONTO,Jovem Pan Esportes,2024-05-14T17:12:40Z,"O Bate-Pronto de hoje debaterá a vitória de virada do São Paulo sobre o Fluminense, ontem de noite, no Estádio do Morumbi.",[],UCv-Nx8pSfG_LxbViMz14RWQ,184969,8635,0,48,{},[],{}
14/05/2024,nqVxHYbnul4,&quot;O Flamengo DOMINOU COMPLETAMENTE o Corinthians! E NÃO TEM EXPLICAÇÃO como...&quot; VITÓRIA GERA DEBATE!,Jovem Pan Esportes,2024-05-11T21:38:12Z,"Lorran deu show, e o Flamengo de Tite venceu o Corinthians por 2 gols a 0 hoje em jogo do Brasileirão. O desempenho ...",[],UCv-Nx8pSfG_LxbViMz14RWQ,190371,6409,0,423,{},[],{}
14/05/2024,-h8Vj5Pqmjo,Corinthians 0 x 0 Atlético-MG - 14/04/2024 - Brasileirão,Jovem Pan Esportes,2024-04-14T21:20:09Z,Jogo Corinthians x Atlético-MG ao vivo hoje: assista à transmissão com imagem dos jornalistas da Jovem Pan Esportes.,[],UCv-Nx8pSfG_LxbViMz14RWQ,384625,3105,0,19,{},[],{}
14/05/2024,VOy63WPLnPU,Barcelona-EQU 0 x 2 São Paulo - 25/04/2024 - Libertadores,Jovem Pan Esportes,2024-04-26T02:10:16Z,Jogo Barcelona-EQU X São Paulo ao vivo hoje: assista à transmissão com imagem dos jornalistas da Jovem Pan Esportes.,[],UCv-Nx8pSfG_LxbViMz14RWQ,592746,6209,0,10,{},[],{}
14/05/2024,4TGwX3GmQwo,🔴AO VIVO | Fortaleza enfrenta Nacional Potosí na Bolívia; Embarque do Ceará | Esportes do Povo,O POVO,2024-05-08T15:04:29Z,"Participe pelo nosso Whatsapp (85) 9699-2299, e pelas nossas redes sociais twitter e instagram @opovocbn. Estamos ao vivo ...",[],UCj-RTZE-V3Q6jleatRR9k2A,3765,442,0,0,{},[],{}
14/05/2024,q-6MGl5kFCk,&quot;ISSO É UMA ARMADILHA PERIGOSA! O Dorival pra mim...&quot; Mauro Cezar FALA TUDO da Seleção Brasileira!,Jovem Pan Esportes,2024-03-27T15:35:02Z,Seleção Brasileira: Brasil e Espanha empataram por 3 gols a 3 no segundo jogo de Dorival Júnior à frente do selecionado ...,[],UCv-Nx8pSfG_LxbViMz14RWQ,335672,12901,0,2320,{},[],{}
14/05/2024,KcbteUxPQ58,INCRÍVEL! Palmeiras consegue VIRADA SURREAL contra o Del Valle NO FIM; Flamengo PERDE! | CANELADA,Jovem Pan Esportes,2024-04-25T03:44:14Z,Veja a íntegra do Canelada... Crédito da foto usada na thumbnail: Luciano González/EFE Baixe o app Panflix: ...,[],UCv-Nx8pSfG_LxbViMz14RWQ,325579,12780,0,179,{},[],{}
14/05/2024,AdXY6Hq3k8k,América-RN 1 x 2 Corinthians - 01/05/2024 - Copa do Brasil,Jovem Pan Esportes,2024-05-02T01:19:57Z,Jogo América-RN x Corinthians ao vivo hoje: assista à transmissão com imagem dos jornalistas da Jovem Pan Esportes.,[],UCv-Nx8pSfG_LxbViMz14RWQ,610466,4750,0,31,{},[],{}
14/05/2024,2btcwHxPO4M,OS 10 ESPORTES COM MAIS MEDALHAS PARA O BRASIL EM OLIMPÍADAS,TNT Sports Brasil,2021-07-24T21:00:01Z,Você sabia disso? Vitor Sergio Rodrigues elenca quais modalidades trouxeram mais medalhas para o Brasil em Olimpíadas!,[],UCs-6sCz2LJm1PrWQN4ErsPw,20988,1822,0,43,{},[],{}
14/05/2024,vqNUYp53SA8,&quot;EU TÔ EMPOLGADO SIM! O São Paulo TEM VERGONHA NA CARA! Se CLASSIFICOU e...&quot; VITÓRIA sobre Cobresal!,Jovem Pan Esportes,2024-05-09T02:47:46Z,O São Paulo de Zubeldía venceu o Cobresal por 3 gols a 1 hoje e se classificou às oitavas de final da Libertadores. O SPFC foi ...,[],UCv-Nx8pSfG_LxbViMz14RWQ,182844,9062,0,483,{},[],{}
14/05/2024,vdPicIaGMaU,"&quot;Cara, o DINIZ TEM QUE...&quot; OLHA o que Luciano FALOU sobre a BRIGA em São Paulo x Fluminense!",Jovem Pan Esportes,2024-05-14T02:23:18Z,"Briga e discussão entre Fernando Diniz e Luciano: em entrevista, o atacante do São Paulo falou sobre a confusão com o técnico ...",[],UCv-Nx8pSfG_LxbViMz14RWQ,136802,3872,0,450,{},[],{}
14/05/2024,_9wqQv6tx4c,RÁDIO ESPORTES  - 08/05/2024,Itatiaia Esporte,2024-05-08T16:10:59Z,Explore o mundo do esporte durante o seu almoço com o Rádio Esportes! Nosso programa oferece informações precisas e ...,[],UCezhRry1J2kNRNCdNDHimNA,10779,606,0,3,{},[],{}
14/05/2024,3nlmHhsNuMw,&quot;FOI HISTÓRICO! O Cuca foi MUITO CORAJOSO de ter FALADO ISSO e...&quot; FORTE PRONUNCIAMENTO REPERCUTE!,Jovem Pan Esportes,2024-03-11T17:20:22Z,"O pronunciamento de Cuca sobre as mulheres em entrevista coletiva no Athletico-PR repercutiu bastante. O treinador, que havia ...",[],UCv-Nx8pSfG_LxbViMz14RWQ,132166,6165,0,782,{},[],{}
14/05/2024,jTJCvJgpTG0,MEU DEUS! QUE FALHA BISONHA DO CÁSSIO! OLHA essa ENTREGADA do goleiro em Juventude x Corinthians!,Jovem Pan Esportes,2024-04-18T00:56:14Z,"QUE FALHA DO CÁSSIO! O goleiro do Corinthians não foi bem, e o Juventude fez 2 gols a 0 com melhores momentos hoje pelo ...",[],UCv-Nx8pSfG_LxbViMz14RWQ,97047,1287,0,355,{},[],{}
14/05/2024,LsRpF1VMFoY,RÁDIO ESPORTES  - 09/04/2024,Itatiaia Esporte,2024-04-09T16:06:13Z,Explore o mundo do esporte durante o seu almoço com o Rádio Esportes! Nosso programa oferece informações precisas e ...,[],UCezhRry1J2kNRNCdNDHimNA,11677,701,0,12,{},[],{}
14/05/2024,mtBGb1hQoCk,&quot;ISSO É UM LIXO! UMA COISA GROTESCA!&quot; ÁUDIO DO VAR do GOL ANULADO do Palmeiras PROVOCA DEBATE!,Jovem Pan Esportes,2024-05-03T16:06:56Z,"A linha do impedimento no gol anulado de Rony, do Palmeiras, estava certa? O áudio do VAR do jogo contra o Botafogo-SP foi ...",[],UCv-Nx8pSfG_LxbViMz14RWQ,333392,9677,0,1369,{},[],{}
14/05/2024,dFP50TGuSLU,"&quot;Se o Diniz realmente ACREDITA NISSO, É BEM PREOCUPANTE! Gente...&quot; Mauro Cezar faz CRÍTICA!",Jovem Pan Esportes,2024-05-14T16:03:35Z,Fernando Diniz teve forte briga e discussão com Luciano em São Paulo x Fluminense e não está conseguindo fazer o time ...,[],UCv-Nx8pSfG_LxbViMz14RWQ,159390,7323,0,498,{},[],{}
14/05/2024,W3eeosjLSrs,&quot;O Palmeiras É FREGUÊS do São Paulo em DECISÃO! A REAL é que...&quot; Pilhado DISPARA após a Supercopa!,Jovem Pan Esportes,2024-02-04T21:34:13Z,"O São Paulo foi campeão da Supercopa do Brasil contra o Palmeiras nos pênaltis, e Pilhado disparou no Canelada, da Jovem ...",[],UCv-Nx8pSfG_LxbViMz14RWQ,115674,6369,0,682,{},[],{}
14/05/2024,JNAF3v3WSxE,&quot;OLHA ISSO! ACABOU A PACIÊNCIA DO CÁSSIO! Ele DISPAROU que...&quot; DESABAFO em ENTREVISTA no Corinthians,Jovem Pan Esportes,2024-04-24T03:16:47Z,"Em entrevista, Cássio desabafa após a derrota do Corinthians para o Argentinos Juniors em jogo hoje pela Copa Sul-Americana.",[],UCv-Nx8pSfG_LxbViMz14RWQ,487646,14757,0,1292,{},[],{}
14/05/2024,D8PSDiw7XPg,&quot;NINGUÉM LEMBRA MAIS DISSO! Mas o Vinicius Júnior com o Neymar na Copa...&quot; Mauro Cezar FALA TUDO!,Jovem Pan Esportes,2024-05-01T15:34:07Z,Vinicius Júnior brilhou e fez dois gols em Bayern de Munique x Real Madrid pela Champions League. A atuação do brasileiro foi ...,[],UCv-Nx8pSfG_LxbViMz14RWQ,377969,13817,0,934,{},[],{}
14/05/2024,wuLGxFbaclc,É HOJE! Dorival ESTREIA na Seleção em JOGAÇO contra a Inglaterra em Wembley! | CAMISA 10,Jovem Pan Esportes,2024-03-23T15:33:38Z,"O Camisa 10 deste sábado falará tudo sobre a Seleção Brasileira, que enfrenta a Inglaterra em amistoso hoje, às 16h, em ...",[],UCv-Nx8pSfG_LxbViMz14RWQ,54229,1525,0,21,{},[],{}
14/05/2024,YXvOf3SRg6Y,Flamengo 1 x 0 Amazonas - 01/05/2024 - Copa do Brasil,Jovem Pan Esportes,2024-05-02T02:38:57Z,Jogo Flamengo x Amazonas ao vivo hoje: assista à transmissão com imagem dos jornalistas da Jovem Pan Esportes. Narração ...,[],UCv-Nx8pSfG_LxbViMz14RWQ,426268,4259,0,42,{},[],{}
14/05/2024,jL4_VyDjCTY,São Paulo 2 x 1 Fluminense - 13/05/2024 - Brasileirão,Jovem Pan Esportes,2024-05-14T02:18:02Z,Jogo São Paulo x Fluminense ao vivo hoje: assista à transmissão com imagem dos jornalistas da Jovem Pan Esportes. Narração ...,[],UCv-Nx8pSfG_LxbViMz14RWQ,767111,12328,0,13,{},[],{}
14/05/2024,HPwOQiuQzZE,RÁDIO ESPORTES  - 09/05/2024,Itatiaia Esporte,2024-05-09T16:06:48Z,Explore o mundo do esporte durante o seu almoço com o Rádio Esportes! Nosso programa oferece informações precisas e ...,[],UCezhRry1J2kNRNCdNDHimNA,9494,500,0,4,{},[],{}
14/05/2024,TekAwQwiww0,"&quot;POR QUE NÃO??? Cara, se o Tite tiver CORAGEM, o Lorran deveria...&quot; Cria do Flamengo PROVOCA DEBATE!",Jovem Pan Esportes,2024-05-11T22:30:02Z,"Lorran deveria virar titular do Flamengo de Tite? Após a vitória contra o Corinthians por 2 gols a 0 em jogo hoje no Maracanã, ...",[],UCv-Nx8pSfG_LxbViMz14RWQ,244160,8811,0,557,{},[],{}
14/05/2024,AeCyusYe54w,RÁDIO ESPORTES  - 10/05/2024,Itatiaia Esporte,2024-05-10T16:07:52Z,Explore o mundo do esporte durante o seu almoço com o Rádio Esportes! Nosso programa oferece informações precisas e ...,[],UCezhRry1J2kNRNCdNDHimNA,9874,555,0,7,{},[],{}
14/05/2024,CrKpkL_-mLU,Palmeiras 0 x 1 Internacional - 17/04/2024 - Brasileirão,Jovem Pan Esportes,2024-04-18T01:11:10Z,Jogo Palmeiras x Internacional ao vivo hoje: assista à transmissão com imagem dos jornalistas da Jovem Pan Esportes.,[],UCv-Nx8pSfG_LxbViMz14RWQ,967265,7205,0,35,{},[],{}
14/05/2024,Ren0s1BARmo,"NOVA JOIA BRILHA, e Palmeiras VENCE o Liverpool-URU DE VIRADA na Libertadores! | CANELADA",Jovem Pan Esportes,2024-04-12T03:02:43Z,Veja a íntegra do Canelada. Crédito da foto usada na thumbnail: ANDERSON LIRA/FOTOARENA/ESTADÃO CONTEÚDO Siga o ...,[],UCv-Nx8pSfG_LxbViMz14RWQ,146752,4275,0,53,{},[],{}
14/05/2024,Ha6R_o5OfFY,&quot;É INFORMAÇÃO! Gente de DENTRO do Palmeiras ME FALOU que o John Kennedy...&quot; OLHA o que Vampeta FALOU,Jovem Pan Esportes,2024-05-01T17:33:38Z,"John Kennedy no Palmeiras: segundo informações de Vampeta, o atacante, que foi afastado de novo do Fluminense por ...",[],UCv-Nx8pSfG_LxbViMz14RWQ,264387,8115,0,463,{},[],{}
14/05/2024,krPKA0_7roQ,Vitória 1 x 3 São Paulo - 05/05/2024 - Brasileirão,Jovem Pan Esportes,2024-05-05T21:18:41Z,Jogo Vitória x São Paulo ao vivo hoje: assista à transmissão com imagem dos jornalistas da Jovem Pan Esportes. Narração de ...,[],UCv-Nx8pSfG_LxbViMz14RWQ,380403,4479,0,31,{},[],{}
14/05/2024,s3wu_RTcNjg,"DI MARÍA NO FLAMENGO? &quot;Gente, ele é CRAQUE! JOGA MUITO! E EU VI que...&quot; OLHA esse DEBATE sobre RUMOR",Jovem Pan Esportes,2024-04-08T17:49:11Z,"Ángel Di María no Flamengo? Será que o argentino, autor de skills e gols no Benfica, de fato interessa ao clube rubro-negro?",[],UCv-Nx8pSfG_LxbViMz14RWQ,172813,7185,0,412,{},[],{}
