Data da Pesquisa,Video ID,Title,Channel Title,Published At,Description,Tags,Channel ID,View Count,Like Count,Dislike Count,Comment Count,Region Restriction,Relevant Topics,Live Streaming Details
12/05/2024,kinmfM69Noo,MAFIA DEFINITIVE EDITION Gameplay Walkthrough Part 1 FULL GAME [4K 60FPS] - No Commentary,MKIceAndFire,2023-02-11T18:03:23Z,Mafia 1 Walkthrough Part 1 and until the last part will include the full Mafia Definitive Edition Gameplay on PC. This Mafia 1 ...,[],UC1bwliGvJogr7cWK0nT2Eag,1668681,15594,0,712,{},[],{}
12/05/2024,HzjyF5mBGng,¿PERO QUÉ te han HECHO BANBALEENA? | Garten of Banban 7 (Gameplay Español) #3,iTownGamePlay *Terror&Diversión*,2024-05-10T16:00:24Z,Hazte MIEMBRO y disfruta de muchas ventajas: http://youtube.com/iTownGamePlay/join No me acostumbro a verla así D: ...,[],UCKmlxQVs0vHtaLldRIQ8lsA,79961,4994,0,219,{},[],{}
12/05/2024,-CMjUBT1HA8,BLACK PANTHER WAR FOR WAKANDA PS5 Gameplay Walkthrough Part 1 FULL GAME [4K 60FPS] -  No Commentary,MKIceAndFire,2022-07-27T19:04:50Z,Avengers Game Black Panther War For Wakanda PS5 Walkthrough Part 1 and until the last part will include the full Marvel's ...,[],UC1bwliGvJogr7cWK0nT2Eag,2757985,19692,0,514,{},[],{}
12/05/2024,c5nsfilEoX4,My Highest IQ Gameplan Goes *EXTREMELY* Wrong • (27 KILLS) • BGMI Gameplay,casetoo,2024-05-12T08:59:46Z,Thankyou for your support ❤️ 2nd Channel - https://youtube.com/channel/UCAi4pnLEKhXVjgdeVbf_y1g Instagram ...,[],UCgZK0B5z3A2m5UWYvPpZcHw,13948,2485,0,99,{},[],{}
12/05/2024,4oZD3k8Y_Ks,Grand Theft Auto 5 - PS5 POV Gameplay,NS Gaming,2023-02-23T10:00:06Z,"Grand Theft Auto 5 - PS5 POV Gameplay Grand Theft Auto V, commonly referred to as GTA 5, is an open-world action-adventure ...",[],UCbmRcXtBBsokomk3fNLLUAA,6541037,151118,0,663,{},[],{}
12/05/2024,006iRze12HQ,HALF LIFE 2 Gameplay Walkthrough FULL GAME (4K 60FPS) No Commentary,Shirrako,2023-03-19T11:42:40Z,Half Life 2 Gameplay Walkthrough PC No Commentary 2160p 60fps HD let's play playthrough review guide Showcasing all ...,[],UC7eAfUjR9gdIjoaoQaS0W-A,469445,5280,0,473,{},[],{}
12/05/2024,NHQ1p9sO8Og,64 Elimination Solo Vs Squads Gameplay Wins (Fortnite Chapter 5 Season 2 PS4 Controller),SENSEI,2024-05-10T17:30:17Z,Fortnite #SoloVsSquads #FortniteChapter5 #Season2 #ad #FortniteController Buy a Controller @ https://nagashock.com & USE ...,[],UC2Loq2qB-wOLikZfrZ2zKbg,31237,786,0,32,{},[],{}
12/05/2024,psxMM72t8zo,POV: You&#39;re Good At Every FPS Game,Shroud,2022-12-31T23:14:48Z,Shroud moments of him being really good at multiple games throughout the last year. THE PERFECT MOUSE ...,[],UCoz3Kpu5lv-ALhR4h9bDvcw,1212947,67560,0,1009,{},[],{}
12/05/2024,wctAqNB98zI,NEW Marvel Rivals Spider-Man Web Swinging Free Roam Gameplay,DVESF,2024-05-11T01:09:37Z,Subscribe here! http://bit.ly/2OjezN8 ✘Twitter: https://bit.ly/34zbJxm This Walkthrough/Gameplay/Clip/Playthrough has been ...,[],UC98iNEL2XiBUaXt3BjV7BrA,42892,1320,0,167,{},[],{}
12/05/2024,kC_wHYMNfuk,"Scary Teacher 3D,Minecraft,MiniWorld,Tom Candy Run,Fortnite,Save The Girl,Crazy Branny Craft,Roblox",GamePlay Adventure,2020-05-11T12:36:40Z,GamePlay_Adventure #Android Please help Gameplay Adventure 1.000.000 subscribe: http://goo.gl/pd27cY. Thanks you ...,[],UCZSKX0Sp81Btp0taUTS7CAA,9429751,38523,0,831,{},[],{}
12/05/2024,pwySpFQwUbw,Doge Rush #gaming #art #satisfatorio #gameplay,Sailton Souza,2024-05-10T19:00:22Z,"Olá pessoal, eu sou Sailton souza. Sejam bem-vindos ao nosso canal de games. Temos vídeos diariamente! @sailtonsouza.",[],UCaicUZSXddGbEz9gDJAOjIA,14039,271,0,0,{},[],{}
12/05/2024,crji7YyUrx0,STEALING BILLION DOLLAR GOLDEN STATUE FROM MUSEUM | GTA V GAMEPLAY #323 | GTA 5,Wasim Gamer Hindi,2024-05-04T08:30:08Z,STEALING BILLION DOLLAR GOLDEN STATUE FROM MUSEUM | GTA V GAMEPLAY #323 | GTA 5 3dugganboss #gtav ...,[],UCkJfmvqtgJqW1uy4eA3DHrQ,138359,12726,0,774,{},[],{}
12/05/2024,Rmg9luK7VNU,[CompletoZ #3] : Black (2006) Gameplay Completo (Xbox/Ps2),Zangado,2022-12-30T13:45:01Z,"Black é um game de tiro em primeira pessoa de 2006. O jogador assume o controle de Jack Kellar, um agente de operações ...",[],UCuVIWETFdxzwlHEHMbhm2_w,795064,27798,0,1453,{},[],{}
12/05/2024,qqlCkF2GWN0,MAG7 GUN DESTRUCTION 27 KILL AJJUBHAI AND AMITBHAI BEST GAMEPLAY - GARENA FREE FIRE,Total Gaming,2022-07-12T04:15:02Z,MAG7 GUN DESTRUCTION 27 KILL AJJUBHAI AND AMITBHAI BEST GAMEPLAY GARENA FREE FIRE TOTAL GAMING.,[],UC5c9VlYTSvBSCaoMu_GI6gQ,4683853,239564,0,3928,{},[],{}
12/05/2024,F2AWk1q7LTI,My Surprise for Gyan Gaming,Badge 99,2024-05-09T11:57:24Z,My Instagram ▻ https://www.instagram.com/badge_99/ Twitter ▻ https://twitter.com/Badge99_ Facebook ...,[],UCPhZzHKo3Y5YYoazMQWuLTg,1592992,212094,0,8027,{},[],{}
12/05/2024,P3kiEHbL0lc,INFAMOUS 2 Gameplay Walkthrough FULL GAME [4K ULTRA HD PS5] - No Commentary,MKIceAndFire,2024-05-11T19:01:09Z,Infamous 2 Walkthrough Part 1 and until the last part will include the full Infamous 2 Gameplay on PS5. This Infamous 2 Gameplay ...,[],UC1bwliGvJogr7cWK0nT2Eag,15320,614,0,58,{},[],{}
12/05/2024,FSWoUGxGNEg,Angry Birds 2 - Official Gameplay Trailer,Angry Birds,2015-07-30T07:42:22Z,It's time to join your favorite feathered heroes on an all-new adventure as they storm Piggy Island to rescue their poor stolen eggs ...,[],UCYC2wjLop-S6Ld4raeoUVNA,3322620,7579,0,577,{},[],{}
12/05/2024,6fNUO23I_BA,"GOD OF WAR RAGNAROK - O Início de Gameplay no PS5, em Português PT-BR!",BRKsEDU,2022-11-08T11:01:00Z,"Vídeo gameplay do jogo God of War Ragnarok, game continuação do God of War de PS4 e que está disponível para PS4 e PS5.",[],UCWKtHaeXVzUscYGcm0hEunw,3728112,181276,0,3399,{},[],{}
12/05/2024,4IjEwvxKUX0,which car is your favorite 🔥 #pubg,ZEMU GAMING,2023-03-13T06:43:45Z,Hello guys how are you today My sensitivity and control video   https://youtu.be/GafVEf1zpO8 Device iPhone XS Max 5 finger full ...,[],UCOayMK9-JkQDTKQGKpLn38A,4132727,179648,0,594,{},[],{}
12/05/2024,F1Y2h2evV1Y,CALL OF DUTY WW2 PS5 Gameplay Walkthrough Part 1 Campaign FULL GAME [4K 60FPS] - No Commentary,MKIceAndFire,2021-02-17T19:06:56Z,Call Of Duty WW2 PS5 Walkthrough Part 1 and until the last part will include the full Call Of Duty WW2 Gameplay on PS5.,[],UC1bwliGvJogr7cWK0nT2Eag,5377119,48164,0,1854,{},[],{}
12/05/2024,rPiDTjl1FUg,The Biggest Mafia Committed Powerful Attack On Michael | Gta V Gameplay,ANKIT PLAYZ,2024-05-11T09:21:56Z,SAVING MAYANK'S MALIBU MANSION FROM MAFIA | GTA V GAMEPLAY #23 Business Email : officialankit676@gmail.com ...,[],UCBOrzeHZNnxkpdEtvdu12Tw,130527,11757,0,341,{},[],{}
12/05/2024,KqreWm5ZpHw,My Singing Monsters (Gameplay Trailer),My Singing Monsters,2012-12-11T15:07:24Z,Collect a cast of charming Monsters with a passion for song in the award-winning My Singing Monsters! Download for free: ...,[],UCngRsuvI1zxHR9vwNZvpTAw,72086084,65187,0,4170,{},[],{}
13/05/2024,kgppJX0G--E,(PS5) THE PACIFIC WAR 1943 | Realistic Immersive ULTRA Graphics Gameplay [4K 60FPS HDR] Call of Duty,Champs Network,2024-01-12T13:03:57Z,(PS5) THE PACIFIC WAR 1943 | Realistic Immersive ULTRA Graphics Gameplay [4K 60FPS HDR] Call of Duty Thanks For ...,[],UCRU9vwwARx8jEACqNpi_KFA,14722521,105430,0,4115,{},[],{}
13/05/2024,j8LHFJChi_g,(PS5) Mexican Cartel Raid | Realistic IMMERSIVE ULTRA Graphics Gameplay [4K 60FPS HDR] Call of Duty,Champs Network,2024-04-16T18:06:09Z,(PS5) Mexican Cartel Raid | Realistic IMMERSIVE ULTRA Graphics Gameplay [4K 60FPS HDR] Call of Duty Thanks For Watching ...,[],UCRU9vwwARx8jEACqNpi_KFA,1888836,14772,0,391,{},[],{}
13/05/2024,3dqqj7ThetM,Overwatch 2 | Porsche | Gameplay Trailer,PlayOverwatch,2024-05-13T16:00:02Z,Race into battle with the Overwatch 2 | Porsche D.Va and Pharah Porsche skins. Inspired by the All-Electric 2025 Porsche Macan ...,[],UClOf1XXinvZsy4wKPAkro2A,123298,7067,0,952,{},[],{}
13/05/2024,2wC8fqSivk4,How Female vs Male Climb Ladder (Stellar Blade vs Bloodborne),YouTuBruh,2024-04-08T06:47:01Z,I just found Stellar Blade Ladder Descent is so Cool and Stylish then I remember the funny Bloodborne clip on YouTube.,[],UCGSnO3hxveFSu_I-ADgGDLw,6052770,476177,0,3626,{},[],{}
13/05/2024,LrZqVOq5su8,"BEST HERO in Marvel Rivals (Early Access, Alpha Gameplay)",ThatPunchKid LIVE,2024-05-13T15:00:30Z,"I played all the heroes in Marvel Rivals (Early Access, Alpha Gameplay) • Main - https://www.youtube.com/@ThatPunchKid ...",[],UCwOK17OSowtRjqRtChXsVcg,19532,847,0,67,{},[],{}
13/05/2024,F9zosNF1WIA,BATTLE OF YORK™ LOOKS ABSOLUTELY AMAZING | Ultra Realistic Graphics Gameplay [4K 60FPS] Son of Rome,GameV,2024-03-05T15:43:25Z,BATTLE OF YORK™ LOOKS ABSOLUTELY AMAZING | Ultra Realistic Graphics Gameplay [4K 60FPS] Son of Rome Thanks for ...,[],UCAvRtPIFFbnfLHswfRS6zhQ,2000432,19531,0,885,{},[],{}
13/05/2024,lgUjO9Uuf0M,"Best mobile games android ios, cool game ever player #shorts #funny #gaming #puzzle #viralshorts",Max Games YT,2023-06-05T11:00:24Z,"Best mobile games android ios, cool game ever player #shorts #funny #gaming #puzzle #viralshorts #funnygame #puzzle ...",[],UCzoXFSRacjcHFRSqxTB6z_A,102678152,0,0,3158,{},[],{}
13/05/2024,v3FRgjIbR1k,24 Kills No Death!! Unstoppable Valir Tanky Build 100% Annoying!! - Build Top 1 Global Valir ~ MLBB,Gameplay Proplayer,2024-05-12T09:35:00Z,valir gameplay pro player valir best one hit build tank 2024 valir top 1 global build valir tersakit 2024. 24 Kills No Death!,[],UCVZAfLep-Ju-zAJsAGSVUNA,40053,1229,0,178,{},[],{}
13/05/2024,JnIprXJMvN4,FALLOUT 4 Gameplay Walkthrough FULL GAME [4K 60FPS PC ULTRA] - No Commentary,MKIceAndFire,2024-05-02T22:34:04Z,Fallout 4 Walkthrough Part 1 and until the last part will include the full Fallout 4 Gameplay on PC. This Fallout 4 Gameplay is ...,[],UC1bwliGvJogr7cWK0nT2Eag,132045,2316,0,111,{},[],{}
13/05/2024,_SQrkkfxY-g,AN EPIC FINAL - Top Spin 2K25 Career Mode - Part 9 | PS5 Gameplay,TheApexHound,2024-05-13T17:00:32Z,"We look to get a few new houses and win as many TS500 tournaments as possible, Let's do it!",[],UCgVls4NK7dz95eGULu8XApQ,3096,128,0,19,{},[],{}
13/05/2024,EQZmmVmVRoI,Call of Duty Warzone 3 Solo Snipe Gameplay PS5(No Commentary),Marshal No Commentary,2024-05-13T08:22:06Z,Call of Duty Modern Warfare3-Warzone3 Battle Royale Sniper Rifle FJX Imperium & Striker Season 3 Solo Win Gameplay (No ...,[],UCU-4n0wHbEhRH2aJfXsqM8A,17391,575,0,51,{},[],{}
13/05/2024,_yX8fdnmY2g,ALONE IN THE DARK #1 - INÍCIO DE GAMEPLAY!!! | Gameplay em Português PT-BR,BRKsEDU,2024-03-20T11:59:27Z,Confira os cursos da EBAC: https://ebac.me/de138b Cupom de R$200 de desconto: eduoferta Vídeo com início de gameplay do ...,[],UCWKtHaeXVzUscYGcm0hEunw,209203,16243,0,507,{},[],{}
13/05/2024,YT79QYy2fng,PINE HARBOR Full Gameplay Walkthrough Part 1 &amp; ENDING (FULL GAME),theRadBrad,2024-05-08T20:00:18Z,"Pine Harbor Walkthrough Gameplay Part 1 includes a Full Game Review, Full Gameplay and the Ending for PC with PlayStation 5 ...",[],UCpqXJOEqGS-TCnazcHCo0rA,209789,6603,0,284,{},[],{}
13/05/2024,wP3uNAlCskY,Street Fighter 6 - 8 Minutes of Akuma Gameplay (High-Level CPU),GameSpot,2024-05-10T01:00:32Z,"The long awaited Akuma returns to Street Fighter 6. In this video he's set to CPU level 7 and battles Manon, Dee Jay, and mirror ...",[],UCbu2SsF-Or3Rsn3NxqODImw,146250,2462,0,193,{},[],{}
13/05/2024,5GngT3Rg2NU,Day 1 of This NEW SURVIVAL GAME has me HYPED! | Bellwright Gameplay | Part 1,Kage848,2024-04-23T20:42:07Z,"Bellwright Gameplay Let's Play - Establish and expand your own settlements, liberate the land, assist its villagers, and recruit ...",[],UCY6c18sccqyFL6PS5KVpicw,145775,3325,0,153,{},[],{}
13/05/2024,8QsjpxxbXbs,Best One v Eight Ending Gameplay Call of Duty Mobile!,DeepanshuCODYT,2024-05-13T12:02:13Z,Just 15Year Old Boy Play Battle Royale Solo vs Squad.. If You Like His Gameplay Plz.... Share & Subscribe This Channel..,[],UCREW9f8iJklpq4bPQwLEATg,8121,602,0,45,{},[],{}
13/05/2024,NdF1niyfH2E,INDIKA : #1 - O INÍCIO DE GAMEPLAY em PORTUGUÊS PT-BR | 4k 60fps,MaxMRM GAMEPLAY,2024-05-08T14:06:08Z,Compre V Rising na Steam aqui: https://store.steampowered.com/app/1604030/V_Rising/?utm_source=MaxMRM Adicione à lista ...,[],UCJ8GQ_SNb-33m_BluT4TTlw,143665,16001,0,689,{},[],{}
13/05/2024,L7fR6_LUkeA,Best Funny Game Ever Played #shorts #gameplay #games,Tootal Gaming 69,2023-03-15T13:37:00Z,Best Funny Game Ever Played #shorts #gameplay #games #tootalgaming69 #androidgames.,[],UCg_2rtTN4Mk0xQiSUg4VnAg,139744113,0,0,855,{},[],{}
13/05/2024,fyVhIlb0bHw,Kiborg - Official Steam Replayability Fest Gameplay Trailer,IGN,2024-05-13T17:00:23Z,"Get a fresh look at Kiborg, the upcoming third-person ultraviolent sci-fi action game from Sobaka Studio that's part of Steam's ...",[],UCKy1dAqELo0zrOtPkf0eTMw,34333,870,0,72,{},[],{}
13/05/2024,PQynmG5N8QM,"PUBG PC GAMEPLAY NOW, BGMI RANK PUSH DONE! RANK=58🐉❤️",HYDRA HRISHAV,2024-05-13T20:57:59Z,"hydraesports #hydrahrishav A Very Warm Welcome to Everyone, I am Hrishav Vishwakarma aka Hydra Hrishav, I Dedicate this ...",[],UCehAE6hCMVAX3PkWLYQLmTQ,24072,2078,0,6,{},[],{}
13/05/2024,PRo7uOrNgGg,"DOGGY RUN GAMEPLAY WALKTHROUGH 🐕🥰 | DOG SWEET 😸 | ANDROID, iOS MOBILE | NEW UPDATE #SHORTS GAMES #0🔥",Gameplay Animation,2021-09-17T13:01:52Z,Hello friend . I am glad to welcome you to my channel .I will be happy if you comment and like this video! I ask you to follow all the ...,[],UCPl0VERb7SjjpE0OIxiIIYw,66849501,2420029,0,2532,{},[],{}
13/05/2024,AieUGe-_nCk,Finger Runner 3D Game - Finger in the Nose #9 #Shorts #Viral #Funny,Oddman Games,2023-05-09T07:00:04Z,SUBSCRIBE for more Funny Videos: https://www.youtube.com/channel/UC0hWgcc02QfOJiSZ24c4uKQ?sub_confirmation=1 ...,[],UC0hWgcc02QfOJiSZ24c4uKQ,49009352,554263,0,457,{},[],{}
13/05/2024,4_UnOs_Ohow,1vs3 🔥 #pubg,ZEMU GAMING,2023-03-15T07:39:51Z,Hello guys how are you today My settings video   https://youtu.be/GafVEf1zpO8 Device iPhone XS Max 5 finger full gyro Please ...,[],UCOayMK9-JkQDTKQGKpLn38A,10979846,541513,0,1432,{},[],{}
13/05/2024,OVJR91ps2ek,Ghost Recon Breakpoint Gameplay,Gameplaysnchill,2023-01-24T03:27:40Z,Subscribe For More Content! :) Social Media Youtube ------------------- https://tinyurl.com/n2aevq5 Tiktok ...,[],UCQJNg0P-W31gcgbsw0JeW7w,1775072,72502,0,346,{},[],{}
13/05/2024,5nKpApXuM1g,(PS5) Camouflage Sniping Mission | Realistic Immersive ULTRA Graphics Gameplay[4K60FPSHDR]CallofDuty,Champs Network,2023-05-31T16:00:04Z,(PS5) Tactical Camouflage Sniping | Realistic Immersive ULTRA Graphics Gameplay [4K 60FPS HDR] Call of Duty Thanks For ...,[],UCRU9vwwARx8jEACqNpi_KFA,13103154,62026,0,1221,{},[],{}
13/05/2024,KLI2esfCsqc,Too Late 💀 | Ready Or Not,FAC TAC,2023-01-24T00:30:09Z,Shorts #ReadyorNot #Swat #Police Ready or Not Gameplay.,[],UCOfz7RhekoAqV1rPKfzTcQA,4607624,209334,0,2500,{},[],{}
13/05/2024,1a7eAo2Q-_k,Ultimate Secret Base!! CKN Gaming,CKN Gaming,2021-02-08T04:21:22Z,Checking out the ultimate Secret Base in Minecraft . It is so cool guys . Check it out. Thanks for watching CKN Gaming.,[],UC135_IPK8XOEEdXdtcseR4w,2431335,8189,0,0,{},[],{}
13/05/2024,CKFyTDanB8A,Fastest YouTuber of pubg mobile history🔥,Fatih GAMING,2024-01-27T12:00:12Z,,[],UCZOW4EOIU_jwHhybPh6q0LQ,1956956,135625,0,689,{},[],{}
13/05/2024,4oZD3k8Y_Ks,Grand Theft Auto 5 - PS5 POV Gameplay,NS Gaming,2023-02-23T10:00:06Z,"Grand Theft Auto 5 - PS5 POV Gameplay Grand Theft Auto V, commonly referred to as GTA 5, is an open-world action-adventure ...",[],UCbmRcXtBBsokomk3fNLLUAA,6565345,151627,0,665,{},[],{}
13/05/2024,FfQdwfz7IoM,If Batman Plays Forza Horizon 5 #shorts,M7HU,2023-04-27T12:00:17Z,Drag Race with the 2019 Raesr Tachyon Speed (Batmobile) in Forza Horizon 5 using the Thrustmaster T300rs Steering Wheel.,[],UC_ETSoji8jM7Gb2RlV9GQmg,5478278,322491,0,3653,{},[],{}
13/05/2024,d7ysZOGsHv0,Gray Zone Warfare : Early Access Gameplay (PC)[2K],Zangado,2024-05-11T13:00:37Z,"Gray Zone Warfare é um jogo de tiro em primeira pessoa tático, intenso e realista. Junte-se a uma empresa militar privada e ...",[],UCuVIWETFdxzwlHEHMbhm2_w,35159,3424,0,150,{},[],{}
13/05/2024,iMtlHsSPZI8,"SEER in Season 21 Abilities 25 KILLS and 5,800 Damage Apex Legends Gameplay",hv apex,2024-05-12T16:00:36Z,25 Kills Bomb and 5000 + Damage With Seer in Season 21! Lean-Batist Channel: https://www.youtube.com/@Lean-Batist ...,[],UCVeowp6qXr_4g_JTsAsWvcQ,8063,257,0,20,{},[],{}
13/05/2024,cqXSS8Qr6TM,The Day Before: Gameplay Comparison (then vs. now),SHO.,2023-02-04T20:00:13Z,thedaybefore #thedaybeforegame #gaming #pcgaming.,[],UCgARJCvlOzaF-pLslkUlD5g,547438,7939,0,344,{},[],{}
13/05/2024,iLF4FCHwvAo,iPhone 13 BGMI #handcam,SpicY PlayZ,2022-12-31T06:24:25Z,,[],UCVwfFePS7j-qLDUn4HZaZKw,1115108,0,0,116,{},[],{}
13/05/2024,64J-08ARU1c,"(PS5) HITMAN 3 - Maldives, Haven Island - Cinematic Run [4k 60FPS]",PlayerKai Gaming,2022-06-29T11:31:04Z,"This video will include Maldives, Haven Island ""Trouble in Paradise"" level in Hitman 3 in cinematic stealth run on professional ...",[],UCX5uxW0ASy9so555o9p8V0w,686964,4480,0,102,{},[],{}
13/05/2024,I-L8BC52A-g,goons in the kitchen | Fallen Aces | noir filter | #indiegame #animation #gameplay,New Blood Interactive,2024-05-10T04:18:03Z,wishlist FALLEN ACES: https://store.steampowered.com/app/1411910/Fallen_Aces/ | Weapo is to blame for this video.,[],UCiNS0ikfd1DT73nn8WPvGsQ,707270,53530,0,477,{},[],{}
13/05/2024,lnmSlvNs2E8,RESIDENT EVIL 4 REMAKE Gameplay Español Parte 1 PS5 (4K 60FPS) | RE4 Remake Walkthrough Guia 100%,DarkPlayer GamingTV,2023-03-23T11:15:03Z,El Gameplay en Español de Resident Evil 4 Remake Hardcore Guia 100%: ...,[],UCWv-0hCp1C3g3OXkY6ssyvQ,1024728,17997,0,1278,{},[],{}
13/05/2024,sjmwa6KR52U,FAR CRY 6 - O INÍCIO DE GAMEPLAY DUBLADO em PORTUGUÊS PT-BR | 4k 60fps no PS5,MaxMRM GAMEPLAY,2021-10-04T16:00:17Z,Neste vídeo conferimos o início de gameplay de Far Cry 6 dublado e legendado em 4k 60fps no PS5. O jogo tem o seu ...,[],UCJ8GQ_SNb-33m_BluT4TTlw,1996879,59285,0,1282,{},[],{}
13/05/2024,JVywqFx0GdE,Detroit Become Human - FULL GAME Walkthrough Gameplay No Commentary (Everyone Survives),Gamer Max Channel,2018-06-20T16:38:18Z,This video is a complete full game walkthrough for Detroit Become Human on best ending. This is an instructional video showing ...,[],UCVdg9q21qjYjBnxp8pMGKvw,3812712,57586,0,5533,{},[],{}
13/05/2024,pBvezl-975I,Stray (PS5) 4K 60FPS HDR Gameplay - (Full Game),FA GAMEZ,2022-07-20T12:00:08Z,Stray (PS5) 4K 60FPS HDR Gameplay - (Full Game) Stray is a 2022 adventure game developed by BlueTwelve Studio and ...,[],UCNerFmYc9oxCBqrL0mv_8ug,3686236,20130,0,590,{},[],{}
13/05/2024,YoStq-KGVjk,Marvel Rivals - 10 Minutes of NEW Gameplay Alpha,Arekkz Gaming,2024-05-11T14:00:32Z,Watch 10 minutes of new gameplay from Marvel Rivals! This alpha footage showcases the intense action and competitive ...,[],UC-zjH-e5XBzMpy_VtwIGRxQ,49941,639,0,204,{},[],{}
13/05/2024,6fNUO23I_BA,"GOD OF WAR RAGNAROK - O Início de Gameplay no PS5, em Português PT-BR!",BRKsEDU,2022-11-08T11:01:00Z,"Vídeo gameplay do jogo God of War Ragnarok, game continuação do God of War de PS4 e que está disponível para PS4 e PS5.",[],UCWKtHaeXVzUscYGcm0hEunw,3730240,181309,0,3401,{},[],{}
13/05/2024,q0vNoRhuV_I,Alan Wake 2 - Gameplay Reveal Trailer | PS5 Games,PlayStation,2023-05-24T21:18:11Z,"Monsters wear many faces Alan Wake 2 releases on October 17, 2023! The long awaited sequel to the award-winning ...",[],UC-2Y8dQb0S6DtpxNgAKoJKA,1569846,44740,0,2898,{},[],{}
13/05/2024,qqlCkF2GWN0,MAG7 GUN DESTRUCTION 27 KILL AJJUBHAI AND AMITBHAI BEST GAMEPLAY - GARENA FREE FIRE,Total Gaming,2022-07-12T04:15:02Z,MAG7 GUN DESTRUCTION 27 KILL AJJUBHAI AND AMITBHAI BEST GAMEPLAY GARENA FREE FIRE TOTAL GAMING.,[],UC5c9VlYTSvBSCaoMu_GI6gQ,4689012,239669,0,3931,{},[],{}
13/05/2024,FSWoUGxGNEg,Angry Birds 2 - Official Gameplay Trailer,Angry Birds,2015-07-30T07:42:22Z,It's time to join your favorite feathered heroes on an all-new adventure as they storm Piggy Island to rescue their poor stolen eggs ...,[],UCYC2wjLop-S6Ld4raeoUVNA,3325298,7585,0,577,{},[],{}
13/05/2024,ggcWTdwWYgo,skyrim in 2023,Jonnny Five,2023-01-09T01:00:12Z,skyrim --------------------------------------------------------------------------------- Join this channel to get access to perks: ...,[],UC19EocxkhiGlQaSvnwHjQaA,1689072,36107,0,1115,{},[],{}
13/05/2024,gRIR38HXKEY,INFAMOUS 1 Gameplay Walkthrough FULL GAME [4K ULTRA HD PS5] - No Commentary,MKIceAndFire,2024-05-08T19:03:35Z,Infamous Game Walkthrough Part 1 and until the last part will include the full Infamous Gameplay on PS5. This Infamous ...,[],UC1bwliGvJogr7cWK0nT2Eag,37053,1028,0,85,{},[],{}
13/05/2024,WvsSF_AcTBw,I Build a Mega Metal Factory - Pal World Gameplay in Hindi,Navrit Gaming,2024-05-13T09:17:37Z,I Build a Mega Metal Factory - Pal World Gameplay in Hindi Recommended Tools: Vidiq - https://vidiq.com/navrit Tubebuddy ...,[],UC7BJ0XwLt-7enyIH-ZY9Euw,20148,2075,0,107,{},[],{}
13/05/2024,KqreWm5ZpHw,My Singing Monsters (Gameplay Trailer),My Singing Monsters,2012-12-11T15:07:24Z,Collect a cast of charming Monsters with a passion for song in the award-winning My Singing Monsters! Download for free: ...,[],UCngRsuvI1zxHR9vwNZvpTAw,72089888,65214,0,4170,{},[],{}
13/05/2024,yYjD78X1d9Q,"Football, Powered by Frostbite - FIFA 17 Official Gameplay Trailer",EA SPORTS FC,2016-08-16T17:32:06Z,"FOOTBALL IS BACK and it's Powered by Frostbite! See new signings, skill moves, celebrations, and Own Every Moment with FIFA ...",[],UCoyaxd5LQSuP4ChkxK0pnZQ,9264169,101746,0,8621,{},[],{}
13/05/2024,JVywqFx0GdE,Detroit Become Human - FULL GAME Walkthrough Gameplay No Commentary (Everyone Survives),Gamer Max Channel,2018-06-20T16:38:18Z,This video is a complete full game walkthrough for Detroit Become Human on best ending. This is an instructional video showing ...,[],UCVdg9q21qjYjBnxp8pMGKvw,3812712,57586,0,5533,{},[],{}
13/05/2024,crji7YyUrx0,STEALING BILLION DOLLAR GOLDEN STATUE FROM MUSEUM | GTA V GAMEPLAY #323 | GTA 5,Wasim Gamer Hindi,2024-05-04T08:30:08Z,STEALING BILLION DOLLAR GOLDEN STATUE FROM MUSEUM | GTA V GAMEPLAY #323 | GTA 5 3dugganboss #gtav ...,[],UCkJfmvqtgJqW1uy4eA3DHrQ,140513,12777,0,775,{},[],{}
13/05/2024,dj0o8JoMfYA,3 Games That No One Plays In India 😞 #shorts | Itsme Boyzz,itsMe BOYzz,2022-08-13T12:47:06Z,"IN This Video I'm gonna talk about, 3 Games That No One Plays In India ! 3 Games That No One Plays! Farlight 84 ...",[],UCd76Qi9hi4a_8ZBlwS-wQzA,2344195,239780,0,3621,{},[],{}
13/05/2024,LzYSH2TADh8,Fortnite Chapter 2 - Season 2 | Battle Pass Gameplay Trailer,Fortnite,2020-02-20T09:09:37Z,More Choices. New Bonuses. 1500 V-Bucks Back. Get the Chapter 2 - Season 2 Battle Pass to unlock the Hideout and earn over ...,[],UClG8odDC8TS6Zpqk9CGVQiQ,14325143,202221,0,17703,{},[],{}
13/05/2024,RSQWHK0J5YM,64 Elimination Solo Vs Squads Gameplay Wins (Fortnite Chapter 5 Season 2 PS4 Controller),SENSEI,2024-05-13T16:45:00Z,Fortnite #SoloVsSquads #FortniteChapter5 #Season2 #ad #FortniteController Buy a Controller @ https://nagashock.com & USE ...,[],UC2Loq2qB-wOLikZfrZ2zKbg,8830,347,0,25,{},[],{}
13/05/2024,FqJ4MRDYUUI,They added Fishing &amp; Much More | Denizen Gameplay | Part 3,Kage848,2024-05-12T18:10:08Z,"Denizen Gameplay Let's Play - Make a living for yourself in a city full of opportunity while you meet a variety of locals, explore ...",[],UCY6c18sccqyFL6PS5KVpicw,7671,430,0,28,{},[],{}
13/05/2024,XLkFmbMusQI,Blight: Survival – Official Gameplay Reveal,GameSpot,2022-11-06T20:00:13Z,Check out 5 minutes of pre-alpha gameplay footage for Blight: Survival a third person action adventure survival game.,[],UCbu2SsF-Or3Rsn3NxqODImw,855406,20170,0,1151,{},[],{}
13/05/2024,LHbDIUP1auQ,World Record? 36 Kills in Duo vs Squad Must Watch Gameplay - Garena Free Fire,Total Gaming,2021-03-29T04:15:01Z,World Record? 36 Kills in Duo vs Squad Must Watch Gameplay Video Free Fire Live One Tap HeadShot Gold to Heroic and ...,[],UC5c9VlYTSvBSCaoMu_GI6gQ,10111198,681469,0,12448,{},[],{}
13/05/2024,bpV_j_cUoOM,Nade God For a Reason 🛐@JONATHANGAMINGYT,SUDBOY EDITS,2022-10-20T13:40:00Z,viral #viralshorts #viralvideo #igc #jonathangaming #jonathan #bgmi #godlike Same Edit On My Instagram also insta- ...,[],UCWs-kxPY1nQ1BVgYsIGqmRg,18338324,1487427,0,2652,{},[],{}
13/05/2024,2AZmuZNu5LA,"Hogwarts Legacy - State of Play Official Gameplay Reveal | PS5, PS4",PlayStation,2022-03-17T21:25:04Z,Become the student you've always wanted to be as you experience life at Hogwarts and embark on a journey through the ...,[],UC-2Y8dQb0S6DtpxNgAKoJKA,11915015,352537,0,23828,{},[],{}
13/05/2024,PbJ0ie1Ao3U,TEKKEN 8 — Jun Kazama Gameplay Trailer,Bandai Namco Entertainment America,2023-03-28T14:00:13Z,Love is a mother's most powerful weapon. Jun Kazama brings balance in all things in #TEKKEN8! Follow Bandai Namco ...,[],UC_ntXHv-XdKCD7CPynVvnQw,2338912,76398,0,9344,{},[],{}
13/05/2024,UovRICGj2-g,INSANE Looking Horror Game Will Make You ILL,Gaming in 60 Seconds,2022-06-22T21:00:13Z,ILL NESS is a first-person atmospheric horror action game with horrifying alien creatures that inhabit inside people while turning ...,[],UCtXCWFGAzqED_Y5VxNiDQLw,1610099,64090,0,1424,{},[],{}
13/05/2024,i2anMw9KxOM,🔥Hot Wheels: Unleashed #4✨ 🏎Batman Map Gameplay,PawPawGo,2022-11-28T15:49:48Z,Hot Wheels: Unleashed #4✨ Batman Map Gameplay Click Here To Subscribe PawPawGo ▻ https://goo.gl/MtyA6w ...,[],UCjkBNfVM-XUbNxxf2VDyVpQ,794886,21,0,1,{},[],{}
13/05/2024,_9W_y8IlNro,Super Mario Maker - &#39;Let&#39;s Watch!&#39; Gameplay Overview,Nintendo of America,2015-08-12T16:00:01Z,"Check out all the new possibilities in the world of Super Mario Maker, exclusively on Wii U! Check out the official Super Mario ...",[],UCGIY_O-8vW4rfX98KlMkvRg,7666978,33165,0,5099,{},[],{}
13/05/2024,iG9lHwyohws,I BECAME A MILITARY SOLDIER | READY OR NOT GAMEPLAY,Ujjwal,2024-04-28T03:30:14Z,"I BECAME A MILITARY SOLDIER | READY OR NOT GAMEPLAY #readyornot #ujjwal Share, Support, Subscribe!!! Subscribe: ...",[],UCl_vAxZpvbO-PFXdDu7EdHw,4507543,175100,0,8700,{},[],{}
