Video ID,Channel Title,Title,Published At,Tags,Thumbnails,Category ID,Duration,View Count,Like Count,Dislike Count,Comment Count
4QIZE708gJ4,PostMaloneVEVO,Post Malone - I Had Some Help (feat. Morgan Wallen) (Official Video),2024-05-10T14:00:06Z,"post malone,had some help,morgan wallen,post malone morgan wallen,post malone had some help,morgan wallen had some help,had some help post malone morgan wallen,posty had some help,posty",https://i.ytimg.com/vi/4QIZE708gJ4/default.jpg,10,PT3M22S,2949415,180035,0,8551
TKQY2ZlIEjY,Megan Thee Stallion,Megan Thee Stallion - BOA [Official Video],2024-05-10T04:00:19Z,"Megan Thee Stallion,Rap,Houston,Hottie,Hip Hop 2019,Hip Hop,Megan Thee Stallion BOA,BOA Megan Thee Stallion,megan thee stallion BOA,megan thee stallion,megan thee stallion boa,boa megan thee stallion,boa meg thee stallion,meg thee stallion boa,boa,BOA,boa megan thee stallion new music,megan thee stallion new music,megan thee stallion new release,boa meg,Megan Thee Stallion - BOA [Official Video],boa official video,megan thee stallion official video,boa video",https://i.ytimg.com/vi/TKQY2ZlIEjY/default.jpg,10,PT3M44S,2307898,194340,0,12678
2KC-8IULfqY,IceSpiceVEVO,Ice Spice - Gimmie A Light (Official Video),2024-05-10T16:00:06Z,"Ice,Spice,Gimmie,Light,10K,Projects/Capitol,Records,Hip,Hop",https://i.ytimg.com/vi/2KC-8IULfqY/default.jpg,10,PT2M7S,830718,60669,0,6082
i1QZO9EiVmY,Post Malone - Topic,I Had Some Help,2024-05-09T10:00:41Z,"Post Malone,ポストマローン,ポスト・マローン,Morgan Wallen,I Had Some Help",https://i.ytimg.com/vi/i1QZO9EiVmY/default.jpg,10,PT2M59S,1112133,64303,0,1256
Cps2uyxo1eM,Nightcap,Shannon Sharpe reacts to Shaquille O'Neal calling Unc out for criticizing Jokic interview | Nightcap,2024-05-10T13:00:10Z,"Nightcap,Shannon Sharpe,Ochocinco,Chad Johnson,Chad Ochocinco,Club Shay Shay,Nightcap Podcast,Shannon Sharpe Podcast,Ochocinco Podcast,Gilbert Arenas,Gil Arenas,Gil Arenas Podcast,Gil Arenas Show",https://i.ytimg.com/vi/Cps2uyxo1eM/default.jpg,17,PT16M40S,687041,20699,0,7423
X9G7Md8QI4k,JRE Clips,"Mike Tyson is ""Terrifying"" Ahead of Jake Paul Fight",2024-05-10T17:00:31Z,"Joe Rogan,JRE,Joe Rogan Experience,JRE Clips,PowerfulJRE,Joe Rogan Fan Page,Joe Rogan Podcast,podcast,MMA,Joe Rogan MMA Show,UFC,comedy,comedian,stand up,funny,clip,favorite,best of",https://i.ytimg.com/vi/X9G7Md8QI4k/default.jpg,22,PT14M27S,1355918,20509,0,4366
SQ1yPMTIwCU,JYP Entertainment,"Stray Kids ""Lose My Breath (Feat. Charlie Puth)"" M/V",2024-05-10T04:00:01Z,"JYP Entertainment,Stray Kids,스트레이 키즈,SKZ,스키즈,방찬,BANG CHAN,리노,LEE KNOW,창빈,서창빈,CHANGBIN,SEOCHANGBIN,현진,황현진,HYUNJIN,HWANGHYUNJIN,한,한지성,HAN,HANJISUNG,필릭스,FELIX,용복,이용복,승민,김승민,SEUNGMIN,KIMSEUNGMIN,아이엔,양정인,I.N,YANGJEONGIN,stray kids comeback,스트레이 키즈 컴백,스키즈 컴백,skz comeback,skz,lose my breath,stray kids lose my breath,skz lose my breath,stray kids charlie puth,skz charlie puth,스키즈 찰리푸스,skz mv,lose my breath mv,스키즈 뮤비,스트레이키즈 뮤비,스키즈 lose my breath 뮤비",https://i.ytimg.com/vi/SQ1yPMTIwCU/default.jpg,10,PT2M53S,10715540,916412,0,108911
7pMrssIrKcY,Gamers Nexus,ASUS Scammed Us,2024-05-11T00:49:24Z,"gamersnexus,gamers nexus,computer hardware,asus scam,asus warranty,asus rma,asus motherboard,asus motherboard warranty,asus,asus rog,asus rog ally,asus ally z1x,asus ally x,asus rog ally warranty,asus rog ally microsd card,asus ally sd card,asus ally thumbstick,asus ally joystick,asus ally joystick drifting,customer induced damage,warranty fraud,magnuson-moss act,louis rossmann",https://i.ytimg.com/vi/7pMrssIrKcY/default.jpg,20,PT29M36S,540279,50790,0,9174
B3x86Eull2U,TV Promos,"Young Sheldon 7x13 ""Funeral"" / 7x14 ""Memoir"" Promo (HD) Series Finale",2024-05-11T01:08:39Z,"young sheldon 7x13 promo,young sheldon 7x13,young sheldon season 7 episode 13 promo,young sheldon 7x13 preview,young sheldon 7x13 trailer,young sheldon season 7,young sheldon s07e13,young sheldon (tv program),young sheldon series finale,young sheldon series finale promo,iain armitage,zoe perry,jim parsons,young sheldon promo,tvpromosdb,young sheldon,7x13,promo,season,episode,trailer,funeral",https://i.ytimg.com/vi/B3x86Eull2U/default.jpg,24,PT16S,342653,4334,0,475
AJZIwDbJxPA,DaFuq!?Boom!,skibidi toilet 73 (full episode),2024-05-10T00:30:08Z,"sfm animation,skibidi toilet vs cameramen,skibidi toilet,scientist skibidi,tv woman,titan cameraman,titan speakerman,skibidi toilet all episodes,titan tv man,g-toilet,gman toilet",https://i.ytimg.com/vi/AJZIwDbJxPA/default.jpg,24,PT9M41S,16300103,686997,0,52247
swVqSElGaHI,JJ Olatunji,I HAVE RETURNED!,2024-05-10T17:55:38Z,,https://i.ytimg.com/vi/swVqSElGaHI/default.jpg,24,PT17M42S,1002725,83726,0,3821
WJW-VvmRKsE,Charli XCX,Charli XCX - 360 (Official Video),2024-05-10T04:00:06Z,"charli xcx,charli xcx - von dutch,von dutch - charli xcx,charli xcx brat,brat charli xcx,charli xcx cult classic,von dutch addison rae remix,charli xcx addison rae remix,charli xcx addison rae,charli xcx 360,360 charli xcx,360 - charli xcx,charli xcx - 360,charli xcx rachel sennott,charli xcx julia fox,charli xcx gabbriette,charli xcx chloe cherry,charli xcx richie shazam,charli xcx b2b,brb charli xcx,charli xcx club classics,club classics charli xcx",https://i.ytimg.com/vi/WJW-VvmRKsE/default.jpg,10,PT4M25S,738482,64690,0,3268
zlFH3aC7Z_c,How Ridiculous,Boat Vs Mountain! Extreme Downhill Rolling Competition,2024-05-10T22:00:39Z,"how ridiculous,rexy,44club",https://i.ytimg.com/vi/zlFH3aC7Z_c/default.jpg,17,PT17M13S,360372,18638,0,1213
jBlC5AOYoBs,Tee Grizzley,Tee Grizzley - Swear to God (Feat. Future) [Official Video],2024-05-10T04:00:06Z,"Tee Grizzley,2 Vaults,Activated,Hip Hop,From The D To The A,Detroit,TeeGrizzley,Jettski Grizzley,Bloodas,Rap,First Day Out,TGrizzly,Jetski Grizzley,Trap,Tgrizzley,Tee Grizzley - Swear to God (Feat. Future) [Official Video],Tee Grizzley Swear to God ft Future,Swear to God Tee Grizzley ft Future,swear to god tee grizzley ft future,tee grizzley ft future swear to god,swear to god tee grizzley,tee grizzley swear to god,swear to god,tee grizzley future,future",https://i.ytimg.com/vi/jBlC5AOYoBs/default.jpg,10,PT3M5S,468160,33936,0,1720
NzKNCn0SunA,TVLine,Young Sheldon 7x12 | George Dies,2024-05-10T01:01:00Z,"TVLine,Michael Ausiello,young sheldon,Lance Barber,Zoe Perry,young sheldon season 7,young sheldon finale,young sheldon george,young sheldon mary,young sheldon george and mary,big bang theory,the big bang theory,tbbt,sheldon cooper,cbs,tv,tv news,television,interview,season 7,young sheldon final episode,young sheldon final season,2024,young sheldon season 7 episode 11,young sheldon season 7 episode 12,episode 7,episode 12,young sheldon george dies",https://i.ytimg.com/vi/NzKNCn0SunA/default.jpg,24,PT9M23S,1420575,9472,0,1384
nXia20jA4tI,Dr.Tamitha Skov,"An Extreme G4 Solar Storm Train, Eight Storms Race to Earth | Space Weather Spotlight 10 May 2024",2024-05-10T19:43:42Z,"space weather,GPS,amateur radio,aurora,photography,astronaut,NASA",https://i.ytimg.com/vi/nXia20jA4tI/default.jpg,25,PT20M50S,218803,9051,0,982
ALM72lthdjE,Peso Pluma,"LA DURANGO (Lyric Video) - Peso Pluma, Junior H, Eslabón Armado",2024-05-10T00:02:31Z,"Peso Pluma,Eslabón Armado,Junior H,PP,Doble P,Double P,Junior,corridos,música mexicana,La Durango,Prajin,Prajin Music,Double P Records",https://i.ytimg.com/vi/ALM72lthdjE/default.jpg,10,PT4M23S,1165807,97443,0,5521
2JTBSa7XsjE,STUDIO CHOOM [스튜디오 춤],'Trendsetter' X 'HUMBLE.' covered by ENHYPEN NI-KI(니키) | May 2024 | Artist Of The Month (4K),2024-05-10T13:00:02Z,"M2,엠투,스튜디오 춤,스춤,Studio choom,COVERS,커버스,DANCE THE X,댄스 더 엑스,댄스,DANCE,비 오리지널,BE ORIGINAL,커버,COVER,Artist Of The Month,AOTM,Drop the dance,드롭더댄스,Mix & Max,믹스앤맥스,믹앤맥,엔하이픈,엔하이픈 니키,ni-ki,enhypen,enhypen ni-ki,aotm ni-ki,ni-ki aotm,artist of the month,아오먼,아오먼 니키,니키 아오먼,니키 엔하이픈,trendsetter,humble,kendrick lamar humble,connor price,켄드릭라마",https://i.ytimg.com/vi/2JTBSa7XsjE/default.jpg,24,PT3M12S,1915019,286371,0,22872
xKEY6THtwuA,Shoreline Mafia,Shoreline Mafia - HEAT STICK (OHGEESY & FENIX FLEXIN)  [Official Music Video],2024-05-10T02:00:07Z,"Shoreline Mafia,ShoreLineDoThatShiT,OTX,Musty,Drakeo,The Ruler 03 Greedo,Atlantic Records,Hip Hop,Rap,traplantic,ohgeesy,master kato,fenix,rob vicious,nun major,Shoreline Mafia Mafia Bidness,Shoreline Mafia Bidness,Mafia Bidness,Shoreline Mafia lbum,Shore line,hyphy,hyphy music,Cali rap,California rap,cali hip hop",https://i.ytimg.com/vi/xKEY6THtwuA/default.jpg,10,PT2M18S,250450,30773,0,2621
NTpbbQUBbuo,HozierVEVO,Hozier - Too Sweet (Official Video),2024-05-10T18:00:08Z,"too sweet hozier,unheard,you're too sweet for me,wildflower and barley,take my whiskey neat,hozier new song,fare well,hozier tiktok,empire now,hozier whiskey song,Hozier,Too Sweet",https://i.ytimg.com/vi/NTpbbQUBbuo/default.jpg,10,PT4M9S,354215,32861,0,964
_23MbK9QLd0,Euphoric Brothers,Garten of Banban 8 - Official Teaser Trailer,2024-05-10T14:05:19Z,"garten of banban devlog,garten of banban ending,poppy playtime,garten of banban gameplay,garten of banban game,garten of banban bosses,garten of banban,garten of banban trailer,garten of banban teaser,garten of banban 7 teaser,garden of banban,garden of banban gameplay,garden of banban trailer,garten of banban 7,garten of banban 7 gameplay,garten of banban 5,garten of banban 8 gameplay,garten of banban 8 teaser,garten of banban 8 trailer,garden of banban 8",https://i.ytimg.com/vi/_23MbK9QLd0/default.jpg,20,PT1M15S,1343546,48926,0,5257
75JPzYvOf1s,"Ryan Hall, Y'all","The May 8, 2024 Severe Weather Outbreak, As It Happened…",2024-05-09T06:57:19Z,"live,weather,live weather channel,weather forecast,tornado,tornadoes,texas,txwx,lawx,nmwx,okwx",https://i.ytimg.com/vi/75JPzYvOf1s/default.jpg,24,PT11H54M59S,2723672,62704,0,360
gnvW3fY3gyg,Young Sheldon,Young Sheldon Series Finale Preview,2024-05-10T16:07:16Z,"the young sheldon,young sheldon,CBS Comedy,young sheldon cast,young sheldon trailer,young sheldon cooper,young sheldon show,young sheldon tv show,cbs young sheldon,Jim Parsons,CBS,Iain Armitage,Zoe Perry,Lance Barber,CBS Sitcom",https://i.ytimg.com/vi/gnvW3fY3gyg/default.jpg,24,PT2M10S,78489,1279,0,104
E7yFvL9WBk4,Nick Pro,Stunts From KNUCKLES In Real Life (Sonic The Hedgehog),2024-05-10T13:11:51Z,"stunts from knuckles,knuckles stunts,stunts from sonic,sonic stunts,sonic stunts in real life,nick pro,nick pro parkour,knuckles,sonic the hedgehog,sonic,sonic the hedgehog 2,sonic movie,stunts in real life,in real life,sonic in real life,stunts,sonic the hedgehog movie,parkour,sonic parkour,real life,sonic the movie",https://i.ytimg.com/vi/E7yFvL9WBk4/default.jpg,17,PT9M56S,430986,4577,0,164
ZUmTlGMt4SI,STARZ,Power Book II: Ghost | Official Trailer | Season 4,2024-05-09T17:00:13Z,"Power book II,Ghost,Power Ghost,Power never ends,legacy,sneak peek,preview,Starz,television,tv,new power,Tariq St. Patrick,aftermath,spinoff,Power spinoff,finale,new,new episodes,Tasha,Power,Power on Starz,Power II on Starz,bts,Power Book II: Ghost clip,Power book II: Ghost Official Clip,power book 2,power book ghost,official clip,ghost bts,behind the scenes,season 4,teaser,official teaser",https://i.ytimg.com/vi/ZUmTlGMt4SI/default.jpg,24,PT2M5S,1684573,12319,0,1884
2UyVehnq8Lo,CBS Sports Golazo - Europe,Bayer Leverkusen vs. Roma: Extended Highlights | UEL Semi-Finals 2nd Leg | CBS Sports Golazo,2024-05-09T21:32:49Z,,https://i.ytimg.com/vi/2UyVehnq8Lo/default.jpg,17,PT14M56S,655621,8126,0,807
OQH886xgcY0,J abdiel,"WYA REMIX BLUE 🔵 - (Video Oficial) J Abdiel, IZaak, Hades 66, Corina Smith, Miky Woodz",2024-05-10T04:00:07Z,,https://i.ytimg.com/vi/OQH886xgcY0/default.jpg,10,PT4M51S,912819,47387,0,1425
yyjiJWXrQ30,PearlescentMoon,Hermitcraft 10: Po Po Permit Purr Purr | Episode 14,2024-05-10T12:25:54Z,"hermitcraft season 10,hermitcraft 10,hermitcraft,minecraft hermitcraft,pearlescentmoon,minecraft lets play,Minecraft,hermitcraft pearl,hermitcraft pearlescentmoon,minecraft starter base,hermitcraft season 10 episode,permit office,minecraft 1.20,hermitcraft friends,Scar,Geminitay,Rendog,Minecraft chorus farm,hermit craft,goodtimeswithscar,hermitcraft season x,season 10,hermitcraft minecraft,hermitcraft vanilla,hc10",https://i.ytimg.com/vi/yyjiJWXrQ30/default.jpg,20,PT35M13S,178918,14865,0,779
g5Ow-kFPtLI,J abdiel,"WYA REMIX RED 🔴 - (Video Oficial) J Abdiel, De La Rose, Yan Block, Jay Wheeler, IZaak",2024-05-10T04:00:07Z,"J Abdiel,De La Rose,Yan Block,Jay Wheeler,IZaak,WYA,WYA REMIX,WYA REMIX RED,2024,Latino,Latina",https://i.ytimg.com/vi/g5Ow-kFPtLI/default.jpg,10,PT5M23S,737747,40034,0,1219
UkA-afhxZjg,NBA,"#2 NUGGETS at #3 TIMBERWOLVES | FULL GAME 3 HIGHLIGHTS | May 10, 2024",2024-05-11T04:22:52Z,"Basketball,G League,NBA,game-0042300233",https://i.ytimg.com/vi/UkA-afhxZjg/default.jpg,17,PT9M32S,1184826,11103,0,2533
ywWwUuWRgsM,Nerrel,Recompilation: An Incredible New Way to Keep N64 Games Alive,2024-05-10T21:45:58Z,"emulation,nintendo 64,preservation,pc port,decompilation,majora's mask,ray tracing,high framerates,mod",https://i.ytimg.com/vi/ywWwUuWRgsM/default.jpg,20,PT11M13S,127342,14589,0,1311
gjx-iHGXk9Q,Paramount Pictures,"A Quiet Place: Day One | Official Trailer 2 (2024 Movie) - Lupita Nyong'o, Joseph Quinn",2024-05-09T13:00:09Z,"Lupita Nyong'o,Joseph Quinn,Djimon Hounsou,Michael Sarnoski,John Krasinski,A Quiet Place: Day One,A Quiet Place,A Quiet Place Franchise,Thriller,Action,Suspense,Horror,Aliens,Alien Invasion,Alien Invasion Movie,Coming Soon,New Movie,2024 Movie,Summer 2024,Summer Movie,New York,Alex Wolff",https://i.ytimg.com/vi/gjx-iHGXk9Q/default.jpg,1,PT2M27S,9343354,41921,0,2611
qGsQl4FQFbQ,Inheritance Machining,Half of a Great Idea,2024-05-10T14:00:44Z,"inheritance machining,inheritance,gears,gear manufacturing,gear hobbing,eureka,bronze,ratchet,involute,notching,lathe,lathe machine,milling machine,bridgeport,rotary table,forming,machine shop,machining,machinist,machine,machine learning,funny,puns,satisfying,do it yourself,storyteller,maker,cathartic,engineering,youtube,asmr,dad jokes,chamfer,chamfering,mechanism,eureka tool",https://i.ytimg.com/vi/qGsQl4FQFbQ/default.jpg,28,PT26M34S,185279,14605,0,699
ZJlDvOr-Zzg,Central Cee,CENTRAL CEE - CC FREESTYLE,2024-05-09T19:00:07Z,"central cee,central,cee,cench,dave,sprinter,doja,day in the life,grm daily,grime,rap,hip hop,uk,mixtape,album,madness,mixtape madness,link up tv,one up,drill,shepherds bush,wild west,23,nike,jordan,chelsea,syna,bellingham,toyota,yaris,urus,trap,synarchy,brand,street,street wear,split decision,no more leaks,ep,entraprenuer,entrepreneur,trapstar,mikey,intro,GRIME,FREESTYLE",https://i.ytimg.com/vi/ZJlDvOr-Zzg/default.jpg,10,PT2M30S,1782949,158126,0,5929
DoKRZRl3-cE,Billie Eilish,Billie Eilish x Fortnite (Featuring “CHIHIRO”),2024-05-10T00:00:07Z,,https://i.ytimg.com/vi/DoKRZRl3-cE/default.jpg,10,PT50S,538912,69838,0,3565
1nEkMeQsQnk,Fanum Live,Fanum Reunites With AMP On Stream..😂,2024-05-09T19:16:52Z,"fanum,fanumfunny,fanumstreams,fanumlive,livefanum",https://i.ytimg.com/vi/1nEkMeQsQnk/default.jpg,20,PT19M9S,515741,13890,0,432
W3ackBw5xX8,AYO Fishing,1v1v1 SHARK TANK Products Fishing Challenge!! Ft. FishingWithNorm,2024-05-10T00:41:53Z,"Shark tank products,Shark Tank,Shark Tank Fishing,Chill n reel,Products,Fishing,Challenge",https://i.ytimg.com/vi/W3ackBw5xX8/default.jpg,22,PT35M23S,172710,11316,0,725
c4kX9jvytgI,Evbo,Minecraft but I SUMMON the PARKOUR GOD,2024-05-09T23:44:29Z,,https://i.ytimg.com/vi/c4kX9jvytgI/default.jpg,20,PT10M9S,466630,18220,0,1496
2D6-BCt0Lwo,Aquarium Info,Raising a Grocery Store Crab as a Pet,2024-05-09T19:39:14Z,"grocery store pets,grocery store crab,grocery store blue crab,grocery store lobster,Leon the Lobster,Pancake the Crab,Waffle the Crab,animal rescue,Kirby,wildlife rescue,Noodle the Crab,Aquarium Info,Aquarium Info girl,Aquarium Info kirby,Aquarium Info axolotl,Krusty Krab,SpongeBob,Bikini Bottom,Plankton,MrKrabs,Krusty Krab for a real life crab,Matthew Beem,Just Joshing",https://i.ytimg.com/vi/2D6-BCt0Lwo/default.jpg,15,PT8M51S,422083,8550,0,1945
CWCnJxAcsVg,Broke,I Built The Amazing Digital Circus Episode 2 out of Lego!,2024-05-09T19:20:13Z,,https://i.ytimg.com/vi/CWCnJxAcsVg/default.jpg,22,PT9M52S,304369,3616,0,189
QnDRzkqgZ-Y,AlondraDessy,BADDIES TURN EMO/GOTH,2024-05-10T00:36:06Z,"Louie’s life,Laura mellado,Alondradessy,Yoatzi,Les do makeup,Murillo twins,Benny soliven,Alondradessy drama,Panchodoesbetter,Ace family,Gnb official,Kb and Karla,luxury closet,walk in closet ideas,designer bag,alanized,Adam ray okay,GNB,GNB OFFICIAL,Austin mcbroom,shawtybae,willito,wendyandeve,Nathaly cuevas,rosa,larray,Emma chamberlain",https://i.ytimg.com/vi/QnDRzkqgZ-Y/default.jpg,22,PT36M3S,94804,4831,0,451
1ZnH_2ufotQ,Baseball Doesn't Exist,The 2024 MLB Season Is Breaking People,2024-05-08T21:00:01Z,,https://i.ytimg.com/vi/1ZnH_2ufotQ/default.jpg,17,PT25M2S,602717,15986,0,1018
3yjbMUdD4eo,FoundFlix,LATE NIGHT WITH THE DEVIL (2024) Ending Explained,2024-05-09T01:00:02Z,"late night with the devil movie review,late night with the devil,late night with the devil spoilers,late night with the devil ending explained,late night with the devil explained,ending explained,ending,explained,last scene,end scene,trailer,clip,foundflix ending explained,foundflix,horror",https://i.ytimg.com/vi/3yjbMUdD4eo/default.jpg,24,PT30M51S,384073,15209,0,790
bTTMVIhMkkM,Hoovies Garage,TEARING APART my Tesla Cybertruck made my mechanic want to RETIRE!!! And we found something BROKEN?,2024-05-08T15:58:21Z,,https://i.ytimg.com/vi/bTTMVIhMkkM/default.jpg,2,PT25M58S,844336,29634,0,6404
dZbUuSmFgMo,Cinemassacre,What Is the Best Castlevania? - 20th Anniversary of Angry Video Game Nerd (AVGN),2024-05-08T18:16:04Z,"james rolfe,cinemassacre,castlevania,avgn,angry video game nerd,avgn season 18,avgn castlevania,avgn dracula,james rolfe dracula,avgn vampire,cinemassacre castlevania,avgn dracula x,avgn richter",https://i.ytimg.com/vi/dZbUuSmFgMo/default.jpg,20,PT25M10S,538491,47769,0,3695
rTd0QPRNZrU,Our Tribe of Many,We got bad news,2024-05-09T13:30:31Z,"large family,large family vlogs,large family homeschool,homeschoolers,lincoln vloggers,nebraska vloggers,family vloggers,interracial couple,interracial family,interracial kids,international family,international couple,international kids,feeding a large family,prolife",https://i.ytimg.com/vi/rTd0QPRNZrU/default.jpg,22,PT34M30S,142066,12108,0,2425
HYGac1djYio,MoreSidemen,SIDEMEN AMONG US BUT THE MAP CHANGES EVERY ROUND,2024-05-07T19:05:44Z,"sidemen,moresidemen,miniminter,ksi,zerkaa,behzinga,tbjzl,vikkstar,wroetoshaw",https://i.ytimg.com/vi/HYGac1djYio/default.jpg,22,PT42M39S,3544924,154574,0,3588
nkPfwXRy3s4,Safiya Nygaard,I Tried Rug Tufting For The First Time,2024-05-07T23:54:31Z,"safiya nygaard,safiya and tyler,tyler williams,safia,sofia,sofiya,rug tufting,rug,rugs,tufting,tufting a rug,my first time tufting a rug,custom rugs,custom rug,moon rug,diy rug,diy,rug tufting gun,tufting gun,chicago,art,artsy,carpet,carpet maker,moon,stars,bats,ceramics,ceramics studio,i tried rug tufting for the first time,bat rug,goth rug",https://i.ytimg.com/vi/nkPfwXRy3s4/default.jpg,22,PT25M9S,1217985,84395,0,1798
uXT-jWF8ZSg,PM7,Pokemon Scarlet but They Randomly Evolve Every Level,2024-05-08T16:00:03Z,"pokemon,pm7,pokemon challenge,pokemon randomizer,pokemon but they randomly evolve every level,pokemon scarlet,pokemon violet,pm7 every level,pm7 every level evolution,pokemen7 every level evolution,pokemon scarlet and violet,pokemon scarlet and violet random,pokemon scarlet but they randomly evolve every level,pokemon every level random evolution,pokemon random evolution challenge,pokemon but,random pokemon,pokemon but they randomly evolve,pokemon but they",https://i.ytimg.com/vi/uXT-jWF8ZSg/default.jpg,20,PT36M45S,295032,11073,0,585
r4hsURcYXVA,Family Island Game,"Family Island: 𝐅𝐑𝐄𝐄 𝐄𝐍𝐄𝐑𝐆𝐘 𝐁𝐄𝐋𝐎𝐖! 🎁| 𝟔,𝟬𝟬𝟬 𝗘𝗻𝗲𝗿𝗴𝘆 𝗕𝗢𝗡𝗨𝗦: Count the bubbles for a chance to WIN! 🫧",2024-05-08T15:00:50Z,"family island game,family island gameplay,family island farm game,how to play family island,island game,family island,family island tips,farm games,island family,games for android,games for ios,mobile games,family island treasure island,islander,treasure island,gameplay walkthrough,new mobile games,game mobile,tips and tricks,funny game,adventure game,family game,walkthrough,Pink Bag",https://i.ytimg.com/vi/r4hsURcYXVA/default.jpg,20,PT10S,368022,15740,0,7041
