Data da Pesquisa,Video ID,Title,Channel Title,Published At,Description,Tags,Channel ID,View Count,Like Count,Dislike Count,Comment Count,Region Restriction,Relevant Topics,Live Streaming Details
11/05/2024,2BHHY9BavCI,DEADPOOL Gameplay Walkthrough Part 1 FULL GAME [4K 60FPS PC ULTRA SETTINGS] - No Commentary,MKIceAndFire,2020-06-28T15:17:40Z,Deadpool Walkthrough Part 1 and until the last part will include the full Deadpool Gameplay on PC. This Deadpool Gameplay is ...,[],UC1bwliGvJogr7cWK0nT2Eag,2978470,35182,0,1008,{},[],{}
11/05/2024,cqXSS8Qr6TM,The Day Before: Gameplay Comparison (then vs. now),SHO.,2023-02-04T20:00:13Z,thedaybefore #thedaybeforegame #gaming #pcgaming.,[],UCgARJCvlOzaF-pLslkUlD5g,547122,7940,0,344,{},[],{}
11/05/2024,4bUkuL9oUbw,Star Wars Lands in the Fortnite Universe | Gameplay Trailer,Fortnite,2024-05-03T07:32:01Z,"In time for May 4, Star Wars brings galactic adventure to different parts of the Fortnite universe: LEGO Fortnite, Battle Royale, ...",[],UClG8odDC8TS6Zpqk9CGVQiQ,3380634,16056,0,1472,{},[],{}
11/05/2024,jQviW9MlQZg,"✅Count Masters All Levels Game Mobile Walkthrough iOS,Android Gameplay Update Pro NDJE40A",DKJ GamePlay,2022-05-31T04:00:14Z,"CountMasters #DKJGameplay ✓Count Masters All Levels Game Mobile Walkthrough iOS,Android Gameplay Update Pro ...",[],UCElqz4X1s4LC--19FPg2dGw,2309759,6399,0,92,{},[],{}
11/05/2024,lC6pKazrhAs,Battery Run💯#shorts #batteryrun #fyp,NORU Gaming,2023-01-13T11:30:11Z,Battery Run  #shorts #batteryrun #fyp Funny Videos ❁◕ ‿ ◕❁ Thanks For Watching Like Subscribe Comment video ...,[],UCK6lv5fUdl_KvvIm0DUPMxw,10703066,118361,0,96,{},[],{}
11/05/2024,JEWqWJCW9P0,TGLTN PUBG GAMEPLAY LIVE,TGLTN,2024-05-11T20:28:46Z,Watch me LIVE every day on Twitch ▻ https://www.twitch.tv/TGLTN Creator Code: TGLTN ...,[],UCQ5rj33Q-QhIpPE2KmoEs2A,75,176,0,0,{},[],{}
11/05/2024,EB0GNm6GeeA,FNF Character Test | gameplay VS playground,GameTime,2021-12-29T06:29:38Z,In this video you will see a test of 6 characters that is compared to the gameplay for Friday Night Funkin' in playground mode with ...,[],UCzo1VsTCT5fk3x8lXHOTTWg,10210637,117908,0,1676,{},[],{}
11/05/2024,ZtHCnXMjIXY,Subway Surfers Gameplay PC - First play,Cartoons Mee,2017-08-09T05:42:09Z,"Subway Surfers Gameplay PC - First play ➤Please Subscribe→https://youtube.com/MarioMee?sub_confirmation=1 Please LIKE, ...",[],UCxz2cC4_n4uWiTaBL9l-tLw,206254612,483968,0,16871,{},[],{}
11/05/2024,SeuyL-3ArD8,White FF Full Gameplay XIT 👽💗,White FF,2022-04-26T17:20:55Z,"Hey, Obrigado Por Assistir! ❤️ White FF! Official Instagram: @whiteffofc Me siga! ✉️ E-mail de contato: ...",[],UC4DYmNBpjCw_j317hDGxs7w,1705659,93881,0,1137,{},[],{}
11/05/2024,kC_wHYMNfuk,"Scary Teacher 3D,Minecraft,MiniWorld,Tom Candy Run,Fortnite,Save The Girl,Crazy Branny Craft,Roblox",GamePlay Adventure,2020-05-11T12:36:40Z,GamePlay_Adventure #Android Please help Gameplay Adventure 1.000.000 subscribe: http://goo.gl/pd27cY. Thanks you ...,[],UCZSKX0Sp81Btp0taUTS7CAA,9427796,38513,0,830,{},[],{}
11/05/2024,Tt1TKIX98_c,"STAR WARS JEDI SURVIVOR - O Início de Gameplay, em Português PT-BR!",BRKsEDU,2023-04-27T15:00:17Z,Confira a Coderhouse: https://bit.ly/CoderHouseBRKsEDU Cupom de desconto: BRKSEDU Vídeo com início de gameplay do ...,[],UCWKtHaeXVzUscYGcm0hEunw,236061,14466,0,252,{},[],{}
12/05/2024,23QMJaHwJUU,[A] Xtreme Gaming vs. Aurora - PGL DOTA 2 Wallachia S #1 - Group Stage - Day 3,PGL,2024-05-12T05:50:21Z,PGL DOTA 2 Wallachia Season #1 May 10-19 Prize pool: $1.000.000 Keen for amazing highlights? Subscribe to PGL DOTA2 ...,[],UC5jpxDZx4yoBo324pMQ91Ww,68117,471,0,0,{},[],{}
12/05/2024,fVbq9ORMlww,I MADE GUNS FOR POKEMON | PALWORLD GAMEPLAY #15,Techno Gamerz,2024-05-12T10:30:13Z,I MADE GUNS FOR POKEMON | PALWORLD GAMEPLAY #15 #palworld #technogamerz Subscribe to our Second YouTube ...,[],UCX8pnu3DYUnx8qy8V_c6oHg,469611,80136,0,13473,{},[],{}
12/05/2024,EmnjWEgjp8A,NOBAR BTR RA PMSL SUPER SUNDAY  - TOPUP DI RYZENGAMINGSTORE.COM,Ryzen Gaming,2024-05-10T14:19:20Z,Join membership sebagai Bocilzen : https://www.youtube.com/channel/UCq7OyQuEX3kBmCgnpRHXCNA/join Don't forget to like ...,[],UCq7OyQuEX3kBmCgnpRHXCNA,6455,3592,0,0,{},[],{}
12/05/2024,kgppJX0G--E,(PS5) THE PACIFIC WAR 1943 | Realistic Immersive ULTRA Graphics Gameplay [4K 60FPS HDR] Call of Duty,Champs Network,2024-01-12T13:03:57Z,(PS5) THE PACIFIC WAR 1943 | Realistic Immersive ULTRA Graphics Gameplay [4K 60FPS HDR] Call of Duty Thanks For ...,[],UCRU9vwwARx8jEACqNpi_KFA,14675287,104960,0,4108,{},[],{}
12/05/2024,d7ysZOGsHv0,Gray Zone Warfare : Early Access Gameplay (PC)[2K],Zangado,2024-05-11T13:00:37Z,"Gray Zone Warfare é um jogo de tiro em primeira pessoa tático, intenso e realista. Junte-se a uma empresa militar privada e ...",[],UCuVIWETFdxzwlHEHMbhm2_w,23569,2674,0,139,{},[],{}
12/05/2024,JnIprXJMvN4,FALLOUT 4 Gameplay Walkthrough FULL GAME [4K 60FPS PC ULTRA] - No Commentary,MKIceAndFire,2024-05-02T22:34:04Z,Fallout 4 Walkthrough Part 1 and until the last part will include the full Fallout 4 Gameplay on PC. This Fallout 4 Gameplay is ...,[],UC1bwliGvJogr7cWK0nT2Eag,115534,2124,0,106,{},[],{}
12/05/2024,F9zosNF1WIA,BATTLE OF YORK™ LOOKS ABSOLUTELY AMAZING | Ultra Realistic Graphics Gameplay [4K 60FPS] Son of Rome,GameV,2024-03-05T15:43:25Z,BATTLE OF YORK™ LOOKS ABSOLUTELY AMAZING | Ultra Realistic Graphics Gameplay [4K 60FPS] Son of Rome Thanks for ...,[],UCAvRtPIFFbnfLHswfRS6zhQ,1964127,19078,0,872,{},[],{}
12/05/2024,YT79QYy2fng,PINE HARBOR Full Gameplay Walkthrough Part 1 &amp; ENDING (FULL GAME),theRadBrad,2024-05-08T20:00:18Z,"Pine Harbor Walkthrough Gameplay Part 1 includes a Full Game Review, Full Gameplay and the Ending for PC with PlayStation 5 ...",[],UCpqXJOEqGS-TCnazcHCo0rA,187537,6122,0,274,{},[],{}
12/05/2024,c4ThPg65yM4,Little Kitty Big City - Español - Impresiones - Juego Completo - Xbox Series X Gameplay,L0k0hGaming,2024-05-11T21:48:30Z,SUSCRÍBETE: http://goo.gl/2nA4f5 #LittleKittyBigCity #Little Kitty #XboxSeriesX Aquí os dejo una guia de Little Kitty Big City para ...,[],UCHybEMsTlz5LLR7MxOOfGjw,5061,375,0,11,{},[],{}
12/05/2024,2wC8fqSivk4,How Female vs Male Climb Ladder (Stellar Blade vs Bloodborne),YouTuBruh,2024-04-08T06:47:01Z,I just found Stellar Blade Ladder Descent is so Cool and Stylish then I remember the funny Bloodborne clip on YouTube.,[],UCGSnO3hxveFSu_I-ADgGDLw,5951587,468221,0,3565,{},[],{}
12/05/2024,3orYgNyzgYU,🔴[Live] We are Back👽I Love You Gyan Bhai💖-Garena Free Fire !!,UnGraduate Gamer,2024-05-12T07:35:05Z,"So , Hi Guys I'm Ayush and Welcome to our channel UnGraduate Gamer    !! Don't forget to Subscribe our Channel  .",[],UCgsWayzDGwj9CclwicO_R3w,57381,11933,0,0,{},[],{}
12/05/2024,YoStq-KGVjk,Marvel Rivals - 10 Minutes of NEW Gameplay Alpha,Arekkz Gaming,2024-05-11T14:00:32Z,Watch 10 minutes of new gameplay from Marvel Rivals! This alpha footage showcases the intense action and competitive ...,[],UC-zjH-e5XBzMpy_VtwIGRxQ,33091,513,0,155,{},[],{}
12/05/2024,5GngT3Rg2NU,Day 1 of This NEW SURVIVAL GAME has me HYPED! | Bellwright Gameplay | Part 1,Kage848,2024-04-23T20:42:07Z,"Bellwright Gameplay Let's Play - Establish and expand your own settlements, liberate the land, assist its villagers, and recruit ...",[],UCY6c18sccqyFL6PS5KVpicw,139179,3245,0,149,{},[],{}
12/05/2024,FrNhyZzpoRU,Arena Breakout: Infinite – 13 Minutes of Gameplay,IGN,2024-05-07T19:00:11Z,"Check out 13 minutes of exclusive gameplay from Arena Breakout: Infinite, the upcoming built-for-PC version of the popular ...",[],UCKy1dAqELo0zrOtPkf0eTMw,112971,3212,0,652,{},[],{}
12/05/2024,f8NlJN0ez7w,Call of Duty Warzone 3 Solo New Gun BAL-27 Gameplay PS5(No Commentary),Marshal No Commentary,2024-05-12T08:30:16Z,Call of Duty Modern Warfare3-Warzone3 Battle Royale Assault Rifles BAL-27 & Striker Season 3 Solo Win Gameplay (No ...,[],UCU-4n0wHbEhRH2aJfXsqM8A,2860,218,0,27,{},[],{}
12/05/2024,w-Z-PBQHqW0,GOD OF WAR RAGNAROK Gameplay Walkthrough Part 1 FULL GAME [PS5] - No Commentary,MKIceAndFire,2022-11-26T21:30:37Z,God Of War Ragnarok Walkthrough Part 1 and until the last part will include the full God Of War Ragnarok Gameplay on PS5.,[],UC1bwliGvJogr7cWK0nT2Eag,988159,8993,0,418,{},[],{}
12/05/2024,lgUjO9Uuf0M,"Best mobile games android ios, cool game ever player #shorts #funny #gaming #puzzle #viralshorts",Max Games YT,2023-06-05T11:00:24Z,"Best mobile games android ios, cool game ever player #shorts #funny #gaming #puzzle #viralshorts #funnygame #puzzle ...",[],UCzoXFSRacjcHFRSqxTB6z_A,102176487,0,0,3083,{},[],{}
12/05/2024,gOAeBbqIANg,MARVEL RIVALS IS ACTUALLY AMAZING.,NoahJ456,2024-05-12T00:06:56Z,MY COACHELLA DJ SET: https://www.youtube.com/watch?v=Hb4sUm-J_Kk REGULAR DONATION: http://tipnoahj456.com ...,[],UCP9tAErY_RlX4RFKssE4ogg,66900,1466,0,67,{},[],{}
12/05/2024,-crzJaZz1aQ,Franklin Plays CHARLIE CHARLIE Ghost Challenge At Night! | Lovely Gaming,Lovely Gaming,2024-05-12T06:52:34Z,"Charlie Charlie Ghost Challenge At Night! THANKS to All the Music Creators I used in the video   Hi nanbargale , in this video ...",[],UC261_KcN9A6EIie_Rq0vlWg,84303,5809,0,417,{},[],{}
12/05/2024,TDPN89X681k,LEGENDARY POKEMONS Vs ALL ELECTRIC POKEMONS!🔥 PalWorld | Techno Gamerz,Dattrax Gaming,2024-05-12T03:30:11Z,LEGENDARY POKEMONS Vs ALL ELECTRIC POKEMONS!   PalWorld | Techno Gamerz FINALLY BREEDING JETRAGON + ...,[],UCJD5R47XWLmJ7nn18T2ZW4w,321978,16914,0,2273,{},[],{}
12/05/2024,5nKpApXuM1g,(PS5) Camouflage Sniping Mission | Realistic Immersive ULTRA Graphics Gameplay[4K60FPSHDR]CallofDuty,Champs Network,2023-05-31T16:00:04Z,(PS5) Tactical Camouflage Sniping | Realistic Immersive ULTRA Graphics Gameplay [4K 60FPS HDR] Call of Duty Thanks For ...,[],UCRU9vwwARx8jEACqNpi_KFA,13082182,61873,0,1219,{},[],{}
12/05/2024,iG9lHwyohws,I BECAME A MILITARY SOLDIER | READY OR NOT GAMEPLAY,Ujjwal,2024-04-28T03:30:14Z,"I BECAME A MILITARY SOLDIER | READY OR NOT GAMEPLAY #readyornot #ujjwal Share, Support, Subscribe!!! Subscribe: ...",[],UCl_vAxZpvbO-PFXdDu7EdHw,4439266,174124,0,8673,{},[],{}
12/05/2024,xP6obUIQHUU,FINALLY 😭😭I CAPTURED JETRAGON ▶ PALWORLD GAMEPLAY #39,Vebv Gaming,2024-05-12T03:30:21Z,FINALLY I CAPTURED JETRAGON ▷ PALWORLD GAMEPLAY #39 Join this channel to get access to perks: ...,[],UCxXoLC9O1-dEjL8tkEaBl6g,6721,751,0,59,{},[],{}
12/05/2024,QbRyNw5D51w,Wow😍MY BEST SNIPER GAMEPLAY TODAY🔥PUBG Mobile,Fatih GAMING,2024-05-12T06:00:17Z,,[],UCZOW4EOIU_jwHhybPh6q0LQ,9845,829,0,49,{},[],{}
12/05/2024,nE5WO5rinus,PUBG | Erangel Classic - Gameplay Trailer,PUBG: BATTLEGROUNDS,2024-05-09T09:00:29Z,"Experience the classic gunplay, feel the familiar tension rise, and immerse yourself once again in this timeless battleground!",[],UCnXDQbqIdp-HQuDyM4p12ng,108771,6422,0,729,{},[],{}
12/05/2024,Ih6WQQGjkwY,Hands On Gameplay with Akuma in Street Fighter 6! He&#39;s as Cool as Ever!,rooflemonger,2024-05-10T01:00:00Z,I was very lucky to be invited by Capcom to try out Akuma and the new Street Fighter 6 balance patch ahead of its release later ...,[],UC-zoo0r7MUN8qD34J8s3Pqw,195840,8430,0,532,{},[],{}
12/05/2024,vv5O8bIcVMs,STELLAR BLADE PS5 Walkthrough Gameplay Part 10 - ABYSS LEVOIRE (FULL GAME),theRadBrad,2024-05-11T14:00:44Z,"PS5 Stellar Blade Walkthrough Gameplay Part 10 includes a Full Game Review, Full Gameplay and Campaign Mission 10 of ...",[],UCpqXJOEqGS-TCnazcHCo0rA,23953,1892,0,109,{},[],{}
12/05/2024,j9_QUfyzBbI,Yatoro Juggernaut Blademaster - Dota 2 Pro Gameplay [Watch &amp; Learn],Dota 2 Pro Gameplay [Watch & Learn],2024-05-11T14:00:37Z,Dendi Pudge Legendary Hero ▻ https://bit.ly/46TGZFS 135 Kills Tinker 99 999 Gold - 3 Hours Epic Battle ▻ https://bit.ly/49kk5J7 ...,[],UCwI9DhoGEziLUxTpK8H77jw,3429,33,0,5,{},[],{}
12/05/2024,_ZCnb2d74lQ,Free Fire Handcam Gameplay On Lone Wolf | God Level Gameplay On Free Fire ||#shorts #viralshort,R1 FUEGO ,2022-09-24T03:35:38Z,1. Garena Free Fire Indonesia Live 2.Garena Free Fire Brazil Live 3.Garena Free Fire India Live 4.Garena Free ...,[],UC_eX8hvj_Ea4YZeqBq1YliA,766080,29481,0,209,{},[],{}
12/05/2024,IKBjWalOeiY,NEW Spider-Man Gameplay - Marvel Rivals Game,DVESF,2024-05-11T01:46:50Z,Subscribe here! http://bit.ly/2OjezN8 ✘Twitter: https://bit.ly/34zbJxm This Walkthrough/Gameplay/Clip/Playthrough has been ...,[],UC98iNEL2XiBUaXt3BjV7BrA,40247,979,0,167,{},[],{}
12/05/2024,64J-08ARU1c,"(PS5) HITMAN 3 - Maldives, Haven Island - Cinematic Run [4k 60FPS]",PlayerKai Gaming,2022-06-29T11:31:04Z,"This video will include Maldives, Haven Island ""Trouble in Paradise"" level in Hitman 3 in cinematic stealth run on professional ...",[],UCX5uxW0ASy9so555o9p8V0w,677969,4434,0,102,{},[],{}
12/05/2024,xQSVTw5xpOg,GTA 5 : MICHAEL TRAPPED IN BIG DANGEROUS SITUATION || BB GAMING,BB GAMING,2024-05-12T07:30:07Z,SUBSCRIBE BY OTHER CHANNELS :-- NEW VLOGGING CHANNEL: ...,[],UCMuXGzMQX65XcPs-zC5P39g,84964,11069,0,532,{},[],{}
12/05/2024,L7fR6_LUkeA,Best Funny Game Ever Played #shorts #gameplay #games,Tootal Gaming 69,2023-03-15T13:37:00Z,Best Funny Game Ever Played #shorts #gameplay #games #tootalgaming69 #androidgames.,[],UCg_2rtTN4Mk0xQiSUg4VnAg,139568339,0,0,854,{},[],{}
12/05/2024,ISyvt8_uc9k,ESTRENO ÉPICO !! ENCUENTRO a SYRINGEON !! | Garten of Banban 7 (Gameplay Español) #1,iTownGamePlay *Terror&Diversión*,2024-05-10T14:00:13Z,"Hazte MIEMBRO y disfruta de muchas ventajas: http://youtube.com/iTownGamePlay/join Gustaa!, super estreno y maratown en el ...",[],UCKmlxQVs0vHtaLldRIQ8lsA,152851,9390,0,486,{},[],{}
12/05/2024,sRCgzwg26SY,Garten of ban ban 7 🥰 gameplay in tamil|Part-1|On vtg!,vasanth தமிழ் gaming,2024-05-12T03:57:57Z,The official mobile game of Garten of Banban 7! The official mobile game of Garten of Banban 7! Languages available: - English ...,[],UCSA8e9rP3qzxlGIzoDrlc0A,20971,1619,0,363,{},[],{}
12/05/2024,PVOGHjMw6Gk,Call of Duty Warzone 3 Solo SVA Gameplay PS5(No Commentary),Marshal No Commentary,2024-05-11T08:30:06Z,Call of Duty Modern Warfare3-Warzone3 Battle Royale Assault Rifles SVA 545 & Striker Season 3 Solo Win Gameplay (No ...,[],UCU-4n0wHbEhRH2aJfXsqM8A,19294,542,0,37,{},[],{}
12/05/2024,PRo7uOrNgGg,"DOGGY RUN GAMEPLAY WALKTHROUGH 🐕🥰 | DOG SWEET 😸 | ANDROID, iOS MOBILE | NEW UPDATE #SHORTS GAMES #0🔥",Gameplay Animation,2021-09-17T13:01:52Z,Hello friend . I am glad to welcome you to my channel .I will be happy if you comment and like this video! I ask you to follow all the ...,[],UCPl0VERb7SjjpE0OIxiIIYw,66843637,2420082,0,2532,{},[],{}
12/05/2024,JVywqFx0GdE,Detroit Become Human - FULL GAME Walkthrough Gameplay No Commentary (Everyone Survives),Gamer Max Channel,2018-06-20T16:38:18Z,This video is a complete full game walkthrough for Detroit Become Human on best ending. This is an instructional video showing ...,[],UCVdg9q21qjYjBnxp8pMGKvw,3809346,57545,0,5530,{},[],{}
12/05/2024,GQ_p1Lc1iik,LIVE SLOT PRAGMATIC PLAY HARI INI | SITUS SLOT GACOR HARI INI | POLA GACOR GATES OF OLYMPUS HARI INI,Irwan Official,2024-05-11T19:00:15Z,LIVE SLOT PRAGMATIC PLAY HARI INI | SITUS SLOT GACOR HARI INI | POLA GACOR GATES OF OLYMPUS HARI INI Hello ...,[],UCZYKUXCQFJ0vR9u_BieyfbQ,9516,11275,0,0,{},[],{}
12/05/2024,BdI-gIqNecs,GTA 5 : MICHAEL BECOME THE BILLIONAIRE BOSS | GTA 5 GAMEPLAY #636,Lazy Steezy,2024-05-12T07:33:28Z,GTA 5 : MICHAEL BECOME THE BILLIONAIRE BOSS | GTA 5 GAMEPLAY #636. • My Second Channel ...,[],UCwMDh433fSOPCgKZV5tvRPg,19903,2943,0,203,{},[],{}
12/05/2024,AieUGe-_nCk,Finger Runner 3D Game - Finger in the Nose #9 #Shorts #Viral #Funny,Oddman Games,2023-05-09T07:00:04Z,SUBSCRIBE for more Funny Videos: https://www.youtube.com/channel/UC0hWgcc02QfOJiSZ24c4uKQ?sub_confirmation=1 ...,[],UC0hWgcc02QfOJiSZ24c4uKQ,48967119,553740,0,455,{},[],{}
12/05/2024,P_Gv7lA_kkY,TARKOV SINGLE PLAYER ES BRUTAL | ESCAPE FROM TARKOV Gameplay Español,Menos Trece,2024-05-11T12:00:18Z,Canal Secundario ▹▹▹ https://www.youtube.com/channel/UCL2wqcZppCSYX-CSMpIcp7Q ○ Eneba: Juegos -70% descuento!,[],UCjuRnAVSiarRGOI8DA2oJtQ,57370,6286,0,536,{},[],{}
12/05/2024,EvcHUxTVeFw,omg😱MY NEW HARDEST GAMEPLAY OF THE WEEK | pubg mobile bgmi,Nemo,2024-05-11T02:45:52Z,Like & Subscribe for more videos. FOLLOW ME Instagram - https://www.instagram.com/nemogaming_​​ Facebook ...,[],UCGR5ZFJp9wPCpH8wi6Lc3vQ,44380,1009,0,56,{},[],{}
12/05/2024,4_UnOs_Ohow,1vs3 🔥 #pubg,ZEMU GAMING,2023-03-15T07:39:51Z,Hello guys how are you today My settings video   https://youtu.be/GafVEf1zpO8 Device iPhone XS Max 5 finger full gyro Please ...,[],UCOayMK9-JkQDTKQGKpLn38A,10967197,541068,0,1431,{},[],{}
12/05/2024,OVJR91ps2ek,Ghost Recon Breakpoint Gameplay,Gameplaysnchill,2023-01-24T03:27:40Z,Subscribe For More Content! :) Social Media Youtube ------------------- https://tinyurl.com/n2aevq5 Tiktok ...,[],UCQJNg0P-W31gcgbsw0JeW7w,1771176,72324,0,345,{},[],{}
12/05/2024,KLI2esfCsqc,Too Late 💀 | Ready Or Not,FAC TAC,2023-01-24T00:30:09Z,Shorts #ReadyorNot #Swat #Police Ready or Not Gameplay.,[],UCOfz7RhekoAqV1rPKfzTcQA,4602063,209084,0,2496,{},[],{}
12/05/2024,wZbg6uY9jV0,JUMBO JOSH ha VUELTO para SALVARNOS !! | Garten of Banban 7  (Gameplay Español) #4 / FINAL,iTownGamePlay *Terror&Diversión*,2024-05-10T17:00:42Z,"Hazte MIEMBRO y disfruta de muchas ventajas: http://youtube.com/iTownGamePlay/join OMG!!, el final más legendario de todos ...",[],UCKmlxQVs0vHtaLldRIQ8lsA,84070,5118,0,306,{},[],{}
12/05/2024,1a7eAo2Q-_k,Ultimate Secret Base!! CKN Gaming,CKN Gaming,2021-02-08T04:21:22Z,Checking out the ultimate Secret Base in Minecraft . It is so cool guys . Check it out. Thanks for watching CKN Gaming.,[],UC135_IPK8XOEEdXdtcseR4w,2424851,8188,0,0,{},[],{}
12/05/2024,NdF1niyfH2E,INDIKA : #1 - O INÍCIO DE GAMEPLAY em PORTUGUÊS PT-BR | 4k 60fps,MaxMRM GAMEPLAY,2024-05-08T14:06:08Z,Compre V Rising na Steam aqui: https://store.steampowered.com/app/1604030/V_Rising/?utm_source=MaxMRM Adicione à lista ...,[],UCJ8GQ_SNb-33m_BluT4TTlw,130651,15080,0,674,{},[],{}
12/05/2024,0jSOcOMLyC8,INTENSE RANKED MATCHES IN TOP SPIN 2K25 | PS5 Gameplay,TheApexHound,2024-05-11T15:00:03Z,"We have an abysmal record in ranked, Can we finally turn it around and get some wins?",[],UCgVls4NK7dz95eGULu8XApQ,6287,120,0,18,{},[],{}
12/05/2024,2YeUJJ4xAC4,STRAY Gameplay Walkthrough Part 1 FULL GAME [4K 60FPS PS5] -  No Commentary,MKIceAndFire,2022-07-20T00:15:38Z,Stray Walkthrough Part 1 and until the last part will include the full Stray Gameplay on PS5. This Stray Gameplay is recorded in 4K ...,[],UC1bwliGvJogr7cWK0nT2Eag,4074002,50360,0,2421,{},[],{}
12/05/2024,JVywqFx0GdE,Detroit Become Human - FULL GAME Walkthrough Gameplay No Commentary (Everyone Survives),Gamer Max Channel,2018-06-20T16:38:18Z,This video is a complete full game walkthrough for Detroit Become Human on best ending. This is an instructional video showing ...,[],UCVdg9q21qjYjBnxp8pMGKvw,3809346,57545,0,5530,{},[],{}
12/05/2024,TtUGTjOPBQA,MAIS CHAVES ALEATÓRIAS NA STEAM! #steam #games #gameplay,raphainhahost,2024-05-10T16:05:22Z,,[],UChcD5jP2fV9-YRl1jFN3TQQ,19805,3484,0,30,{},[],{}
12/05/2024,qr9NT3Ics3A,Homeworld 3 - #1 - Gameplay / Deutsch - Die schönste Weltraum-Strategie ist zurück!,GameTube,2024-05-10T18:15:03Z,GameTube als Podcast: https://open.spotify.com/show/3QMadPVuIT6gWCBGTu3k2j?si=03fc4e1bca7a4ba6 Playlist zu ...,[],UC4exMFDKv2U6TGgi9pLQxPg,4289,151,0,15,{},[],{}
12/05/2024,fuQf-iGCmKA,Temple Run 2 (2023) - Gameplay (PC UHD) [4K60FPS],Throneful,2023-01-02T13:00:30Z,Temple Run 2 (2023) - Gameplay (PC UHD) [4K60FPS] POKI - https://poki.com/en/g/temple-run-2. Gaming PC Specs ▻CPU AMD ...,[],UCIw5rbXUrtk31t20Ap5817w,1459701,6428,0,155,{},[],{}
12/05/2024,YnLXXNEALSM,WORLD WAR Z Gameplay Walkthrough Part 1 FULL GAME [4K 60FPS PS5] - No Commentary,MKIceAndFire,2023-03-20T18:00:58Z,World War Z Game Walkthrough Part 1 and until the last part will include the full World War Z Gameplay on PS5. This World War Z ...,[],UC1bwliGvJogr7cWK0nT2Eag,1098324,10844,0,341,{},[],{}
12/05/2024,4_UnOs_Ohow,1vs3 🔥 #pubg,ZEMU GAMING,2023-03-15T07:39:51Z,Hello guys how are you today My settings video   https://youtu.be/GafVEf1zpO8 Device iPhone XS Max 5 finger full gyro Please ...,[],UCOayMK9-JkQDTKQGKpLn38A,10967197,541068,0,1431,{},[],{}
12/05/2024,8FCYHGAhAwc,JOGOS terão ANÚNCIOS NO MEIO DA GAMEPLAY!!! #gameplayrj #davyjones #ad #ea,Gameplayrj,2024-05-11T02:00:05Z,"GCM GAMES GIFT CARDS - CARTÃO DA PSN, XBOX, STEAM, APPLE, GOOGLE PLAY, NINTENDO, BTL.NET, RIXTY ...",[],UCJAbkIY17zAmCTNQHH0bQoQ,15602,1152,0,15,{},[],{}
12/05/2024,F6pUz41HMpE,RDR2 Vs AC Mirage : Comparing 5 gameplay features FINAL PART #rdr2 #gaming #ubisoft #acmirage,One Minute Gaming,2024-05-11T00:00:10Z,rdr2gameplay #gaming #arthurmorgan #viral #edit #shorts #assassinscreedmirage ...,[],UCbP449RtHbxn2mG_GKuo4IA,61813,7121,0,76,{},[],{}
12/05/2024,yQPesB1zH-4,Hip hop vs 3 Grandmaster Squad 😈😱 Real life Gameplay 🇳🇵🇧🇷 #ffshorts #shorts,Rox yt,2024-05-10T07:39:00Z,ffshorts #freefireshorts #youtubeshorts #ytshorts.,[],UCSRIO3stedsmG_8c4Cx6InQ,98008,8861,0,5,{},[],{}
12/05/2024,FFo8EFhx1qg,This Game Really Caught Me By Surprise (TALES OF KENZERA Walkthrough Gameplay Part 1),theRadBrad,2024-04-30T14:00:10Z,"Tales of Kenzera: ZAU is out now! Click here to buy: https://www.inflcr.co/SHKMU Tales of Kenzera is now out on PS5, Xbox ...",[],UCpqXJOEqGS-TCnazcHCo0rA,166549,5230,0,323,{},[],{}
12/05/2024,vkJQZ2Cz9-s,TEKKEN 8 — Jin Kazama Gameplay Trailer,Bandai Namco Entertainment America,2023-02-28T15:00:45Z,You can't choose your family. But you can fight for your fate. #JinKazama is back in #TEKKEN8! http://spr.ly/60063vPAw ...,[],UC_ntXHv-XdKCD7CPynVvnQw,2534978,58158,0,5118,{},[],{}
12/05/2024,64J-08ARU1c,"(PS5) HITMAN 3 - Maldives, Haven Island - Cinematic Run [4k 60FPS]",PlayerKai Gaming,2022-06-29T11:31:04Z,"This video will include Maldives, Haven Island ""Trouble in Paradise"" level in Hitman 3 in cinematic stealth run on professional ...",[],UCX5uxW0ASy9so555o9p8V0w,677969,4434,0,102,{},[],{}
12/05/2024,CKFyTDanB8A,Fastest YouTuber of pubg mobile history🔥,Fatih GAMING,2024-01-27T12:00:12Z,,[],UCZOW4EOIU_jwHhybPh6q0LQ,1944205,135029,0,688,{},[],{}
12/05/2024,KLI2esfCsqc,Too Late 💀 | Ready Or Not,FAC TAC,2023-01-24T00:30:09Z,Shorts #ReadyorNot #Swat #Police Ready or Not Gameplay.,[],UCOfz7RhekoAqV1rPKfzTcQA,4602063,209084,0,2496,{},[],{}
12/05/2024,Ha_-3ChWCqk,HALO INFINITE Campaign Gameplay Walkthrough FULL GAME No Commentary,GameClips,2021-12-08T18:14:51Z,HALO INFINITE Campaign Gameplay Walkthrough FULL GAME No Commentary New Trailers 2021! Subscribe To Gameclips To ...,[],UCj4lFy4F5PqXD7d41mCKVYw,2007898,22195,0,1746,{},[],{}
12/05/2024,iLF4FCHwvAo,iPhone 13 BGMI #handcam,SpicY PlayZ,2022-12-31T06:24:25Z,,[],UCVwfFePS7j-qLDUn4HZaZKw,1109025,0,0,116,{},[],{}
12/05/2024,rjiW4h7KSkw,SOLO 10 KILLS IN BGIS YUVIJOD GAMEPLAY ANALYSIS  @YuviGaming-vo9dc,Mr Spike Gaming,2024-05-11T15:32:14Z,"Download SoStronk: https://sostronk-app.onelink.me/gsWo/l6sb7216 Play BGMI, Win ₹ 50000 Daily Message me on Instagram ...",[],UCasVrVp-Lr0ynmxFeXRG3oQ,68220,8059,0,195,{},[],{}
12/05/2024,-LEadiNJ5vM,GTA 5 : I LOST MY BIKE | GTA V BANGLA GAMEPLAY #96,Miraz The Gamer,2024-05-11T08:01:42Z,Like Aim : 10K Social Media: Instagram: https://www.instagram.com/mirazthegamer/ Facebook: ...,[],UCSYqG1_9j6BzqrDfKr9rOrg,61518,6562,0,824,{},[],{}
12/05/2024,e90WhwN2QdQ,PUBG: BATTLEGROUNDS (2023) Gameplay (PC UHD) [4K60FPS],Throneful,2023-01-02T19:00:13Z,PUBG: BATTLEGROUNDS (2023) Gameplay (PC UHD) [4K60FPS] Steam ...,[],UCIw5rbXUrtk31t20Ap5817w,1426162,15237,0,502,{},[],{}
12/05/2024,wP3uNAlCskY,Street Fighter 6 - 8 Minutes of Akuma Gameplay (High-Level CPU),GameSpot,2024-05-10T01:00:32Z,"The long awaited Akuma returns to Street Fighter 6. In this video he's set to CPU level 7 and battles Manon, Dee Jay, and mirror ...",[],UCbu2SsF-Or3Rsn3NxqODImw,111879,2040,0,175,{},[],{}
12/05/2024,X2z9mwLQEfk,Uncharted: The Lost Legacy (PS5) 4K HDR Gameplay - (Full Game),FA GAMEZ,2021-05-26T12:01:40Z,Uncharted: The Lost Legacy (PS5) 4K HDR Gameplay - (Full Game) Uncharted: The Lost Legacy is a 2017 action-adventure ...,[],UCNerFmYc9oxCBqrL0mv_8ug,3331915,23217,0,790,{},[],{}
12/05/2024,pBvezl-975I,Stray (PS5) 4K 60FPS HDR Gameplay - (Full Game),FA GAMEZ,2022-07-20T12:00:08Z,Stray (PS5) 4K 60FPS HDR Gameplay - (Full Game) Stray is a 2022 adventure game developed by BlueTwelve Studio and ...,[],UCNerFmYc9oxCBqrL0mv_8ug,3678920,20110,0,591,{},[],{}
12/05/2024,_XJuTYzDIcg,Marvel Rivals | Gameplay FR + Info Codes Alpha !,StiM,2024-05-11T10:01:58Z,Gameplay / Let's Play sur Marvel Rivals en français (FR) ! Pensez à vous abonner ...,[],UCQNZ0D6gi7XupBSLK3MVk-A,8871,406,0,32,{},[],{}
12/05/2024,lnmSlvNs2E8,RESIDENT EVIL 4 REMAKE Gameplay Español Parte 1 PS5 (4K 60FPS) | RE4 Remake Walkthrough Guia 100%,DarkPlayer GamingTV,2023-03-23T11:15:03Z,El Gameplay en Español de Resident Evil 4 Remake Hardcore Guia 100%: ...,[],UCWv-0hCp1C3g3OXkY6ssyvQ,1023817,17979,0,1278,{},[],{}
12/05/2024,8-N5fYjhQO8,Pragmata - Official Gameplay Teaser Trailer | Capcom Showcase 2023,IGN,2023-06-12T22:16:37Z,"We finally get our first tease of what Pragmata will actually look like, along with an apology for the game's further delay.",[],UCKy1dAqELo0zrOtPkf0eTMw,675477,22781,0,1505,{},[],{}
12/05/2024,sjmwa6KR52U,FAR CRY 6 - O INÍCIO DE GAMEPLAY DUBLADO em PORTUGUÊS PT-BR | 4k 60fps no PS5,MaxMRM GAMEPLAY,2021-10-04T16:00:17Z,Neste vídeo conferimos o início de gameplay de Far Cry 6 dublado e legendado em 4k 60fps no PS5. O jogo tem o seu ...,[],UCJ8GQ_SNb-33m_BluT4TTlw,1995831,59267,0,1282,{},[],{}
12/05/2024,QiSVpxFvDew,O NOVO Jogo do GATO! - Little Kitty Big City - O Início (Gameplay PT-BR Português),Hagazo,2024-05-10T16:31:57Z,"Conferimos Little Kitty Big City, o NOVO Jogo do Gato! Lançado no dia 9 de maio para Xbox Series, Xbox One, Nintendo Switch e ...",[],UC0thds55Zx_icfe2QyO5eIA,13487,1176,0,55,{},[],{}
