Data da Pesquisa,Video ID,Title,Channel Title,Published At,Description,Tags,Channel ID,View Count,Like Count,Dislike Count,Comment Count,Region Restriction,Relevant Topics,Live Streaming Details
12/05/2024,5GJWxDKyk3A,Billie Eilish - Happier Than Ever (Official Music Video),BillieEilishVEVO,2021-07-30T16:00:09Z,"Listen to the new album “Happier Than Ever”, out now: https://BillieEilish.lnk.to/HappierTh... Directed by Billie Eilish Follow Billie ...",[],UCDGmojLIoWpXok597xYo8cg,366118052,6438244,0,154868,{},[],{}
12/05/2024,GwqXanhE5hw,"Musica para trabajar activo y alegre - Música Alegre para en Tiendas, Cafés| Deep House Mix 2024 #30",Legend Music - Música Electrónica,2024-05-07T03:37:45Z,"Musica para trabajar activo y alegre - Música Alegre para en Tiendas, Cafés| Deep House Mix 2024 #30 Musica para trabajar ...",[],UCNnQqoYFCqLID3GAMkGtS6A,102708,1189,0,8,{},[],{}
12/05/2024,mRFVUuBlpHM,Fresno - Uma Música,FresnoVEVO,2009-06-26T19:20:19Z,Music video by Fresno performing Uma Música. (C) 2008 Universal Music Ltda.,[],UCXMLR9S2G2MpKnlPHjjfHgg,5984206,26267,0,2067,{},[],{}
12/05/2024,r92TO57gBqI,MÚSICA DO FILME ACAMPAMENTO DE FÉRIAS 3 - ISSO É ROXTEEN / ÚLTIMO SHOW MENINOS VS MENINAS,LUCCAS NETO - LUCCAS TOON,2021-01-15T22:00:11Z,FILME ACAMPAMENTO DE FÉRIAS 3: ...,[],UC_gV70G_Y51LTa3qhu8KiEA,9054540,115785,0,0,{},[],{}
12/05/2024,RhSjBSGTtSo,Musical católico Mãezinha do Céu | música para bebe Arte Piedosa,Arte Piedosa - Estúdio de animação católico,2016-04-20T15:06:07Z,Quem já cantou essa música? Mãezinha do Céu se tornou tradicional no Brasil e encanta pela pureza infantil. Demonstra um ...,[],UCd54iNpMDFb9Cdrh0_zHiig,40949462,285434,0,2260,{},[],{}
12/05/2024,7QU1nvuxaMA,Audioslave - Like a Stone (Official Video),AudioslaveVEVO,2009-10-25T07:20:03Z,Official Video for ”Like A Stone” by Audioslave Listen to Audioslave: https://Audioslave.lnk.to/listenYD Subscribe to the official ...,[],UCHc7ICbMq7vwaToJQeEtnrA,1236495575,4784213,0,134228,{},[],{}
12/05/2024,XXYlFuWEuKI,The Weeknd - Save Your Tears (Official Music Video),TheWeekndVEVO,2021-01-05T17:00:12Z,"Official music video by The Weeknd performing ""Save Your Tears""– 'After Hours' available everywhere now: ...",[],UCF_fDSgPpBQuh1MsUTgIARQ,1548383644,9210522,0,301060,{},[],{}
12/05/2024,P4E831Xqs1c,Luan Pereira ft. @GustavoMioto - Moletom (Oficial),Luan Pereira LP,2023-06-30T14:00:10Z,Ouça agora: https://agroplaybr.ffm.to/moletom Shows: (62) 99653-8762 LP Produções e AgroPlay Music apresenta: Direção ...,[],UCAdN9VApym_qAQirG-kROvg,110218426,645551,0,41107,{},[],{}
12/05/2024,YaEG2aWJnZ8,Sia - Unstoppable (Official Video - Live from the Nostalgic For The Present Tour),Sia,2021-09-27T20:55:30Z,"'This Is Acting' is already 5 years old Thanks to all of you it's been a truly *Unstoppable* journey! To celebrate, here's a ...",[],UCN9HPn2fq-NL8M5_kp4RWZQ,378897076,3156501,0,55009,{},[],{}
12/05/2024,pW9wY_OJpVc,Zona De Perigo,Léo Santana - Topic,2022-12-19T03:03:51Z,Provided to YouTube by Universal Music Group Zona De Perigo · Léo Santana Zona De Perigo ℗ 2022 Universal Music Ltda ...,[],UCQpQCI2ATQXPm26YFzbV2ww,63168407,469734,0,2199,{},[],{}
12/05/2024,QvYSckKSL5g,Tracy Chapman - Baby Can I Hold You (Live),ShoutFactoryVEVO,2020-04-11T01:02:01Z,"Tracy Chapman performs ""Baby Can I Hold You"" http://vevo.ly/n7svzZ.",[],UC-oYSv96tFifyD-Lijqs5mw,157608228,1020338,0,21299,{},[],{}
12/05/2024,I8KkJ1EiLUY,"Canta Comigo - Tá Ok (Dueto - Trend TikTok Brasil) “então toma, toma, toma” #shorts",Bernardo Gomes,2023-06-08T20:13:00Z,Encontra-me nas outras redes! Não tenho autorais no Spotify (ainda) INSTAGRAM: http://www.instagram.com/itsgomesofc ...,[],UCI3Q3avhQ8Q685yCSQS7I_g,6335644,177619,0,3860,{},[],{}
12/05/2024,2S24-y0Ij3Y,BLACKPINK - &#39;Kill This Love&#39; M/V,BLACKPINK,2019-04-04T14:58:45Z,BLACKPINK - Kill This Love 천사 같은 Hi 끝엔 악마 같은 Bye 매번 미칠듯한 High 뒤엔 뱉어야 하는 Price 이건 답이 없는 Test 매번 ...,[],UCOmHUn--16B90oW2L6FRR3A,1957913462,25455490,0,2485657,{},[],{}
12/05/2024,0Bej8-hOfDU,"Louvores de Adoração 2024 - As Melhores Músicas Gospel Mais Tocadas - Top Gospel, Hinos Evangélicos",TOP MÚSICAS GOSPEL,2024-05-11T01:18:28Z,"Louvores de Adoração 2024 - As Melhores Músicas Gospel Mais Tocadas - Top Gospel, Hinos Evangélicos ...",[],UCMnwr3b07QGBOB4b0dNw-EQ,138480,1425,0,9,{},[],{}
12/05/2024,w46bWxS9IjY,I Don&#39;t Want To Talk About It (from One Night Only! Rod Stewart Live at Royal Albert Hall),RodStewartVEVO,2016-08-05T07:00:02Z,"Music video by Rod Stewart performing I Don't Want To Talk About It. (C) 2004 RCA Records, a division of Sony Music ...",[],UCQJ8dGinafM10rIOx5HZsjw,959554500,3713924,0,127757,{},[],{}
12/05/2024,11e4sW-Q4Ns,L2K - Jerusalema  Chorégraphie Officiel.,L2K,2020-07-31T00:29:32Z,Découvrez mon dernier single : https://www.youtube.com/watch?v=bpYh8GSmc18 Médicament | L2K Liens vers les ...,[],UCIMbaLmPW22pxXZASAccFfg,372589104,1448522,0,28653,{},[],{}
12/05/2024,BxFWp5Te6Gw,WESLEY SAFADÃO 2024 ( REPERTÓRIO NOVO 2024 ) CD NOVO - MÚSICAS NOVAS,Música TopTop,2024-05-10T12:00:15Z,Quer nos ajudar? Então não esquece de deixar seu like no vídeo e de se inscrever no nosso canal! Participem de nosso grupo lá ...,[],UC_anvZzRWb5B4VSfq0iFlpw,27919,293,0,4,{},[],{}
12/05/2024,CevxZvSJLk8,Katy Perry - Roar,KatyPerryVEVO,2013-09-05T20:00:22Z,"Katy Perry's new album ""Smile"" out August 28 - http://katy.to/smileID Listen to Katy's new song “Smile”: https://katy.to/smileID Get ...",[],UC-8Q-hLdECwQmaWNwXitYDw,4000603496,16892550,0,783410,{},[],{}
12/05/2024,liIEJu-DrCI,Canção de Cortar o Cabelo - Música Infantil por Bella Lisa Show,Bella e Lucca Show,2023-06-20T22:00:22Z,Bella e Lucca vai Cortar o Cabelo - Música Infantil por Bella Lisa Show Nesse vídeo Bella e Lucca vão cortar o cabelo e se ...,[],UCrxIJOB_71D_xh5xf-KCo6g,24124136,0,0,0,{},[],{}
12/05/2024,dNVvnkMyccI,Sou da LOUD (feat. Gilklan) - Videoclipe Oficial,LOUD,2019-12-14T22:35:13Z,Roupas da LOUD: http://loud.gg Uma realização LOUD e Max Arena Música Sou da LOUD Letra Gilklan Músicos Yoka ...,[],UC7iwNp4GUynlGXvK-6KD0Rw,45063507,2213567,0,81407,{},[],{}
12/05/2024,OPf0YbXqDm0,Mark Ronson - Uptown Funk (Official Video) ft. Bruno Mars,MarkRonsonVEVO,2014-11-19T14:00:18Z,Official Video for Uptown Funk by Mark Ronson ft. Bruno Mars Listen to Mark Ronson: https://MarkRonson.lnk.to/listenYD ...,[],UCmfFGTSsfJVu6CGvL8r75qg,5221880513,21514735,0,614451,{},[],{}
